subject_code,course_number,title_name,credits,contact_hours,cross_listed,dual_listed,repeatable,prerequisites,description,typically_offered,source_url
BUSAD,1020,Business Learning Team Orientation,1.,Lecture 1.,,,,,"A required orientation for all College of Business Students involved with a Business Learning Team. Review of college and university requirements, transfer credits, academic planning, university policies and deadlines and registration procedures. Includes a consideration of various business majors and careers, tools for success in college including writing skills and presentations from employers, alumni and current students.","Fall, Spring",https://catalog.iastate.edu/azcourses/busad/
BUSAD,1030,Orientation,1.,Lecture 1.,,,,,"A required orientation for all College of Business students. Review of college and university requirements, transfer credits, academic planning, university policies and deadlines, and registration procedures. Includes group advising for course selection and registration.","Fall, Spring",https://catalog.iastate.edu/azcourses/busad/
BUSAD,1050,Exploration of Majors & Careers in Business,1.,Lecture 1.,,,,,"Exploration course providing in-depth information and education regarding majors and related careers in business, with the goal for students of making a decision on which business major(s) to pursue. 8 week course. Offered on a satisfactory-fail basis only.","Fall, Spring",https://catalog.iastate.edu/azcourses/busad/
BUSAD,2030,Professional Development in Business,1.,Lecture 1.,,,,Credit or enrollment in BUSAD 1020 or BUSAD 1030,"Designed to develop prepared, professional and engaged students directly aligned with current workplace competencies: individual and team strengths, professional branding, developing and implementing a professional job/internship search, resume and other professional job seeking communications, interviewing, evaluating offers, and networking. Team presentations will be a requirement of this course.",,https://catalog.iastate.edu/azcourses/busad/
BUSAD,2920,CYstarters 2.0 Entrepreneurship Seminar,1.,Lecture 1.,,,True,Instructor Permission for Course,"Advanced study of entrepreneurship and student venture coaching, a continuation of the CYstarters summer accelerator experience. This hands-on course provides student entrepreneurs with the resources and support needed to grow their business. Class will include seminars with successful entrepreneurs and professional service providers, goal setting, a formal pitch presentation, group accountability, and mentoring in an immersive experiential environment. Class participants must have completed the 11-week CYstarters summer accelerator experience through the Pappajohn Center for Entrepreneurship.","Fall, Spring",https://catalog.iastate.edu/azcourses/busad/
BUSAD,3010,Introduction to International Business,3.,Lecture 3.,,,,Sophomore classification,"Foundation for international business theory and practices with an emphasis on understanding the intersection of business, culture, politics, law, and economics. Views from both the United States and countries abroad will be presented.","Fall, Spring",https://catalog.iastate.edu/azcourses/busad/
BUSAD,3910A,Professional Experiential Learning: Domestic Internship,1.,,,,True,Instructor Permission for Course,Supervised work experience in a business related discipline. Offered on a satisfactory-fail basis only.,,https://catalog.iastate.edu/azcourses/busad/
BUSAD,3910B,Professional Experiential Learning: International Internship,1.,,,,True,Instructor Permission for Course,Supervised work experience in a business related discipline. Offered on a satisfactory-fail basis only.,,https://catalog.iastate.edu/azcourses/busad/
BUSAD,3910C,Professional Experiential Learning: Domestic Travel and Study,1.,,,,True,,Supervised travel and study in a business related discipline. Offered on a satisfactory-fail basis only.,,https://catalog.iastate.edu/azcourses/busad/
BUSAD,3910D,Professional Experiential Learning: International Travel and Study,1.,,,,True,,Supervised travel and study in a business related discipline. Offered on a satisfactory-fail basis only.,,https://catalog.iastate.edu/azcourses/busad/
BUSAD,3980,Cooperative Education,Required.,,,,True,Instructor Permission for Course,Required of all cooperative education students engaged in full-time internship/co-op. Students must register for this course prior to commencing each work period. No more than three credits may be taken in addition to BUSAD 3980 during any given semester. Offered on a satisfactory-fail basis only.,,https://catalog.iastate.edu/azcourses/busad/
BUSAD,4030X,Transitioning from College to Career,1.,Lecture 1.,,,,BUSAD 2030 and Senior Standing,"Career readiness for graduating seniors, with emphasis on personal branding, workplace communication, job search strategies, and social capital. Skill development in career mapping, ethical decision-making, and development of a professional launch plan.",Spring,https://catalog.iastate.edu/azcourses/busad/
BUSAD,4900A,Independent Study: International Business,1-3.,,,,True,Instructor Permission for Course,,,https://catalog.iastate.edu/azcourses/busad/
BUSAD,4900C,"Independent Study: Consulting, Investment Banking and Related Industries",3.,"Lecture 1, Laboratory 4.",,,,Instructor Permission for Course,"Application of course learning to solve real-life business problems. Through the combination of significant experiential-learning activities, online academic lectures and readings, and writing assignments, this course will provide students with unique experiences to enhance skills such as formulating problems, structuring and prioritizing problems, synthesizing results, and communicating intuition from complicated analyses.","Fall, Spring, Summer",https://catalog.iastate.edu/azcourses/busad/
BUSAD,4900E,Independent Study: Entrepreneurship,1-3.,,,,True,Instructor Permission for Course,,,https://catalog.iastate.edu/azcourses/busad/
BUSAD,4900G,Independent Study: General,1-3.,,,,True,Instructor Permission for Course,Independent Study.,,https://catalog.iastate.edu/azcourses/busad/
BUSAD,4900H,Independent Study: Honors,1-3.,,,,True,Permission of Instructor; Membership in the University Honors Program,,,https://catalog.iastate.edu/azcourses/busad/
BUSAD,4910,Okoboji Entrepreneurship Institute,1-3.,,,,,,"Advanced study of entrepreneurship that includes a team-based entrepreneurial simulation, seminars with successful entrepreneurs and business community leaders, a formal pitch presentation, and networking and mentoring in an immersive experiential environment. Students must apply and be selected for participation.",,https://catalog.iastate.edu/azcourses/busad/
BUSAD,4950,Executive Analysis and Presentation,3.,Lecture 3.,,,True,Sophomore classification in the Ivy College of Business,"The development of professional skills with the focus on analyzing real business problems and developing strategic solutions for companies' senior management. Hands-on learning and practices through case studies and real-world examples. Key aspects include business issue identification, analysis and problem-solving, actional solution evaluation, proposal development, and presentation to senior executives.",Fall,https://catalog.iastate.edu/azcourses/busad/
BUSAD,5010,Strategic Management,2.,Lecture 2.,,,,Admission to the Graduate Program in Seed Technology and Business or Permission of Instructor,Critical analysis of current practice and case studies in strategic management with an emphasis on integrative decision making. Strategy formulation and implementation will be investigated in the context of complex business environments.,,https://catalog.iastate.edu/azcourses/busad/
BUSAD,5020,Quantitative Business Analysis and Decision Making,3.,Lecture 3.,,,,Ivy College of Business Graduate Student or instructor permission,"Introduction to the sources and statistical analysis of data as well as optimization models for use in making business decisions. Data collection, descriptive and inferential statistics including hypothesis testing, analysis of variance, multiple regression, linear programming and simulation.",,https://catalog.iastate.edu/azcourses/busad/
BUSAD,5030,Information Systems,2.,Lecture 2.,,,,Admission to the Graduate Program in Seed Technology and Business or Permission of Instructor,"Introduction to a broad variety of information systems (IS) topics, including current and emerging developments in information technology (IT), IT strategy in the context of corporate strategy, and IS planning and development of enterprise architectures. Cases, reading, and discussions highlight the techniques and tactics used by managers to cope with strategic issues within an increasingly technical and data-driven competitive environment.",,https://catalog.iastate.edu/azcourses/busad/
BUSAD,5040,Marketing and Logistics,3.,Lecture 3.,,,,Admission to the Graduate Program in Seed Technology and Business or Permission of Instructor,"Integration of the business functions concerned with the marketing and movement of goods along the supply chain with the primary goal of creating value for the ultimate customer. Coordination of marketing, production, and logistics activities within the firm and with outside suppliers and customers in the supply chain.",,https://catalog.iastate.edu/azcourses/busad/
BUSAD,5070,Organizational Behavior,2.,Lecture 2.,,,,Admission to the Graduate Program in Seed Technology and Business or Permission of Instructor,"Understanding human behavior in organizations, and the nature of organizations from a managerial perspective. Special emphasis on how individual differences, such as perceptions, personality, and motivation, influence individual and group behavior in organizations and on how behavior can be influenced by job design, leadership, groups, and the structure of organizations.",,https://catalog.iastate.edu/azcourses/busad/
BUSAD,5080,Accounting and Finance,3.,Lecture 3.,,,,Admission to the Graduate Program in Seed Technology and Business or Permission of Instructor,"Survey of fundamental topics in accounting and finance. Financial statement reporting and analysis for agriculture firms, corporate governance issues related to financial reporting, (e.g., Sarbanes-Oxley). Basic tools and techniques used in financial management, including stock and bond valuation. How to assess and use capital budgeting methods to evaluate proposed firm investments.",,https://catalog.iastate.edu/azcourses/busad/
BUSAD,5090,"International Seed Business Practices, Policies, & Regulation",3.,Lecture 3.,,,,Admission to the Graduate Program in Seed Technology and Business or Permission of Instructor,"Cultural, financial, economic, political, legal/regulatory environments shaping an organization's international business strategy. Topics include entry (and repatriation) of people, firms, goods, services, and capital. Special attention to the institutions of seed regulation and policy. Ethical issues facing managers operating in an international context.",,https://catalog.iastate.edu/azcourses/busad/
BUSAD,5900,Special Topics in Business,3.,,,,True,Department Permission for Course,A special topics course covering contemporary issues in business. Topics vary by semester.,,https://catalog.iastate.edu/azcourses/busad/
BUSAD,5910,Professional Experiential Learning,1-5.,,,,True,Permission of Instructor; Permission of Department Chair,Academically supervised travel and/or work experiences in a business related discipline.,,https://catalog.iastate.edu/azcourses/busad/
BUSAD,5920,MBA Professional Skills Development,1.5.,Lecture 1.5.,,,,Enrolled in MBA program,"Provides first-year MBA students with tools necessary to develop and implement a successful internship and career search, and to develop professional skills critical for success in the competitive business environment. Topics include career search strategy, resume and cover letter development, interviewing, strategic networking, salary negotiation, impression management, team skills development, presentation skills development, and business etiquette. Required for all full-time MBA students.",,https://catalog.iastate.edu/azcourses/busad/
BUSAD,5930,Business Specialty Masters Seminar,Required.,Lecture 1.,,,,Ivy College of Business Graduate Student,"Provides incoming specialty masters students in the Ivy College of Business with an introduction to college and program resources in the areas of student services, career services, and program support. Required for all full-time residential Ivy masters students. Offered on a satisfactory-fail basis only.","Fall, Spring",https://catalog.iastate.edu/azcourses/busad/
BUSAD,5940,MBA Professional Skills Development II,1.5.,Lecture 1.5.,,,,BUSAD 5920,"A second course designed to improve the professional skills of first-year MBA students. Emphasis on building effective communications and networking skills. Students will participate in professional workshops, company visits, executive speaker seminars, service learning projects, business case competitions, and related activities.",,https://catalog.iastate.edu/azcourses/busad/
BUSAD,5950X,Executive Analysis and Presentation,3.,Lecture 3.,,,,Ivy College of Business Graduate Student,"This is a hands-on course where students analyze real business problems and develop strategic recommendations for senior management. Through case studies and real-world examples, students will hone their analytical skills, learn to identify key issues, evaluate various stakeholders' perspectives, and propose actionable solutions that align with organizational goals. This course prepares students for leadership roles, equipping them with critical thinking and problem-solving skills necessary to significantly impact the business world.","Fall, Spring",https://catalog.iastate.edu/azcourses/busad/
BUSAD,5960,Professional Development and Executive Communications,3.,Lecture 3.,,,,Ivy College of Business Graduate Student,"Refine executive business core competencies through professional development topics, a speaker series and individualized coaching. The course is designed to enhance existing professional communication skill sets for emerging leaders. Various communication focuses may include: executive presentations, communication strategies, and other topics relevant to working professionals.",Summer,https://catalog.iastate.edu/azcourses/busad/
BUSAD,5970,Part-Time Cooperative Education,Required.,,,,True,Department Permission for Course,Career development growth through a process of analyzing and reporting experiential learning endeavors. Students may complete this course during or pursuant to completion of a summer- or semester-length internship or co-op experience. International students must have completed two graduate course semesters at Iowa State University before taking the course. Offered on a satisfactory-fail basis only.,,https://catalog.iastate.edu/azcourses/busad/
BUSAD,5980,Cooperative Education,Required.,,,,True,Department Permission for Course,Professional work experience. Students must register for this course prior to commencing work. Offered on a satisfactory-fail basis only.,,https://catalog.iastate.edu/azcourses/busad/
BUSAD,5990A,Creative Component: Accounting,3.,,,,True,Department Permission for Course,Preparation and writing of creative component.,,https://catalog.iastate.edu/azcourses/busad/
BUSAD,5990C,Creative Component: Finance,3.,,,,True,Department Permission for Course,Preparation and writing of creative component.,,https://catalog.iastate.edu/azcourses/busad/
BUSAD,5990E,Creative Component: Management,3.,,,,True,Department Permission for Course,Preparation and writing of creative component.,,https://catalog.iastate.edu/azcourses/busad/
BUSAD,5990F,Creative Component: Marketing,3.,,,,True,Instructor Permission for Course,Preparation and writing of creative component.,,https://catalog.iastate.edu/azcourses/busad/
BUSAD,5990I,Creative Component: Agribusiness,3.,,,,True,Department Permission for Course,Preparation and writing of creative component.,,https://catalog.iastate.edu/azcourses/busad/
BUSAD,5990J,Creative Component: General Business,3.,,,,True,Department Permission for Course,Preparation and writing of creative component.,,https://catalog.iastate.edu/azcourses/busad/
BUSAD,5990K,Creative Component: Management Information Systems,3.,,,,True,Department Permission for Course,Preparation and writing of creative component.,,https://catalog.iastate.edu/azcourses/busad/
BUSAD,5990L,Creative Component: Supply Chain Management,3.,,,,True,Department Permission for Course,Preparation and writing of creative component.,,https://catalog.iastate.edu/azcourses/busad/
BUSAD,6440,Business Research Methods,3.,Lecture 3.,,,,In PhD program in the College of Business or Permission of Instructor,A survey of the wide variety of research methods used in business. Methods will be presented and discussed with emphasis on applicability in different research situations.,Fall,https://catalog.iastate.edu/azcourses/busad/
BUSAD,6990,Research,3-6.,,,,True,Ivy College of Business PhD student or instructor permission,Research.,"Fall, Spring, Summer",https://catalog.iastate.edu/azcourses/busad/
