subject_code,course_number,title_name,credits,contact_hours,cross_listed,dual_listed,repeatable,prerequisites,description,typically_offered,source_url
CDEV,5020,Community and Natural Resource Management,3.,Lecture 3.,,,,Graduate Standing or Permission of Instructor,"Detailed introduction to community resource management. Theoretical frameworks, methodological investigation, applied practices. Enhancement of ability of community development professionals to work with communities to plan, develop and monitor conversation and development of natural resources with multiple functions.",,https://catalog.iastate.edu/azcourses/c_dev/
CDEV,5030,Principles and Strategies of Community Change,3.,Lecture 3.,,,,Graduate Standing or Permission of Instructor,"Analysis of principles and practices of community change and development. Use of case studies to relate community development approaches to conceptual models from diverse disciplines. Exploration of professional practice principles, and student construction of their personal framework for practicing community development.",,https://catalog.iastate.edu/azcourses/c_dev/
CDEV,5040,Community Analysis: Introduction to Methods,3.,Lecture 3.,,,,Graduate Standing or Permission of Instructor,"Introduction to research methods relevant to community development. Formulate and begin a research effort, methods of data collection and how conceptual frameworks are used to develop the questions and analyze data. Emphasis on strategies for reporting findings and applying findings in community action and methods of evaluating the entire research process. Significant attention paid to issues of research ethics and inclusiveness.",,https://catalog.iastate.edu/azcourses/c_dev/
CDEV,5050,Organizing for Community Change,3.,Lecture 3.,,,,Graduate Standing or Permission of Instructor,"Examines role of civil society in community planning efforts. Comparative approach to planning theories and approaches. Focus on change within communities and the roles of government, planners, and citizens in reacting to or shaping change. Dimensions of social capital and the context of change covered.",,https://catalog.iastate.edu/azcourses/c_dev/
CDEV,5060,Community and Regional Economic Analysis I,3.,Lecture 3.,,,,Graduate Standing or Permission of Instructor,"Introduction to concepts of communities and regions, theories of economic growth, drivers of economic growth, the economic base of a community, sources of growth or decline in the community, roles of local government and institutions, and analytical tools. Strategies for local economic development will also be explored.",,https://catalog.iastate.edu/azcourses/c_dev/
CDEV,5070,Introduction to Native Communities,3.,Lecture 3.,,,,Graduate Standing or Permission of Instructor,"A base knowledge course. For students currently working within, in partnership with, or considering working with Native communities. Basic understanding within the context of community development of the diversity of the tribal structures and cultures and the unique history and jurisdictional considerations of these nations. Working with tribes, Federal and Indian relations, and governance and cultural issues.",,https://catalog.iastate.edu/azcourses/c_dev/
CDEV,5080,Ecological Economics,3.,Lecture 3.,,,,Graduate Standing or Permission of Instructor,"Approaches economy and community by looking at the inherent interdependence, jointness, and potential complimentarity between ecology and economy (utility) of a place.",,https://catalog.iastate.edu/azcourses/c_dev/
CDEV,5090,Building Native Community and Economic Capacity,3.,Lecture 3.,,,,Graduate Standing or Permission of Instructor,"Focus on non-western approaches to helping Native communities build their capacity. Students will learn to take a participatory, culture-centered, and strength-based approach to development.",,https://catalog.iastate.edu/azcourses/c_dev/
CDEV,5100,Indian Country Agriculture and Natural Resources,3.,Lecture 3.,,,,Graduate Standing or Permission of Instructor,"Introduction to the historical and contemporary issues related to natural resource management on Native American lands. Philosophical and economic arguments concerning natural resource conservation, preservation and extraction will be explored.",,https://catalog.iastate.edu/azcourses/c_dev/
CDEV,5120,Sustainable Communities,3.,Lecture 3.,,,,Graduate Standing or Permission of Instructor,"Students will learn the conceptual relationships among Community and Sustainable Development and Sustainable Communities and examine the social, environmental, and economic aspects of sustainable communities. The course includes analysis of public policy impacts on community sustainability, practical actions for enhancing sustainability, and changing power dynamics and reward structures involved in incorporating sustainability into Community Development.",,https://catalog.iastate.edu/azcourses/c_dev/
CDEV,5130,Economic Development Strategies and Programs,3.,Lecture 3.,,,,Graduate Standing or Permission of Instructor,"Course explores theories of local economic development and addresses the development issues faced by communities in the 21st century. Students will understand and apply concepts from economic development planning, economic analysis, business development, human resource development, community-based development, and high-technology development.",,https://catalog.iastate.edu/azcourses/c_dev/
CDEV,5200,Community Development Orientation,2.,Lecture 2.,,,,Graduate Standing or Permission of Instructor,"Introduction to the Community Development program. Focus on on-line delivery methods, graduate level research and writing, technology skills.",,https://catalog.iastate.edu/azcourses/c_dev/
CDEV,5210,Housing and Development,3.,Lecture 3.,,,,Graduate Standing or Permission of Instructor,"Review and evaluation of historical and current housing issues, production, and financial systems, including consideration of racial, ethnic, income, and gender issues as they relate to the role of housing developments and programs in community development.",Spring,https://catalog.iastate.edu/azcourses/c_dev/
CDEV,5220,Community Leadership and Capacity Building,3.,Lecture 3.,,,,Graduate Standing or Permission of Instructor,Defining leadership and applying it to the workplace. Understanding of potential link between leadership and community capacity. Identifying strategies for leadership development in communities.,,https://catalog.iastate.edu/azcourses/c_dev/
CDEV,5230,Grantwriting for Community Development Professionals,3.,Lecture 3.,,,,Graduate Standing or Permission of Instructor,"Basic Grant Development and Management will introduce students to the grant-getting process and provide an overview of what happens after a project is funded. The following topics will be covered: researching funding sources, generating cutting edge ideas, assessing needs, planning a project, establishing credibility, formulating a sustainable budget, designing an evaluation plan, managing the funded project, and disseminating project results.",,https://catalog.iastate.edu/azcourses/c_dev/
CDEV,5240,Non-Profit Management in Community Development,3.,Lecture 3.,,,,Graduate Standing or Permission of Instructor,"Understanding of how non-profit organizations are run in order that they may participate more fully in community development efforts. Learning skills necessary to assist organizations to manage community development projects and programs, such as, budgeting, planning, personnel, facilities, volunteer management, and fundraising.",,https://catalog.iastate.edu/azcourses/c_dev/
CDEV,5250,Role of Tribal Colleges in Economic Development,3.,Lecture 3.,,,,Graduate Standing or Permission of Instructor,Focus on role of tribally-chartered colleges and universities in economic development within Native communities. Social capital analytic framework to examine and evaluate tribal college model of economic development.,,https://catalog.iastate.edu/azcourses/c_dev/
CDEV,5260,Immigration and Community Inclusion,3.,Lecture 3.,,,,Graduate Standing or Permission of Instructor,"Mechanisms for community inclusion and exclusion in relation to immigration will be examined. Aspects of ethnicity, religion, occupation and transnationalism are addressed in terms of community mechanism for incorporating immigrants as community assets.",,https://catalog.iastate.edu/azcourses/c_dev/
CDEV,5270,Public and Non-Profit Budgeting,3.,Lecture 3.,,,,Graduate Standing or Permission of Instructor,"Introduction to the fundamental theories and practices of budgeting in the public and non-profit sectors. Topics covered include overview of budgeting and budget reform, taxation, expenditures, budget preparation and adoption, budget implementation, and performance budgeting.",Summer,https://catalog.iastate.edu/azcourses/c_dev/
CDEV,5280,Evaluation of Organizations and Programs,3.,Lecture 3.,,,,Graduate Standing or Permission of Instructor,"Introduction to the philosophy, techniques, and methodologies of organizational and program evaluation. Overview of program evaluation and theory, techniques to evaluate program processes and performance, evaluation designs, assessing program efficiency, models to diagnose organizations, and methods to assess organizational performance.",,https://catalog.iastate.edu/azcourses/c_dev/
CDEV,5300,Toward Ethical Engagement,3.,Lecture 3.,,,,Graduate Standing or Permission of Instructor,Understanding what ethics are and identify ethical dimensions of a problem. Ability to employ ethical analysis and engagement strategies in public problem-solving.,,https://catalog.iastate.edu/azcourses/c_dev/
CDEV,5320,Community and Regional Economic Analysis II,3.,Lecture 3.,,,,Graduate Standing or Permission of Instructor,Substantive grounding in the theories and practice of measuring community economic dynamics; build solid foundation skills for applied community economic analysis.,,https://catalog.iastate.edu/azcourses/c_dev/
CDEV,5900,Special Topics in Community Development,1-3.,,,,True,Graduate Standing or Permission of Instructor,"Special topics in Community Development. Independent Study, must get instructor approval.","Fall, Spring, Summer",https://catalog.iastate.edu/azcourses/c_dev/
CDEV,5990,Creative Component,1-30.,,,,True,Graduate Standing or Permission of Instructor,Students work with major professor to conduct research and carry out work on their creative component. Instructor permission required.,"Fall, Spring, Summer",https://catalog.iastate.edu/azcourses/c_dev/
CDEV,6990,Thesis Research,1-6.,,,,True,,Thesis Research.,"Fall, Spring, Summer",https://catalog.iastate.edu/azcourses/c_dev/
