subject_code,course_number,title_name,credits,contact_hours,cross_listed,dual_listed,repeatable,prerequisites,description,typically_offered,source_url
CHEM,5620,Fundamentals of Atomic and Molecular Quantum Mechanics,3.,Lecture 3.,,,,Graduate Standing or Permission of Instructor,"Variational method, many electron atoms; addition of angular momentum, self-consistent field method for open and closed shells, linear combinations of atomic orbitals, origin of chemical bonding, many-electron diatomic and polyatomic molecules, treatments of electron correlation, approximation methods.",Spring,https://catalog.iastate.edu/azcourses/chem/
CHEM,5630,Statistical Mechanics,3.,Lecture 3.,,,,Graduate Standing or Permission of Instructor,"Microscopic and macroscopic properties, laws of thermodynamics, ensembles and distribution functions, applications to gases, solids, and chemical equilibrium.",Spring,https://catalog.iastate.edu/azcourses/chem/
CHEM,5640,Molecular Spectroscopy and Structure,3.,Lecture 3.,,,,Graduate Standing or Permission of Instructor,"Maxwell's field equations, interaction of light with matter including time-dependent perturbation theory, microwave, vibrational (infra-red, Raman) and electronic spectroscopies, symmetry derived selection rules, special lineshapes and introduction to nonlinear and coherent laser spectroscopies. Offered even-numbered years.",Spring,https://catalog.iastate.edu/azcourses/chem/
CHEM,5710,Solid-State Chemistry,2.,Lecture 2.,,,,Graduate Standing or Permission of Instructor,"Structural principles, synthetic strategies, analytical methods, and chemical bonding issues applied to solids. Atomic packings and networks, short-range vs. long-range order, defects; phase diagrams, reactive fluxes, chemical transport; diffraction, spectroscopy; energy bands and their bonding interpretations. Offered even-numbered years.",Spring,https://catalog.iastate.edu/azcourses/chem/
CHEM,5720,Spectrometric Identification of Organic Compounds,3.,"Lecture 2, Laboratory 3.",,,,Graduate Standing or Permission of Instructor,"Principles of infrared, ultraviolet, nuclear magnetic resonance, and mass spectroscopy as applied to organic chemistry.",Fall,https://catalog.iastate.edu/azcourses/chem/
CHEM,5730,Nanochemistry,2.,Lecture 2.,,,,Graduate Standing or Permission of Instructor,"Synthesis, characterization, properties and applications of nanoscale materials (≈ 0.5-500 nm), relationship with molecular, meso and bulk compounds. Chemistry of solid surfaces, zero-, one- and two- dimensional (0D, 1D, 2D) nanostructures , semiconductor quantum dots, plasmonic nanoparticles, carbon nanomaterials, porous nanomaterials, potential health and safety impacts. Offered odd-numbered years.",Spring,https://catalog.iastate.edu/azcourses/chem/
CHEM,5740,Organometallic Chemistry of the Transition Metals,2.,Lecture 2.,,,,Graduate Standing or Permission of Instructor,"Transition metal complexes with ligands such as cyclopentadienyl, olefins, acetylenes, benzenes, and carbon monoxide. Coverage of structure, bonding, reactivity, fundamental mechanisms, and homogeneous catalysis. Offered odd-numbered years.",Spring,https://catalog.iastate.edu/azcourses/chem/
CHEM,5750,Diffraction and Crystal Structure,3.,Lecture 3.,,,,Graduate Standing or Permission of Instructor,"Fundamentals of structure determination for single crystals emphasizing symmetry, diffraction geometry and instrumentation, sample preparation and handling, data collection strategies, methods of structure solution and refinement, presentation of results, and crystallographic databases. Offered odd-numbered years.",Spring,https://catalog.iastate.edu/azcourses/chem/
CHEM,5760,Surface Chemistry,3.,Lecture 3.,,,,Graduate Standing or Permission of Instructor,"Gas-surface interactions and techniques of characterization. Idealized surface lattices, surface tension, Wulff plots, work function, adsorbate-adsorbate interactions, 2D phase diagrams, diffusion, thin film growth, adsorption and desorption mechanisms/energetics/kinetics, adsorption isotherms, vacuum techniques, electron- and ion-based spectroscopies for surface analysis (including AES, FIM, XPS, UPS, EXAFS, EELS, SIMS, LEED and STM). Offered even-numbered years.",Fall,https://catalog.iastate.edu/azcourses/chem/
CHEM,5770,Mass Spectrometry,3.,Lecture 3.,,,,Graduate Standing or Permission of Instructor,"Basic physics, instrumentation, chemical and biological applications of mass spectrometry.",Spring,https://catalog.iastate.edu/azcourses/chem/
CHEM,5780,Chemical Kinetics and Mechanisms,2.,Lecture 2.,,,,Graduate Standing or Permission of Instructor,"Rates and mechanisms; reversible, consecutive, and competing reactions; chain mechanisms; kinetic isotope effects; very rapid reactions; acid-base catalysis, theories of unimolecular reactions; transition state and Marcus theories. Offered even-numbered years.",Spring,https://catalog.iastate.edu/azcourses/chem/
CHEM,5790,Introduction to Research in Chemistry,Required.,Lecture 1.,,,,Graduate Standing or Permission of Instructor,Introduction to the various areas of research in chemistry at Iowa State University.,Fall,https://catalog.iastate.edu/azcourses/chem/
CHEM,5800,Introduction to Computational Quantum Chemistry,3.,Lecture 3.,,,,Graduate Standing or Permission of Instructor,"Basic principles of quantum mechanics, schrodinger equation. Hartree-Fock/molecular orbital theory, introduction to group theory, introduction to modern methods of computational chemistry; applications include molecular structure, potential energy surfaces and their relation to chemical reactions; molecular spectroscopy, photochemistry, solvent effects and surface chemistry. Offered odd-numbered years.",Fall,https://catalog.iastate.edu/azcourses/chem/
CHEM,5830,Chemical Group Theory,1.,Lecture 1.,,,,Graduate Standing or Permission of Instructor,"Basic concepts and theorems, representation theory; point groups, molecular orbitals, molecular states, molecular vibrations, rotation group and angular momenta; space groups and crystals; permutation group, antisymmetry, and spin states.",Fall,https://catalog.iastate.edu/azcourses/chem/
CHEM,5990,Nonthesis Research,1-30.,,,,True,Instructor Permission for Course,,,https://catalog.iastate.edu/azcourses/chem/
CHEM,6000,Seminar in Inorganic Chemistry,1.,Lecture 1.,,,True,,,"Fall, Spring",https://catalog.iastate.edu/azcourses/chem/
CHEM,6010,Selected Topics in Inorganic Chemistry,1-2.,Lecture 2.,,,True,,Topics such as molecular structure and bonding; organometallic compounds; physical techniques of structure determination; nonaqueous solutions; Zintl phases; transition-metal oxides; free-radical reactions; electron transfer reactions; metal-metal bonding; and bioinorganic chemistry of nucleic acids.,"Fall, Spring",https://catalog.iastate.edu/azcourses/chem/
CHEM,6110,Seminar in Analytical Chemistry,1.,Lecture 1.,,,True,,,"Fall, Spring",https://catalog.iastate.edu/azcourses/chem/
CHEM,6190,Special Topics in Analytical Chemistry,1-2.,Lecture 2.,,,True,,"Raman spectroscopy, sensors, spectroelectrochemistry, capillary electrophoresis, analytical plasmas, chemometrics and bioanalytical chemistry.","Fall, Spring",https://catalog.iastate.edu/azcourses/chem/
CHEM,6310,Seminar in Organic Chemistry,1.,Lecture 1.,,,True,,,"Fall, Spring",https://catalog.iastate.edu/azcourses/chem/
CHEM,6320,Selected Topics in Organic Chemistry,1-2.,Lecture 2.,,,True,,"Topics of current interest in organic chemistry such as spectroscopy, physical organic chemistry, photochemistry, organometallic chemistry, mechanisms of oxidations and reductions, modern organic synthesis, reactive intermediates, bioorganic chemistry, and polymers.","Fall, Spring",https://catalog.iastate.edu/azcourses/chem/
CHEM,6600,Seminar in Physical Chemistry,1.,Lecture 1.,,,True,,,Spring,https://catalog.iastate.edu/azcourses/chem/
CHEM,6670,Special Topics in Physical Chemistry,1-2.,Lecture 2.,,,,,Advanced and recent developments in physical chemistry are selected for each offering.,"Fall, Spring",https://catalog.iastate.edu/azcourses/chem/
CHEM,6990,Research,1-30.,,,,True,,,,https://catalog.iastate.edu/azcourses/chem/
