subject_code,course_number,title_name,credits,contact_hours,cross_listed,dual_listed,repeatable,prerequisites,description,typically_offered,source_url
CRP,2010,The North American Metropolis,3.,"Lecture 2, Laboratory 2.",,,,,Examination of the evolution of American urban centers from the colonial era to the present. Considers the demographic changes and social movements underway in urban America and explores how an understanding of the history of cities provides us with knowledge that we can use to improve our cities today.,"Fall, Spring",https://catalog.iastate.edu/azcourses/c_r_p/
CRP,2110,Digital Design Methods for Landscape Architecture,3.,Lecture 3.,,,,,"Foundational knowledge and basic skills in 2D, 3D, and 4D computer applications used for design development and communication, with emphasis on 3D modeling and workflow interoperability.",Spring,https://catalog.iastate.edu/azcourses/c_r_p/
CRP,2510,Fundamentals of Geographic Information Systems,3.,"Lecture 2, Laboratory 2.",,,,,"Fundamentals of the concepts, models, functions and operations of Geographic Information Systems (GIS). Principals of spatial problems, spatial questions and hypotheses and their solutions based on spatial data, GIS tools and techniques. Integration of concepts and applications through lectures and facilitated labs. Applications from a variety of areas including design; physical, social, and human science; engineering; agriculture; business and medicine, landscape architecture, architecture, urban planning, geology, forestry, biology, and ecology.",Fall,https://catalog.iastate.edu/azcourses/c_r_p/
CRP,2910,World Cities and Globalization,3.,Lecture 3.,,,,,"World cities and globalization in developed and developing countries. Topics include globalization, world cities and regions, uneven economic development, the international division of labor, multinational corporations, international environmentalism, tourism, popular culture and place-based identity. Meets International Perspectives Requirement.","Fall, Spring",https://catalog.iastate.edu/azcourses/c_r_p/
CRP,2930,Environmental Planning,3.,"Lecture 2, Laboratory 2.",,,,,"Comprehensive overview of the field of environmental relationships and the efforts being made to organize, control, and coordinate environmental, aesthetic, and cultural characteristics of land, air, and water.","Fall, Spring",https://catalog.iastate.edu/azcourses/c_r_p/
CRP,3010,Urban Analytical Methods,4.,"Lecture 3, Studio 2.",,,,STAT 1010,"An introduction to the methods and analytical techniques used by planners to study community change. Course includes identification of key sources of planning information and data. Students learn to use quantitative methods for analysis of population, land use, economic and transportation data. Students learn to apply basic analytic methods to community problems and learn the art of effective written, graphic, and oral presentation of data.",Spring,https://catalog.iastate.edu/azcourses/c_r_p/
CRP,3020,Plan Analysis and the Development Process,3.,Lecture 3.,,,,CRP 3010,"Course introduces how to read and understand different types of plans, including land use plans, comprehensive plans, transportation plans, parks and recreation plans, housing plans, neighborhood plans, downtown plans, climate action plans. Students will learn plan analysis, staff report writing, presentations to the public and elected officials, and the development proposal process.",,https://catalog.iastate.edu/azcourses/c_r_p/
CRP,3200,Urban Geography,3.,Lecture 3.,,,,,"An introduction to urban geography. Study of urban centers, including people and infrastructure. Investigation of the origin and evolution of urban areas and the processes that shape urban change. Topics include urban form, and the social, economic, political, cultural, and institutional factors that shape cities.","Fall, Spring",https://catalog.iastate.edu/azcourses/c_r_p/
CRP,3250,Introduction to Housing,3.,Lecture 3.,,,,,Introduction to issues related to the topic of housing in the United States. Particular focus on the social and spatial segmentation of housing in the U.S. and the role of policy in housing production and regulation. Meets U.S. Cultures and Communities Requirement.,Spring,https://catalog.iastate.edu/azcourses/c_r_p/
CRP,3300,Practicum,1-3.,,,,True,Major in CRP,"Structured work experience under close supervision of a professional planner. Practical planning experience; relationships between theory and practice, professional responsibilities, and the scope of various planning roles. Offered on a satisfactory-fail basis only.","Fall, Spring, Summer",https://catalog.iastate.edu/azcourses/c_r_p/
CRP,3310,Professional Practice Seminar,2.,Lecture 2.,,,,CRP 3010 and Junior classification,"Preparation for working as a planning professional; development of resume and portfolio; discussion of professional ethics and expectations of employers and clients; presentations from planning professionals, and discussion of the range of career choices within the planning profession.",Fall,https://catalog.iastate.edu/azcourses/c_r_p/
CRP,3510,Geospatial Analysis and Visualization,3.,"Lecture 2, Laboratory 2.",,,,CRP 2510,"Intermediate GIS course for students who are interested in learning advanced functions and operations of Geographic Information Systems. Principles of spatial problem types and solutions, geographical concepts and tools and techniques will be shared during lecture and several ESRI ArcGIS Pro software components will be used in a facilitated lab setting. Emphasis will be on regional planning and transportation studies, as well as environmental, social and sustainable practices and related applications. Latest GIS applications will be integrated in the coursework to allow visualizing city plans and projects in one place for collaboration among stakeholders.","Fall, Spring",https://catalog.iastate.edu/azcourses/c_r_p/
CRP,3760,"Rural, Urban and Regional Economics",3.,Lecture 3.,,,,ECON 1010,"Firm location with respect to regional resources, transport, scale economies, externalities, and policies. Measures of local comparative advantage and specialization. Spatial markets. Population location considering jobs, wages, commuting, and local amenities. Business, residential, and farm land use and value. Migration. Other topics may include market failure, regulation, the product cycle, theories of rural and urban development, developmental policy, firm recruiting, local public goods and public finance, schools, poverty, segregation, and crime.",,https://catalog.iastate.edu/azcourses/c_r_p/
CRP,3830,Theory of the Planning Process,3.,Lecture 3.,,,,Junior classification,"The nature of planning and its relation to social and economic planning; levels of planning, place of planning in decision making; steps in the planning process, uses and limitation of knowledge in planning, relation of facts and values.",Fall,https://catalog.iastate.edu/azcourses/c_r_p/
CRP,3910,Field Travel,1-2.,,,,True,Major in CRP,Observation of professional practice and community or regional problems and issues. Offered on a satisfactory-fail basis only.,"Fall, Spring",https://catalog.iastate.edu/azcourses/c_r_p/
CRP,4100,Professional Work Experience,Required.,,,,True,Instructor Permission for Course,Approved professional work experience.,"Fall, Spring, Summer",https://catalog.iastate.edu/azcourses/c_r_p/
CRP,4160,Urban Design and Practice,6.,,,,,CRP 3010,Principles of urban design and their application to residential and commercial development in studio projects.,Spring,https://catalog.iastate.edu/azcourses/c_r_p/
CRP,4170,Urban Revitalization,3.,Lecture 3.,,,,Junior classification,"Planning methods available to further revitalization and preservation efforts, with particular attention to housing and neighborhoods. Relationship between neighborhood change and urban development process; public policy implications.",Spring,https://catalog.iastate.edu/azcourses/c_r_p/
CRP,4210,Financing Historic Preservation Projects,3.,Lecture 3.,,,,,Investigation of the financial tools and incentives used to promote the rehabilitation and redevelopment of historic buildings and neighborhoods in cities and towns. Study of broader economic and social impacts on communities. Examinations of completed preservation projects around the United States.,Fall,https://catalog.iastate.edu/azcourses/c_r_p/
CRP,4290,Planning in Developing Countries,3.,Lecture 3.,,,,Junior classification,"Introduction to issues in planning and governance in developing countries. Problems and strategies may include population movement and change, economic globalization, rural development, urban growth, sustainable development, and housing.","Fall, Spring",https://catalog.iastate.edu/azcourses/c_r_p/
CRP,4320,Community Planning Studio,4-6.,,,,,"(CRP 2010, CRP 3010, and CRP 3830) OR Permission of Instructor",Integration of planning methods and theory in dealing with a community planning problem. Analysis of problem and formulation of strategies for implementation. Preparation of a community planning report.,"Fall, Spring",https://catalog.iastate.edu/azcourses/c_r_p/
CRP,4350,Planning in Small Towns,3.,Lecture 3.,,,,Junior classification,Contemporary planning problems in small towns and the design of viable strategies to enhance their social and economic position in today's society.,Fall,https://catalog.iastate.edu/azcourses/c_r_p/
CRP,4360,Community Economic Development,3.,Lecture 3.,,,,,The nature and process of economic development in the context of community development. Recent changes and trends and their implications for local and regional development. Selected case studies and applications. Contemporary community economic development issues. Offered odd-numbered years.,Fall,https://catalog.iastate.edu/azcourses/c_r_p/
CRP,4370,Public Participation in Planning,3.,Lecture 3.,,,,,"Rationale and need for public participation in community planning and development. Techniques used to garner participation, and the ability to integrate techniques into a broader participatory process. Techniques covered will include public hearings, public meetings, social action construct, advisory committees, scenario building, social media and asset mapping. Students will also work with a community to demonstrate skills learned.",Spring,https://catalog.iastate.edu/azcourses/c_r_p/
CRP,4420,Site Development,3.,Lecture 3.,,,,,"Introduction to site development including site review. Studio project integrating concept, finance, selection, analysis, and design.",Spring,https://catalog.iastate.edu/azcourses/c_r_p/
CRP,4450,Transportation Policy and Planning,3.,Lecture 3.,,,,Junior classification,"Comprehensive overview of key policy issues related to transportation planning and investment in the United States and abroad. Policy issues explored include safety, environmental impact, sustainable communities, and economic development. Policy analysis and planning are studied in conjunction with each policy issue explored. Issues of concern to state, metropolitan, and local governments.",Fall,https://catalog.iastate.edu/azcourses/c_r_p/
CRP,4490,Geodesign: Planning for Sustainable Futures,3.,Lecture 3.,,,,CRP 2510,"Geodesign combines design creativity with scientific thinking based on spatial data. Special focus on sustainable development of future neighborhoods, communities, cities and/or countries. Students learn the geodesign process and implement a set of techniques and technologies that enable project conceptualization, data collection and visualization, spatial analysis, design creation, impact evaluation and stakeholder participation. Final project involves developing cases for analysis using GIS software.",,https://catalog.iastate.edu/azcourses/c_r_p/
CRP,4510,Introduction to Geographic Information Systems,3.,,,,,,"Introduction to geographic information systems, including discussions of GIS hardware, software, data structures, data acquisition, data conversion, data presentation, analytical techniques, and implementation procedures. Laboratory emphasizes practical applications and uses of GIS.","Fall, Spring, Summer",https://catalog.iastate.edu/azcourses/c_r_p/
CRP,4520,Geographic Data Management and Planning Analysis,3.,,,,,CRP 3510,"Extensive coverage of geo-relational database concept and design, GIS database creation and maintenance, geographic data manipulation and analysis. GIS output generation and geographic data presentation. Laboratory emphasizes practical applications and uses of GIS.","Fall, Spring",https://catalog.iastate.edu/azcourses/c_r_p/
CRP,4540,Fundamentals of Remote Sensing and Spatial Analysis,3.,Lecture 3.,,,,CRP 3510 or AGRON 2700 or NREM 3450 or GEOL 4520 or LA 3020 or CRP 5510 or GEOL 5520,"Introduction to image processing techniques needed for analysis of optical remote sensing imagery, including filtering, enhancement, and classification. Analysis of elevation surfaces, hydrology, distance, overlays and visual programming with Model Builder. Practical applications in a variety of topics to understand how to analyze imagery.",Spring,https://catalog.iastate.edu/azcourses/c_r_p/
CRP,4550,Smart and Sustainable Cities,3.,Lecture 3.,,,,,"Introduction to concepts of smart and sustainable cities. Study of novel technologies for smart and sustainable cities, including sustainable energy, innovative tools for citizens' engagement, improved safety, smart mobility, and happy living. Examples of national and international smart cities. Students may gain experience with ArcGIS Online, ArcUrban and/or other emerging software.",,https://catalog.iastate.edu/azcourses/c_r_p/
CRP,4560,GIS Programming and Automation,3.,Lecture 3.,,,,CRP 3510 or AGRON 2700 or NREM 3450 or GEOL 4520 or LA 3020 or CRP 5510 or GEOL 5520,"Introduction to automated geoprocessing in Geographic Information Systems using Python. Focus on learning scripting language and object-oriented programming, automation of custom-designed geoprocessing scripts, and application toward student research and/or interests.",Fall,https://catalog.iastate.edu/azcourses/c_r_p/
CRP,4570,Geogames for Civic Engagement,3.,Lecture 3.,,,,,"Explore, design, and implement participatory geospatial games; define GeoGames; learn about different types of GeoGames and their formal and dramatic elements; design GeoGames for civic engagement, community visioning, and community planning.",Spring,https://catalog.iastate.edu/azcourses/c_r_p/
CRP,4590X,Geospatial Techniques for Nature-Based Solutions,3.,"Laboratory 2, Lecture 2.",,,,,"Exploration of the application of Geographic Information Systems (GIS) in planning Nature-Based Solutions (NBS), which are strategies that leverage natural processes to enhance resilience and address environmental, social, and economic challenges. Foundational knowledge of GIS principles and NBS, such as gathering and processing geospatial data, and conducting spatial analyses to assess and map ecosystems services. In this interdisciplinary course, students will use GIS tools to identify suitable locations and design strategies for NBS, and develop scenarios for disaster risk reduction, land use planning, and agriculture conservation planning.",,https://catalog.iastate.edu/azcourses/c_r_p/
CRP,4600,Social Justice and Planning,3.,Lecture 3.,,,,,"Investigation of the topic of social justice as it relates to the challenge of planning more socially just urban societies, emphasizing the importance of social justice issues to planning in a globalized world. Includes a range of issues and case studies of local social justice initiatives, both US and global. Students will complete individual service learning projects as part of the course requirement. Offered even-numbered years.",Spring,https://catalog.iastate.edu/azcourses/c_r_p/
CRP,4710,Real Estate Development,3.,Lecture 3.,,,,,"Summary of the process to develop real property. Using case studies, examine how the development process differs between residential, office, retail and mixed-use projects. Study the development process using a diverse set of analytical tools including market research, planning and legal analysis, and the discounted cash flow method.",Spring,https://catalog.iastate.edu/azcourses/c_r_p/
CRP,4750,Grant Writing,1.,Lecture 1.,,,,,"A short introduction to effective grant writing for the public and non-profit sectors. Includes identifying appropriate funding sources for an organization, identifying goals and objectives, and budgeting.",Fall,https://catalog.iastate.edu/azcourses/c_r_p/
CRP,4790,Public Finance and Planning,3.,Lecture 3.,,,,,"Overview of public finance theory, particularly in how it relates to local governments and the work of planning and community development. Concepts include theories of taxation, challenges unique to local public finance, collective action, and a survey of the different revenue sources used to fund local government.",Spring,https://catalog.iastate.edu/azcourses/c_r_p/
CRP,4840,Sustainable Communities,3.,Lecture 3.,,,,Junior classification,The history and theory of sustainable community planning. Procedural and substantive dimensions. Case studies of communities engaged in sustainability planning. Use and development of indicators.,Spring,https://catalog.iastate.edu/azcourses/c_r_p/
CRP,4900,Independent Study,1-3.,,,,True,Instructor Permission for Course,Investigation of an approved topic commensurate with student's interest and ability. Offered on a satisfactory-fail basis only.,"Fall, Spring, Summer",https://catalog.iastate.edu/azcourses/c_r_p/
CRP,4900H,Independent Study: Honors,1-3.,,,,True,Permission of Instructor; Membership in the University Honors Program,Investigation of an approved topic commensurate with student's interest and ability. Offered on a satisfactory-fail basis only.,"Fall, Spring, Summer",https://catalog.iastate.edu/azcourses/c_r_p/
CRP,4910,Environmental Law and Planning,3.,Lecture 3.,,,,6 credits natural sciences or permission of instructor,"Environmental law and policy as applied in planning at the local and state levels. Brownfields, environmental justice, water quality, air quality, wetland and floodplain management, and local government involvement in ecological protection through land use planning and other programs.",Spring,https://catalog.iastate.edu/azcourses/c_r_p/
CRP,4920,"Planning Law, Administration and Implementation",3.,Lecture 3.,,,,Junior classification,"The basis in constitutional, common, and statutory law for the powers of plan implementation. Problems of balancing public and private interests as revealed in the study of leading court cases. Administration of planning agencies and programs.",Fall,https://catalog.iastate.edu/azcourses/c_r_p/
CRP,4940,Senior Seminar in Planning,1-3.,Lecture 3.,,,True,Senior classification,An advanced forum for seniors that focuses upon recent trends and important issues affecting planning today. Topics addressed will vary. A demonstration of understanding of current issues and their effects upon planning applications is expected.,"Fall, Spring",https://catalog.iastate.edu/azcourses/c_r_p/
CRP,5010,The Practice of Planning,1.,Lecture 1.,,,,Graduate Standing or Permission of Instructor,"Exploration of the practice of planning in the United States. Discussion of the role of professional planning; field trips to meet practicing planners; learn about local government structure, functions and key issues confronting Iowa and US communities; examination of career paths within the planning profession.",Fall,https://catalog.iastate.edu/azcourses/c_r_p/
CRP,5100,Professional Work Experience,Required.,,,,True,Instructor Permission for Course,Approved professional work experience.,"Fall, Spring, Summer",https://catalog.iastate.edu/azcourses/c_r_p/
CRP,5110,Documenting the Historic Built Environment,3-4.,Lecture 4.,,,,Graduate Standing or Permission of Instructor,"Principals and methods for researching, identifying, recording, and analyzing buildings, districts, and sites that are historically or architecturally significant. Classroom and fieldwork components will use real-world historic places as case studies.",Fall,https://catalog.iastate.edu/azcourses/c_r_p/
CRP,5160,Urban Design Practice,6.,,,,,Graduate Standing or Permission of Instructor,Principles of urban design and their application to residential and commercial development in studio project.,Spring,https://catalog.iastate.edu/azcourses/c_r_p/
CRP,5170,Urban Revitalization,3.,Lecture 3.,,,,Graduate Standing or Permission of Instructor,"Planning methods available to further revitalization and preservation efforts, with particular attention to housing and neighborhoods. Relationship between neighborhood change and urban development process; public policy implications.",Spring,https://catalog.iastate.edu/azcourses/c_r_p/
CRP,5210,Historic Preservation Planning: Theory and Practice,3.,Lecture 3.,,,,Graduate Standing or Permission of Instructor,"Introduction to the history, theory, and practice of historic preservation and cultural resource management. Cases exploring preservation in US and global contexts; politics of preservation; preservation technologies; and relationship of preservation to other community issues.",Spring,https://catalog.iastate.edu/azcourses/c_r_p/
CRP,5260,Real Estate Development,3.,Lecture 3.,,,,Graduate Standing or Permission of Instructor,"Overview of the real estate development process. Topics include the history of real estate development, roles of planning and market forces in real estate development, and financial management of real estate development. Projects involve analysis of market niches, market penetration rates, lease rates, synergism and tenant mix, and the go/no go decision applied to residential, commercial, and mixed-use development.",,https://catalog.iastate.edu/azcourses/c_r_p/
CRP,5270,Sustainable Community Development,3.,Lecture 3.,,,,Graduate Standing or Permission of Instructor,"Introduces the central principles of sustainable community design and its implementation in the residential and commercial real estate development sectors. Topics include current practices and regulatory mandates, with a focus on the importance of private participation in the development of sustainable communities.",,https://catalog.iastate.edu/azcourses/c_r_p/
CRP,5280,Financing Historic Preservation Projects and Revitalizing Communities,3.,Lecture 3.,,,,Graduate Standing or Permission of Instructor,Investigation of the financial tools and incentives used to promote the rehabilitation and redevelopment of historic buildings and neighborhoods in cities and towns. Study of broader economic and social impacts on communities. Examinations of completed preservation projects around the United States.,,https://catalog.iastate.edu/azcourses/c_r_p/
CRP,5290,Planning in Developing Countries,3.,Lecture 3.,,,,,"Introduction to issues in planning and governance in an international setting. Problems and strategies may include population movement and change, economic globalization, urban growth, rural development, and housing.","Fall, Spring",https://catalog.iastate.edu/azcourses/c_r_p/
CRP,5300,Practicum,1-3.,,,,True,Graduate Standing or Permission of Instructor,"Practical planning experience. Structured work in range of tasks under close supervision of a professional planner. Relationships between theory and practice, exposure to variety of roles in functioning specialties. Offered on a satisfactory-fail basis only.","Fall, Spring, Summer",https://catalog.iastate.edu/azcourses/c_r_p/
CRP,5320,Community Planning Studio,4-6.,,,,,Graduate Standing or Permission of Instructor,"Comprehension and analysis of various geographic contexts pertinent to community planning and the use of planning theory, tools and techniques in an applied setting. Process of making a community plan: historical patterns, current conditions and strategies for planning.",Fall,https://catalog.iastate.edu/azcourses/c_r_p/
CRP,5350,Planning in Small Towns,3.,Lecture 3.,,,,Graduate Standing or Permission of Instructor,Contemporary planning problems in small towns and the design of viable strategies to enhance their social and economic position in today's society. Offered even-numbered years.,Fall,https://catalog.iastate.edu/azcourses/c_r_p/
CRP,5360,Community Economic Development,3.,Lecture 3.,,,,Graduate Standing or Permission of Instructor,The nature and process of economic development in the context of community development. Recent changes and trends and their implications for local and regional development. Selected case studies and applications. Contemporary community economic development issues. Offered odd-numbered years.,Fall,https://catalog.iastate.edu/azcourses/c_r_p/
CRP,5420,Site Development,3.,Lecture 3.,,,,Graduate Standing or Permission of Instructor,"Introduction to site development, including site review. Studio project integrating concept, finance, selection, analysis, and design.",Spring,https://catalog.iastate.edu/azcourses/c_r_p/
CRP,5450,Transportation Policy and Planning,3.,Lecture 3.,,,,Graduate Standing or Permission of Instructor,"Comprehensive overview of key policy issues related to transportation planning and investment in the United States and abroad. Policy issues explored include safety, environmental impact, sustainable communities, and economic development. Policy analysis and planning are studied in conjunction with each policy issue explored. Issues of concern to state, metropolitan, and local governments.",Fall,https://catalog.iastate.edu/azcourses/c_r_p/
