subject_code,course_number,title_name,credits,contact_hours,cross_listed,dual_listed,repeatable,prerequisites,description,typically_offered,source_url
ECON,1010,Principles of Microeconomics,3.,Lecture 3.,,,,,"Resource allocation, opportunity cost, comparative and absolute advantage. Supply and demand. Marginal analysis. Theories of production and consumption, pricing, and the market system. Perfect and imperfect competition and strategic behavior. Factor markets. Present discounted value.","Fall, Spring, Summer",https://catalog.iastate.edu/azcourses/econ/
ECON,1010H,Principles of Microeconomics: Honors,3.,Lecture 3.,,,,Membership in the University Honors Program,"Resource allocation, opportunity cost, comparative and absolute advantage. Supply and demand. Marginal analysis. Theories of production and consumption, pricing, and the market system. Perfect and imperfect competition and strategic behavior. Factor markets. Present discounted value.",,https://catalog.iastate.edu/azcourses/econ/
ECON,1010L,Laboratory in Principles of Microeconomics,1.,Laboratory 2.,,,,,Discussion of material typically covered in ECON 1010 . Application of economic principles to real world problems. Economic principles and basic business management concepts applied to decision-making in agribusiness operations.,Fall,https://catalog.iastate.edu/azcourses/econ/
ECON,1020,Principles of Macroeconomics,3.,Lecture 3.,,,,,"Measurement of macro variables and general macro identities. Classical models of full employment. Production and growth. Savings and investment. Employment and unemployment. Money, inflation, and price levels. Operation of the U.S. banking system. Fiscal and monetary policy. Elements of international finance. ECON 1010 recommended.","Fall, Spring, Summer",https://catalog.iastate.edu/azcourses/econ/
ECON,1020H,Principles of Macroeconomics: Honors,3.,Lecture 3.,,,,Membership in the University Honors Program,"Measurement of macro variables and general macro identities. Classical models of full employment. Production and growth. Savings and investment. Employment and unemployment. Money, inflation, and price levels. Operation of the U.S. banking system. Fiscal and monetary policy. Elements of international finance. ECON 1010 recommended.",,https://catalog.iastate.edu/azcourses/econ/
ECON,1030X,Introduction to Economics: Real World Applications,3.,Lecture 3.,,,,,"Introduction to key economics concepts in the context of current events and real-world questions. Topics will address some or all of the following concepts: market supply and demand, consumer and producer behavior, government policy and regulation, market structure, market failures, time value of money, inflation, gross domestic product, economic growth, labor markets, financial markets, and international trade. Cannot be used as a substitute for ECON 1010 or ECON 1020 prerequisite.",,https://catalog.iastate.edu/azcourses/econ/
ECON,1100,Orientation in Agricultural Business,1.,"Discussion 0.5, Lecture 0.5.",,,,,Orientation course for freshman and new transfer students in agricultural business.,Fall,https://catalog.iastate.edu/azcourses/econ/
ECON,2070,Applied Economic Optimization,3.,"Lecture 2, Discussion 2.",,,,MATH 1510 or MATH 1600 or MATH 1650,"Application of linear algebra, calculus and unconstrained and constrained optimization techniques to economic problems. Learning outcomes include the ability to (i) identify the objective, decision variables and constraints in economic decision problems, (ii) represent elements of an economic problem in simple mathematical models, (iii) identify and apply mathematical tools that can be used to solve the problems, (iv) identify the strengths and limitations of the solution method, and (v) interpret the economic meaning and implications of the solution.","Fall, Spring",https://catalog.iastate.edu/azcourses/econ/
ECON,2300,Farm Business Management,3.,Lecture 3.,,,,ACCT 2840 ; ECON 1010,"Business and economic principles applied to decision making and problem solving in the management of a farm business. Cash flow, partial, enterprise, and whole farm budgeting. Information systems for farm accounting, analysis, and control. Obtaining and managing land, capital, and labor resources. Alternatives for farm business organization and risk management.","Fall, Spring",https://catalog.iastate.edu/azcourses/econ/
ECON,2340,Small Business Management,3.,Lecture 3.,,,,ECON 1010,"An introduction to small business management, entrepreneurship, and economics utilizing a series of case studies. Exploration of issues related to starting or acquiring a new business and development of knowledge and skills for successful management of a small business, with an emphasis on agricultural business.",,https://catalog.iastate.edu/azcourses/econ/
ECON,2350,Introduction to Agricultural Markets,3.,Lecture 3.,,,,ECON 1010,"Basic concepts and economics principles related to markets for agricultural inputs and products. Overview of current marketing problems faced by farms and agribusinesses, farm and retail price behavior, structure of markets, food marketing channels, food quality and food safety, and the role of agriculture in the general economy. The implications of consumer preferences at the farm level. Introduction to hedging, futures, and other risk management tools.","Fall, Spring",https://catalog.iastate.edu/azcourses/econ/
ECON,2360,Agricultural Selling,3.,Lecture 3.,,,,ECON 1010,"Principles of selling with application to agricultural and food related businesses. Attitudes, value systems, and behavioral patterns that relate to agricultural sales. Marketing, selling strategies, preparing for sales calls, making sales presentations, handling objections, and closing sales. Analysis of the buying or purchasing process. Evaluation of agri-selling profession.","Fall, Spring, Summer",https://catalog.iastate.edu/azcourses/econ/
ECON,2710,Introduction to Data Analysis in Agri-Food Industry,3.,Lecture 3.,,,,,Introduction to quantitative methods for economic decision making. Examples from agricultural and natural resource economics presented using spreadsheet software tools such as Microsoft Excel.,Spring,https://catalog.iastate.edu/azcourses/econ/
ECON,2920A,Career Seminar: Agricultural Business,1.,Lecture 1.,,,,Major in economics or agricultural business,"Career opportunities in the various industries and government institutions. Required training and skills needed to perform successfully in different types of careers. Factors important in finding and obtaining employment either before or after graduation including personal resumes, interviewing, and letter writing. Graduation Restriction: Only one of ECON 2920, 2920A, and 2920B can be used toward graduation.",,https://catalog.iastate.edu/azcourses/econ/
ECON,2920B,Career Seminar: Economics and Business Economics,1.,Lecture 1.,,,,Major in economics or business economics,"Career opportunities in the various industries and government institutions. Required training and skills needed to perform successfully in different types of careers. Factors important in finding and obtaining employment either before or after graduation including personal resumes, interviewing, and letter writing. Graduation Restriction: Only one of ECON 2920, 2920A, and 2920B can be used toward graduation.",,https://catalog.iastate.edu/azcourses/econ/
ECON,2970,Internship,2.,,,,True,Permission of Instructor; and major in Agricultural Business or Economics,"Students complete a research report, based on their internship or approved work experience, that examines chosen topics in management, marketing or finance.",,https://catalog.iastate.edu/azcourses/econ/
ECON,2980,Cooperative Education,Required.,,,,True,Permission of the department cooperative education coordinator; sophomore classification,Required of all cooperative education students. Students must register for this course prior to commencing each work period.,,https://catalog.iastate.edu/azcourses/econ/
ECON,3010,Intermediate Microeconomics,3-4.,"Discussion 1, Lecture 3.",,,,ECON 1010 and ECON 2070 or MATH 1660,"Theory of consumer and business behavior; optimal consumption choices and demand; theory of firm behavior; costs, production, and supply; competitive and imperfectly competitive markets; theory of demand for and supply of factors of production; general equilibrium analysis. Fall and spring require recitation and are 4 credits; summer is 3.0 credits.","Fall, Spring, Summer",https://catalog.iastate.edu/azcourses/econ/
ECON,3010H,Intermediate Microeconomics: Honors,3-4.,Lecture 3.,,,,ECON 1010 and ECON 2070 or MATH 1660 ; Membership in the University Honors Program,"Theory of consumer and business behavior; optimal consumption choices and demand; theory of firm behavior; costs, production, and supply; competitive and imperfectly competitive markets; theory of demand for and supply of factors of production; general equilibrium analysis. Recitation required for 4 credits.",,https://catalog.iastate.edu/azcourses/econ/
ECON,3020,Intermediate Macroeconomics,3.,Lecture 3.,,,,ECON 1010 ; ECON 1020 ; ( MATH 1600 or MATH 1650 ),"Theory of income, employment, interest rates, and the price level; fiscal and monetary policy; budget and trade deficits; money and capital inflows, interest rates, and inflation.","Fall, Spring",https://catalog.iastate.edu/azcourses/econ/
ECON,3020H,Intermediate Macroeconomics: Honors,3.,Lecture 3.,,,,ECON 1010 ; ECON 1020 ; ( MATH 1600 or MATH 1650 ); Membership in the University Honors Program,"Theory of income, employment, interest rates, and the price level; fiscal and monetary policy; budget and trade deficits; money and capital inflows, interest rates, and inflation.",,https://catalog.iastate.edu/azcourses/econ/
ECON,3130,Economics of Sports,3.,Lecture 3.,,,,ECON 1010,"Application of economics to issues in sports, including franchising; rival leagues and barriers to entry; cooperative, competitive, and collusive behavior; player productivity and compensation; contracts, unions, and discrimination; antitrust, taxation, and subsidies. Economic concepts include supply and demand, costs, competition, time value of money, labor economics, pricing, public finance, production, game theory, risk analysis, and industrial organization.",,https://catalog.iastate.edu/azcourses/econ/
ECON,3200,Labor Economics,3.,Lecture 3.,,,,ECON 1010 or ECON 1020,"Economic analysis of contemporary domestic and international labor market issues including labor supply and demand, unemployment, and employment in the U.S. and elsewhere; investments in and returns to education, training, health, immigration and migration; income inequality; labor productivity; out-sourcing and global competitiveness; work incentives; compensation including benefits; and labor policies such as minimum wages, over-time pay, discrimination, unions, and immigration. Examples drawn from the U.S. and other developed countries with reference to developing countries where relevant. Meets International Perspectives Requirement.",,https://catalog.iastate.edu/azcourses/econ/
ECON,3210,Economics of Discrimination,3.,Lecture 3.,,,,ECON 1010,"Economic theories of discrimination. Analysis of the economic problems of women and minorities in such areas as earnings, occupations, and unemployment. Public policy concerning discrimination. Poverty measurement and antipoverty programs in the U.S. Meets U.S. Cultures and Communities Requirement.",,https://catalog.iastate.edu/azcourses/econ/
ECON,3220X,Health Economics,3.,Lecture 3.,,,,ECON 1010,"Study of the economic behaviors of individuals, medical care providers, insurers, and governments in decision-making related to healthcare resource allocation. Analysis of market inefficiencies created from asymmetric information problems between patients, insurers, and healthcare providers, policies promoting fair access to essential healthcare and for addressing externalities in the health industry.",Spring,https://catalog.iastate.edu/azcourses/econ/
ECON,3300,Advanced Farm Business Management,3.,Lecture 3.,,,,ECON 2300,"Effective use of strategic planning, decision methods, and computer assistance for solving farm problems. Applications of economic and management theory to analyze farm business decisions using efficiency measures to assess current resource use and direct the farm business analysis, planning, and tax process.",,https://catalog.iastate.edu/azcourses/econ/
ECON,3320,Cooperatives,3.,Lecture 3.,,,,ECON 1010,"Survey of cooperative business structure, including historical developments in the United States, principles of cooperation, state and federal authorization for cooperative activity, economic motivations and foundations, governance, marketing and pricing strategies, and financing, capitalization and taxation considerations. Students will learn how the cooperative model is applied in a variety of markets.",,https://catalog.iastate.edu/azcourses/econ/
ECON,3340,Entrepreneurship in Agriculture,3.,Lecture 3.,,,,ECON 1010,Introduction to the process of entrepreneurship within the agricultural and food sectors. Emphasis on opportunity recognition and creation of concept for new startup ventures. Students will develop a business plan for a startup business or non-profit organization.,"Fall, Spring",https://catalog.iastate.edu/azcourses/econ/
ECON,3350,The Economics of Global Agricultural Food and Bio-energy,3.,Lecture 3.,,,,ECON 1010,"Applied economic analysis of the determinants of world agricultural production, marketing, and use in feed, food, fiber, biofuel, and other applications, and global food processing and consumption. Analysis of market case studies and various data on global agricultural production and transformation, land and resource use, demography, economic activity, nutrition and health trends. Meets International Perspectives Requirement.",,https://catalog.iastate.edu/azcourses/econ/
ECON,3370,Agricultural Marketing,3.,Lecture 3.,,,,ECON 1010,"Understanding of agricultural commodity markets for grain, livestock and dairy with emphasis on marketing decisions and risk management for farmers and processors. Hands-on applications of marketing and management tools via market simulations. ECON 2350 recommended.",,https://catalog.iastate.edu/azcourses/econ/
ECON,3380X,Agribusiness and Law,3.,Lecture 3.,,,,ECON 1010,"Economic, business, and legal principles applied to decision making and strategies of agricultural input suppliers, cooperatives, food processors and distributors, and food retailers. Within these contexts, the legal forms of doing business; corporate strategies and legal issues; business conduct and antitrust law; agricultural marketing and production contracts; food quality; intellectual property; labor relations; international agribusiness conduct and legal issues. Teaching methods include some case studies.",,https://catalog.iastate.edu/azcourses/econ/
ECON,3440,Public Finance,3.,Lecture 3.,,,,ECON 1010,"The economic role of governments in market economies. Public goods, externalities, income distribution, and income maintenance programs. The effect of taxes on economic behavior, descriptions of the structure of the principal U.S. taxes, and current reform proposals.",,https://catalog.iastate.edu/azcourses/econ/
ECON,3530,"Money, Banking, and Financial Institutions",3.,Lecture 3.,,,,ECON 1020,"Theoretical and applied analysis of money, banking, and financial markets; interest rates and portfolio choice; the banking industry in transition; the money supply process; the Federal Reserve System and the conduct of monetary policy; macro implications of monetary policy; international finance.","Fall, Spring, Summer",https://catalog.iastate.edu/azcourses/econ/
ECON,3550,International Trade and Finance,3.,Lecture 3.,,,,ECON 1010 ; ECON 1020,"Explanations of causes of international trade and the impact of trade on welfare and employment patterns. Analysis of government policies towards trade, such as tariffs, quotas, and free trade areas. Theory of balance of payments and exchange rate determination, and the role of government policies. Examination of alternative international monetary arrangements. Meets International Perspectives Requirement.",,https://catalog.iastate.edu/azcourses/econ/
ECON,3620,Applied Ethics in Agricultural Business,3.,Lecture 3.,,,,ECON 1010 ; Junior or Senior classification; College of Agriculture and Life Sciences major,Explore ethics of management and decision-making in agriculture and agricultural business. Discuss and debate proper ethical behavior in these issues and situations and the relationship between business and personal ethical behavior.,,https://catalog.iastate.edu/azcourses/econ/
ECON,3640,Rural Property Appraisal,3.,Lecture 3.,,,,ECON 1010,"Use of income capitalization, sales comparison and cost appraisal concepts in appraising agricultural resources. Application of underlying economic/business/management principles, especially present value, as they relate to farmland appraisal. Determination and estimation of economic impacts of special consideration and property use factors. Evaluate feasibility and profitability of investment in rural property.",,https://catalog.iastate.edu/azcourses/econ/
ECON,3710,Introductory Econometrics,4.,Lecture 4.,,,,ECON 3010 AND ( STAT 3260 or STAT 3410 ),Introduction to the models and methods used to estimate relationships and test hypotheses pertaining to economic variables. Among the topics covered in the course are: Single and multiple regression analysis; functional forms; omitted variable analysis; multicollinearity; heteroskedasticity; autocorrelation; simultaneous equations; and dynamic models.,"Fall, Spring",https://catalog.iastate.edu/azcourses/econ/
ECON,3760,"Rural, Urban and Regional Economics",3.,Lecture 3.,,,,ECON 1010,"Firm location with respect to regional resources, transport, scale economies, externalities, and policies. Measures of local comparative advantage and specialization. Spatial markets. Population location considering jobs, wages, commuting, and local amenities. Business, residential, and farm land use and value. Migration. Other topics may include market failure, regulation, the product cycle, theories of rural and urban development, developmental policy, firm recruiting, local public goods and public finance, schools, poverty, segregation, and crime.",,https://catalog.iastate.edu/azcourses/econ/
ECON,3800,"Energy, Environmental and Resource Economics",3.,Lecture 3.,,,,ECON 1010,"Natural resource availability, use, conservation, and government policy, with emphasis on energy issues. Environmental quality and pollution control policies.",,https://catalog.iastate.edu/azcourses/econ/
ECON,3820X,Climate Economics,3.,Lecture 3.,,,,ECON 1010,Application of economic concepts to understand implications of climate change.Topics covered will include economic costs and benefits of climate mitigation and adaptation;efficiency and distributional dimensions of climate policy; and current topics in climate andenergy policy.,Fall,https://catalog.iastate.edu/azcourses/econ/
ECON,3830X,Economics of Innovation,3.,,,,,ECON 1010,Key concepts in the economics of innovation. Definition and measure of innovation; useful mental frameworks in understanding innovation; factors that drive innovation; and policies and actions that impact direction and rate of innovation.,Fall,https://catalog.iastate.edu/azcourses/econ/
ECON,3850,Economic Development,3.,Lecture 3.,,,,ECON 1020,"Current problems of developing countries, historical experiences and interrelationships betweendeveloped and developing countries, theories of economic growth and economic development,measurements and predictions of economic performance of developing countries, and alternativepolicies and reforms for economic development. Topics to include poverty, income inequality,population growth, and environmental and economic development. Meets InternationalPerspectives Requirement.",,https://catalog.iastate.edu/azcourses/econ/
ECON,3870,Economies of China and India,3.,Lecture 3.,,,,ECON 1010,"The economic development of China and India within the larger historical, political, and socioeconomic contexts. The characteristics of the development paths of major industries. The drivers of and impediments for future economic development. The two economies' connections with the world economy. Meets International Perspectives Requirement.",,https://catalog.iastate.edu/azcourses/econ/
ECON,3980,Cooperative Education,Required.,,,,True,Permission of Department Cooperative Education Coordinator; Junior classification,Required of all cooperative education students. Students must register for this course prior to commencing each work period.,,https://catalog.iastate.edu/azcourses/econ/
ECON,4010,Topics in Microeconomics,3.,Lecture 3.,,,,ECON 3010 and STAT 2260,"Advanced treatment of selected topics from one or more of the following areas: household production models, factor markets, game theory and imperfect competition, general equilibrium, intertemporal choice, asset markets, income distribution, externalities and public goods, etc.",,https://catalog.iastate.edu/azcourses/econ/
ECON,4020,Topics in Macroeconomics,3.,Lecture 3.,,,,ECON 3020 or ECON 3530,"Advanced treatment of selected topics from one or more of the following areas: business cycle theory, growth theory, fiscal and monetary policy, coordination issues, open economy macroeconomics, and financial economics.",,https://catalog.iastate.edu/azcourses/econ/
ECON,4100X,Experimental Economics,3.,Lecture 3.,,,,,"Introduction to experimental economics and major subject areas addressed by laboratory and field experiments. Topics include an introduction to the technique of using laboratory experimental methods to test economic theories, understanding economic behavior, and conducting field experiments. Additional topics will introduce students to human subjects review, experimental design, writing a literature review, and the study of a series of experiments: markets, individual decision-making, asset markets, behavioral game theory, and neuroeconomics.",,https://catalog.iastate.edu/azcourses/econ/
ECON,4160,Industrial Organization,3.,Lecture 3.,,,,ECON 3010,"Study of the structure of firms and markets and of their interaction, with emphasis on imperfectly competitive markets. Behavior of firms in strategic settings and insights of basic game-theoretic models. Welfare implications of alternative market organizations, consequences of market power, and scope for government regulation and antitrust/competition policies. Topics include monopoly and price discrimination, oligopoly models, product quality, product differentiation, vertical integration, information and advertising, patents, R&D and innovation, and regulation.",,https://catalog.iastate.edu/azcourses/econ/
ECON,4180,Introduction to Game Theory,3.,Lecture 3.,,,,ECON 3010,"Systematic introduction to game theory and its uses in economics. Develops the basic framework, models and tools necessary to analyze games of strategy, including: Strategic and extensive-form representations of games; best response functions and Nash equilibrium, mixed strategies backward induction and subgame-perfect equilibrium, imperfect and incomplete information, Bayesian and sequential equilibria. Examples and applications taken from economics, business, political science, law and biology.",,https://catalog.iastate.edu/azcourses/econ/
ECON,4310,Managerial Economics,3.,Lecture 3.,,,,ECON 3010,Theory of the firm; organizational incentives and efficiency; moral hazard; role of information and decision making under uncertainty; ownership and control; business investment.,,https://catalog.iastate.edu/azcourses/econ/
ECON,4350,Analysis of Food Markets,3.,Lecture 3.,,,,ECON 3010 and STAT 2260,Food market analysis from an economics perspective; food markets and consumption; methods of economic analysis; food industry structure and organization; food and agriculture regulations; labeling; consumer concerns; agricultural commodity promotion. Final project required.,Spring,https://catalog.iastate.edu/azcourses/econ/
ECON,4370,Commodity Marketing and Risk Management,3.,Lecture 3.,,,,ECON 2350 AND ECON 3010 AND ( ECON 2710 or STAT 3260 ),"The purpose and performance of commodity markets. How commodity marketing institutions function. Merchandising arrangements. Distinguishing features of agricultural commodities. Hedging, arbitrage, and speculation in commodity spot, forward, futures, and options markets. Valuation theory.",,https://catalog.iastate.edu/azcourses/econ/
ECON,4500X,Economic Growth,3.,Lecture 3.,,,,,"A theoretical and empirical examination of economic growth and income differences between countries. Focuses on both the historical experience of countries that are currently rich and the process of catch‐up, or stagnation, among poor countries. Topics include population growth, accumulation of physical and human capital, technological change, natural resources, income distribution, geography, government, and culture. Meets International Perspectives Requirement.",Fall,https://catalog.iastate.edu/azcourses/econ/
ECON,4550,International Trade,3.,Lecture 3.,,,,ECON 3010,"Rigorous treatment of theories of international trade and international factor movements. Examination of the impact of trade and labor migration on domestic and world welfare and on the distribution of income. Theoretical analysis of government policies towards trade and factor movements, including quotas, tariffs, free trade areas and immigration restrictions. Discussion of contemporary issues and controversies concerning globalization, including multinational firms and labor migration. Meets International Perspectives Requirement.",,https://catalog.iastate.edu/azcourses/econ/
