subject_code,course_number,title_name,credits,contact_hours,cross_listed,dual_listed,repeatable,prerequisites,description,typically_offered,source_url
ECON,4570,International Finance,3.,Lecture 3.,,,,ECON 3020,"National income accounting and balance of payments; foreign exchange rates and exchange rate markets; money, interest rates, and exchange rate determination; prices, exchange rates, and output in the short run; international monetary arrangements; fixed versus flexible exchange rates; optimal currency areas; international capital flows; currency and financial crises in emerging markets. Graduation Restriction: Retrieving data. Wait a few seconds and try to cut or copy again. Meets International Perspectives Requirement.",,https://catalog.iastate.edu/azcourses/econ/
ECON,4600,"Agricultural, Food, and Trade Policy",3.,Lecture 3.,,,,ECON 3010 or ECON 5010,"Description and analysis of economic problems of U.S. agriculture. Explanation and economic analysis of government policies and programs to develop agriculture, conserve agricultural resources, address consumer food concerns, stabilize farm prices, and raise farm incomes. The influence of macropolicy, world economy, international trade, and bioenergy on U.S. agriculture.",,https://catalog.iastate.edu/azcourses/econ/
ECON,4660,Agricultural Finance,3.,Lecture 3.,,,,ECON 3010 ; FIN 3010 ; STAT 2260,"Financial analysis of agricultural businesses; liquidity, capital structure, and growth and risk of agricultural firms; capital budgeting methods; analysis of land investments, leasing, and costs of credit; financial intermediation and major financial institutions for agriculture; borrower-lender relationships, and asset-liability management techniques by financial intermediaries; public policies affecting agricultural credit markets. ECON 3530 recommended.",,https://catalog.iastate.edu/azcourses/econ/
ECON,4800,Intermediate Environmental and Resource Economics,3.,Lecture 3.,,,,ECON 3010,"Theories of natural resource utilization and allocation. Externalities, public goods, and environmental quality. Renewable energy, biofuels, land use change and life cycle analysis of carbon, and sustainability and resource conservation. Methodologies for analyzing natural resource and environmental problems and evaluating resource policies.",,https://catalog.iastate.edu/azcourses/econ/
ECON,4900,Independent Study,1-3.,,,,True,Junior or Senior classification; 14 credits in ECON; Permission of Instructor,Graduation Restriction: No more than 9 credits of ECON 4900 may be used toward graduation.,,https://catalog.iastate.edu/azcourses/econ/
ECON,4900E,Independent Study: Entrepreneurship,1-5.,,,,True,Junior or Senior classification; 14 credits in ECON; Permission of Instructor,Graduation Restriction: No more than 9 credits of ECON 4900 may be used toward graduation.,,https://catalog.iastate.edu/azcourses/econ/
ECON,4900H,Independent Study: Honors,1-5.,,,,True,Junior or Senior classification; 14 credits in ECON; Permission of Instructor: Membership in the University Honors Program,Graduation Restriction: No more than 9 credits of ECON 4900 may be used toward graduation.,,https://catalog.iastate.edu/azcourses/econ/
ECON,4920,Graduating Senior Survey,Required.,Lecture 1.,,,,,"Final preparations for graduation. The final stages of job searching, interviewing, letter writing, and resume preparation. Outcomes assessment information from graduating seniors including opinion surveys, instructor/advisor/course evaluations, exit interviews, student accomplishment surveys, job placement surveys, and comprehensive skills examinations. Departmental recognition of graduating seniors. Life as an alumnus - expectations and obligations. Convocation and commencement information. Offered on a satisfactory-fail basis only.","Fall, Spring, Summer",https://catalog.iastate.edu/azcourses/econ/
ECON,4950,Economics Domestic Travel Course,1-3.,Lecture 4.,,,,Permission of Instructor; Sophomore classification,"Tour and study of domestic businesses, markets, and economic institutions located outside Iowa to expose students to the diversity of activities within the U.S. economy. Pre-trip sessions arranged. Locations and duration of tours will vary.",,https://catalog.iastate.edu/azcourses/econ/
ECON,4960,Economics International Travel Course,1-3.,,,,True,,"Tour and study of international agricultural and/or nonagricultural economies, markets, and institutions. Locations and duration of tours will vary. Limited enrollment. Meets International Perspectives Requirement.",,https://catalog.iastate.edu/azcourses/econ/
ECON,4970X,Agricultural Business Capstone,3.,,,,,,"Students admitted into this experiential course will act as consultants to an agricultural business, consortium, or trade organization to execute an innovation project. Students are mentored through a process for developing and executing the consulting project, where they assimilate knowledge from other courses as they analyze new business/market opportunities. Students will develop insights through idea/concept articulation, opportunity assessment, customer needs analysis, value proposition, and financial modeling which will coalesce into a final summary report and presentation to present to the sponsor organization at the end of the semester.",,https://catalog.iastate.edu/azcourses/econ/
ECON,4980,Cooperative Education,Required.,,,,True,Permission of Department Cooperative Education Coordinator; Senior classification,Required of all cooperative education students. Students must register for this course prior to commencing each work period.,,https://catalog.iastate.edu/azcourses/econ/
ECON,5000,Quantitative Methods in Economic Analysis I,4.,Lecture 4.,,,,Graduate Standing or Permission of Instructor,"Economic applications of selected mathematical and statistical concepts: linear models and matrix algebra; differential calculus and optimization; integral calculus and economic dynamics; probability distributions, estimation, and hypothesis testing in the analysis of economic data. The best math preparation is a full year of calculus.",Fall,https://catalog.iastate.edu/azcourses/econ/
ECON,5010,Microeconomics,4.,Lecture 4.,,,,,"The theory of the consumer, theory of the firm, perfect and imperfect competition, welfare economics, and selected topics in general equilibrium and uncertainty.",Fall,https://catalog.iastate.edu/azcourses/econ/
ECON,5020,Macroeconomics,4.,Lecture 4.,,,,Graduate Standing or Permission of Instructor,"Models of aggregate supply and demand, theories of consumption and investment, money supply and demand, inflation, rational expectations, stabilization policy, financial markets, and international finance.",Fall,https://catalog.iastate.edu/azcourses/econ/
ECON,5090,Applied Numerical Methods in Economics,3.,Lecture 3.,,,,Graduate Standing or Permission of Instructor,"Use of numerical techniques to solve economic problems. Numerical differentiation and integration numeric solutions of systems of equations, static and dynamic optimization problems including unconstrained optimization, maximum likelihood methods, general nonlinear programming methods, dynamic programming and optimal control, numerical methods for solving functional equations.",,https://catalog.iastate.edu/azcourses/econ/
ECON,5100,Experimental Economics,3.,Lecture 3.,,,,Graduate Standing or Permission of Instructor,"Introduction to experimental economics and major subject areas addressed by laboratory and field experiments. Exploration of experimental methods by concentrating on series of experiments. Applications include individual decision-making, behavioral game theory, markets, behavioral labor, public and development economics, social network, and neuroeconomics. Research project.",,https://catalog.iastate.edu/azcourses/econ/
ECON,5110X,Research Seminar in Experimental Economics,3.,Lecture 3.,,,,Graduate Standing or Permission of Instructor,"Design, conduct, interpret, and report on economic experiments. Preparation of a potentially publishable experimental research paper. Topics vary according to student interest.",Fall,https://catalog.iastate.edu/azcourses/econ/
ECON,5200,Labor Supply and Human Capital Formation,3.,Lecture 3.,,,,Graduate Standing or Permission of Instructor,"Labor supply decisions and empirical analysis for agricultural operators and other self-employed and wage-earning households; multiple job holding; resource allocation in productive households; human capital formation by households, firms, and public institutions, which includes schooling, on-the-job training, migration, health, research, raising of children, and implications for household income and welfare; applications to problems in rural areas of developing and developed countries.",,https://catalog.iastate.edu/azcourses/econ/
ECON,5310,Trends Impacting Agri-Food Businesses,2.,Lecture 2.,,,,Graduate Standing or Permission of Instructor,"Explore trends impacting agricultural and food businesses. Video interviews with a range of entrepreneurs, investors and industry experts will expose students to a variety of ideas and opinions on the most important trends and issues impacting the future structure of agri-food markets and explore the implications for agri-food businesses. In addition, students will be challenged to develop their own ideas about how these trends will impact their business and career.",Fall,https://catalog.iastate.edu/azcourses/econ/
ECON,5320,Managerial Economics for the Global Organization,3.,Lecture 3.,,,,Graduate Standing or Permission of Instructor,"Applications of microeconomic theory and decision analysis for firms operating in U.S. and internationally. Topics include demand & supply, consumer choice theory, production and cost theory, short run and long run business decisions, input cost and human capital differences across countries, empirical estimation of demand and supply, pricing, exchange rates, government and business, market structures and strategy.",,https://catalog.iastate.edu/azcourses/econ/
ECON,5370,Commodity Markets: Analysis and Strategy,3.,Lecture 3.,,,,Graduate Standing or Permission of Instructor,"Analysis of exchange-traded and over-the-counter commodity markets, their functions and performance. Evaluation of hedging, speculation, and arbitrage strategies. Commodity transformation over space and time. Valuation of derivatives and comparison with derivatives on financial assets. Efficiency and the role of information in commodity markets. Market regulation.",,https://catalog.iastate.edu/azcourses/econ/
ECON,5450,Public Economics,3.,Lecture 3.,,,,Graduate Standing or Permission of Instructor,"Economic justifications for government activities; illustrative theoretical and empirical analyses of expenditure programs; foundations of excess burden, incidence analysis, and optimal taxation; effects of taxation on labor supply; public goods and externalities; social insurance; introduction to economics of the health sector with an emphasis on the role of market failures.",,https://catalog.iastate.edu/azcourses/econ/
ECON,5570X,International Finance,3.,Lecture 3.,,,,Graduate Standing or Permission of Instructor,"National income accounting and balance of payments; foreign exchange rates and exchange rate markets; money, interest rates, and exchange rate determination; prices, exchange rates, and output in the short run; international monetary arrangements; fixed versus flexible exchange rates; optimal currency areas; international capital flows; currency and financial crises in emerging markets. Graduation Restriction: Retrieving data. Wait a few seconds and try to cut or copy again. Meets International Perspectives Requirement.",,https://catalog.iastate.edu/azcourses/econ/
ECON,5600,"Agricultural, Food, and Trade Policy",3.,Lecture 3.,,,,Graduate Standing or Permission of Instructor,"Description and analysis of economic problems of U.S. agriculture. Explanation and economic analysis of government policies and programs to develop agriculture, conserve agricultural resources, address consumer food concerns, stabilize farm prices, and raise farm incomes. The influence of macroeconomic policy, world economy, international trade, and bioenergy on U.S. agriculture.","Fall, Spring, Summer",https://catalog.iastate.edu/azcourses/econ/
ECON,5710,Intermediate Econometrics,4.,"Lecture 3, Laboratory 2.",,,,Graduate Standing or Permission of Instructor,Single and multiple equation regression models; dummy explanatory variables; serial correlation; heteroskedasticity; distributed lags; qualitative dependent variables; simultaneity. Use of econometric models for tests of economic theories and forecasting.,Spring,https://catalog.iastate.edu/azcourses/econ/
ECON,5760,Spatial Economics,3.,Lecture 3.,,,,Graduate Standing or Permission of Instructor,"Analysis of location choice by firms, employees, and households emphasizing the role of spatial variations in agglomeration economies, economies of scale, distance, transport, endowments, amenities, and local government. Models of land use, urban form, spatial competition, central place theory, and migration. Techniques of discrete choice analysis, statistical analysis of categorical data, urban system modeling, and interregional computable general equilibrium.",,https://catalog.iastate.edu/azcourses/econ/
ECON,5800,Intermediate Environmental and Resource Economics,3.,Lecture 3.,,,,Graduate Standing or Permission of Instructor,"Theories of natural resource utilization and allocation. Externalities, public goods, and environmental quality. Renewable energy, biofuels, land use change and life cycle analysis of carbon, and sustainability and resource conservation. Methodologies for analyzing natural and environmental problems and evaluating resource policies.","Fall, Spring, Summer",https://catalog.iastate.edu/azcourses/econ/
ECON,5810,Advanced Environmental Economics,3.,Lecture 3.,,,,Graduate Standing or Permission of Instructor,Interrelationships of natural resource use and the environment. Applied welfare and benefit-cost analyses. Externalities and pollution abatement. Nonmarket valuation of resources. Property rights. Legal and social constraints. Policy approaches.,,https://catalog.iastate.edu/azcourses/econ/
ECON,5900,Special Topics,1-5.,,,,True,,Offered on a satisfactory-fail basis only.,"Fall, Spring, Summer",https://catalog.iastate.edu/azcourses/econ/
ECON,5940,Research Methods in Economics I,1.,Lecture 1.,,,,Graduate Standing or Permission of Instructor,"Introduction to methods used in empirical economic research. Formulation of well-posed economic questions, locating and evaluating relevant literature, and meaning of testable hypotheses.",Fall,https://catalog.iastate.edu/azcourses/econ/
ECON,5950,Research Methods in Economics II,1.,Lecture 1.,,,,Graduate Standing or Permission of Instructor,"Develop skills required to successfully acquire, manipulate and analyze data that can be used for conducting empirical economic research. Topics include research design, developing workflows that support reproducible analysis, data visualization and related issues. Hands on work with one or more example data sets to gain experience and confidence in using statistical software and interpreting the results of this analysis.",Spring,https://catalog.iastate.edu/azcourses/econ/
ECON,5960,Research Methods in Economics III,1.,Lecture 1.,,,,Graduate Standing or Permission of Instructor,"Formulation of the research question, problem identification, literature review, data identification, formulation and testing of hypotheses, and presentation of research results. Lectures will build on assigned readings, and cover components of applied economic research, and writing skills. Student research presentations and lectures by invited speakers. Students develop their creative component in a “hands on” environment where the instructor and others can offer guidance.",Spring,https://catalog.iastate.edu/azcourses/econ/
ECON,5990,Creative Component,1-5.,,,,True,,Offered on a satisfactory-fail basis only.,"Fall, Spring, Summer",https://catalog.iastate.edu/azcourses/econ/
ECON,6010,Microeconomic Analysis I,4.,"Lecture 4, Discussion 1.",,,,,"Economic theory and methodology; theory of consumer behavior, theory of the competitive firm, supply and factor demand; duality relations in consumer and producer theory, welfare change measures; partial equilibrium analysis, perfect competition, monopoly; choice under uncertainty, the expected utility model, risk aversion; insurance, portfolio and production decisions under risk.",Fall,https://catalog.iastate.edu/azcourses/econ/
ECON,6020,Macroeconomic Analysis,4.,"Lecture 4, Discussion 1.",,,,,Neoclassical aggregate growth models; the overlapping generations model; endogenous growth models; equilibrium business cycle theories; equilibrium job search and matching; models of money; fiscal and monetary policy; income and wealth distribution.,Spring,https://catalog.iastate.edu/azcourses/econ/
ECON,6030,Microeconomic Analysis II,4.,"Lecture 3, Discussion 1.",,,,,"General equilibrium analysis, efficiency, and welfare; market failures, externalities, and the theory of the second best; introduction to game theory; adverse selection, signaling, screening and moral hazard.",Spring,https://catalog.iastate.edu/azcourses/econ/
ECON,6040,Advanced Macroeconomic Analysis,4.,"Lecture 4, Discussion 1.",,,,,"Topics will be selected from: new Keynesian approaches to business cycle theory; endogenously generated business cycles; models of credit and financial intermediation; mechanism design and time inconsistency issues; political economy models; heterogeneous-agent models with strategic interaction; path dependence, network effects, and lock-in; economies as evolving self-organizing systems.",Fall,https://catalog.iastate.edu/azcourses/econ/
ECON,6060,Advanced Topics in Macroeconomics,3.,Lecture 3.,,,,,Selected topics in macroeconomic theory of current significance to the profession.,,https://catalog.iastate.edu/azcourses/econ/
ECON,6150,Industrial Organization I,3.,Lecture 3.,,,,,"Introduction to industrial organization theory and game-theoretic methods. Monopoly and price discrimination. Oligopoly theory and product differentiation. Quality and asymmetric information. Research & development and innovation. Introduction to empirical methods in industrial organization. Discrete choice models of product differentiation. Cost and production functions. Entry, exit, and dynamic equilibrium models.",,https://catalog.iastate.edu/azcourses/econ/
ECON,6180,Game Theory,3.,Lecture 3.,,,,,"Theoretical analysis and applications of strategic games, extensive form games, and cooperative games. Nash equilibrium, correlated equilibrium, Bayesian games, subgame perfect equilibrium, the core, evolutionary equilibrium, repeated games with finite automata, and common knowledge.",,https://catalog.iastate.edu/azcourses/econ/
ECON,6210,Advanced Labor Demand and Labor Markets,3.,Lecture 3.,,,,,"Analysis of labor demand, job search and matching, unemployment, market determination of wages, compensating differentials, employment contracts and incentives, wage inequality and discrimination, effects of minimum wage legislation, occupation choice, labor unions.",Spring,https://catalog.iastate.edu/azcourses/econ/
ECON,6410,Agricultural Economics I,3.,Lecture 3.,,,,,"Advanced treatment of selected topics and models in agricultural economics, with policy analysis applications. Topics include: farm-level input and output choices; decision making under uncertainty; supply analysis, storage and commodity markets; risk management and hedging; crop insurance; credit markets; farmland prices; market integration.",,https://catalog.iastate.edu/azcourses/econ/
ECON,6420,Agricultural Economics II,3.,Lecture 3.,,,,,"Advanced treatment of selected topics and models in agricultural economics, with policy analysis applications. Topics include: demand systems for food and agricultural goods; imperfect competition and market power in agriculture; contracts; economics of R&D and innovation; quality and product differentiation; equilibrium models for agricultural policy analysis.",,https://catalog.iastate.edu/azcourses/econ/
ECON,6530,Financial Economics,3.,Lecture 3.,,,,,"Review of decision-making under uncertainty. Portfolio Theory. Theoretical foundations of asset valuation models: capital asset pricing model (CAPM), arbitrage pricing theory (APT), representative agent models, pricing of derivative securities. Complete and incomplete asset markets, credit markets, financial intermediaries, the role of government in the financial sector. Market frictions, crashes, bubbles. Applications of asset valuation models, with emphasis on their testable implications.",,https://catalog.iastate.edu/azcourses/econ/
ECON,6550,International Trade,3.,Lecture 3.,,,,,Theories of international trade; welfare and distributional aspects of trade and commercial policies. Optimal trade policies in the presence of domestic distortions; strategic trade policy; international trade and economic growth.,,https://catalog.iastate.edu/azcourses/econ/
ECON,6570,International Finance,3.,Lecture 3.,,,,,The intertemporal approach to current account determination; non-traded goods and the real exchange rate; fiscal policy in the open economy; monetary approach to balance of payments and exchange rate determination; sticky price models of the open economy; exchange-rate based stabilizations; capital inflows; financial and balance of payments crises; international business cycles.,,https://catalog.iastate.edu/azcourses/econ/
ECON,6710,Econometrics I,4.,"Lecture 4, Discussion 1.",,,,,"Probability and distribution theory for univariate and multivariate normal random variables, introduction to the theory of estimators for linear models, hypothesis testing and inference, introduction to large sample properties of estimators; derivation of common estimators and their properties for the classical and general multiple regression models, hypothesis testing, forecasting, implications of specification errors - missing data, left-out regressors, measurement error, stochastic regressors.",Fall,https://catalog.iastate.edu/azcourses/econ/
ECON,6720,Econometrics II,4.,"Lecture 4, Discussion 1.",,,,,"Identification, estimation, and evaluation of systems of simultaneous equations; qualitative choice and limited dependent variable models; introduction to time series methods and applications, including alternative variance specifications.",Spring,https://catalog.iastate.edu/azcourses/econ/
ECON,6730,Microeconometrics,3.,Lecture 3.,,,,,"Econometric treatment of models arising in microeconometric applications. Methods are primarily concerned with the analysis of cross-section data. Topics may include: systems of demand equations in panel data settings, random utility models of discrete choices, production possibilities frontier estimation, and discrete/continuous models of participation and consumption.",,https://catalog.iastate.edu/azcourses/econ/
ECON,6740,Macroeconometrics,3.,Lecture 3.,,,,,"Time-series econometric techniques and their application to macroeconomics and financial markets. Techniques may include GARCH and ARCH-M models, unit-root tests, nonlinear adjustment models, structural VARs, and cointegration tests.",,https://catalog.iastate.edu/azcourses/econ/
ECON,6800,Advanced Resource Economics,3.,Lecture 3.,,,,,"Dynamic allocation of scarce, exhaustible, and renewable natural resources, including minerals and energy, soil, water, forests, and fish. Social versus private decisions. Market and nonmarket considerations. Technological change. Regulation. Dynamics and uncertainty.",,https://catalog.iastate.edu/azcourses/econ/
ECON,6900,Advanced Topics,1-5.,Lecture 5.,,,True,,Offered on a satisfactory-fail basis only.,"Fall, Spring, Summer",https://catalog.iastate.edu/azcourses/econ/
ECON,6940A,Research Workshop,3.,Lecture 3.,,,,Instructor Permission for Course,"Instruction in basic and applied research methods commonly used in economics. Survey methodologies, critique written work, summarize and evaluate data, prepare and present work orally, and develop an original research paper. Satisfactory-fail only.",Fall,https://catalog.iastate.edu/azcourses/econ/
ECON,6940B,Research Workshop,3.,"Lecture 2, Discussion 1.",,,,ECON 6940A,"Writing and communicating economic research. Continuation of ECON 6940A , resulting in completion of an original research paper. Satisfactory-fail only. Offered on a satisfactory-fail basis only.",Spring,https://catalog.iastate.edu/azcourses/econ/
ECON,6990,Research for Thesis or Dissertation,1-30.,,,,True,,Offered on a satisfactory-fail basis only.,"Fall, Spring, Summer",https://catalog.iastate.edu/azcourses/econ/
