subject_code,course_number,title_name,credits,contact_hours,cross_listed,dual_listed,repeatable,prerequisites,description,typically_offered,source_url
EM,3240,Mechanics of Materials,3.,Lecture 3.,,,,CE 2740,"Plane stress, plane strain, stress-strain relationships, and elements of material behavior. Application of stress and deformation analysis to members subject to centric, torsional, flexural, and combined loadings. Elementary considerations of theories of failure, buckling.","Fall, Spring, Summer",https://catalog.iastate.edu/azcourses/e_m/
EM,3270,Mechanics of Materials Laboratory,1.,Laboratory 2.,,,,EM 3240,Experimental determination of mechanical properties of selected engineering materials. Experimental verification of assumptions made in 3240. Use of strain measuring devices. Preparation of reports.,"Fall, Spring",https://catalog.iastate.edu/azcourses/e_m/
EM,3620,Principles of Nondestructive Testing,3.,Lecture 3.,,,,PHYS 1320 OR PHYS 2320 or PHYS 2320H,"Radiography, ultrasonic testing, magnetic particle inspection, eddy current testing, dye penetrant inspection, and other techniques. Physical bases of nondestructive tests, materials to which applicable, effects of material condition, types of defects detectable, calibration standards, and reliability safety precautions.","Fall, Spring",https://catalog.iastate.edu/azcourses/e_m/
EM,3620L,Nondestructive Testing Laboratory,1.,Laboratory 2.,,,,Credit or enrollment in MATE 3620 or EM 3620,"Application of nondestructive testing techniques to the detection and sizing of flaws in materials and to the characterization of material's microstructure. Included are experiments in hardness, dye penetrant, magnetic particle, x-ray, ultrasonic and eddy current testing.","Fall, Spring",https://catalog.iastate.edu/azcourses/e_m/
EM,4170,Experimental Mechanics,3.,"Lecture 2, Laboratory 2.",,,,"EM 3240 , and MATE 2730","Introduction to fundamental concepts for force, displacement, stress and strain measurements for structures and materials applications. Strain gage theory and application. Full field deformation measurements with laser interferometry and digital image processing. Advanced experimental concepts at the micro- and nano-scale regimes. Selected laboratory experiments. Offered even-numbered years.",Fall,https://catalog.iastate.edu/azcourses/e_m/
EM,4240,Intermediate Mechanics of Materials,3.,Lecture 3.,,,,EM 3240,"Analysis of stresses, strains, and deflections. Torsion and bending of unsymmetrical members. Analysis of thick wall pressure vessels and shrink fit problems. Dynamic load effects, fatigue and fracture mechanics introduction. Work-strain energy methods.","Fall, Spring",https://catalog.iastate.edu/azcourses/e_m/
EM,4250,Introduction to the Finite Element Method,3.,Lecture 3.,,,,EM 3240 and MATH 2660 or MATH 2670,"Introduction of finite element analysis through applications to one-dimensional, steady-state problems such as elastic deformation, heat and fluid flow, consolidation, beam bending, and mass transport. Transient heat conduction and wave propagation. Two-dimensional triangular and quadrilateral elements. Plane problems of torsion, thermal and potential flow, stress analysis. Simple computer programs for one- and two-dimensional problems.",Spring,https://catalog.iastate.edu/azcourses/e_m/
EM,4510,Engineering Acoustics,3.,Lecture 3.,,,,[(MATH 2660 OR MATH 2670) AND PHYS 2310 AND 2310L] OR Graduate Standing,The basics of acoustic wave propagation in fluids with an emphasis on sound propagation in air. Topics include transmission and reflection of sound at a boundary; role of acoustic sources in directing sound fields; diffraction of sound around solid objects; reverberation of sound in a room; and the measurement of sound fields.,Fall,https://catalog.iastate.edu/azcourses/e_m/
EM,4800,Ultrasonic Nondestructive Evaluation,3.,Lecture 3.,,,,EM 3240 or MATE 3190 ; MATH 2660 or MATH 2670 ; PHYS 2320,"Introduction to stress/strain, Hooke's law, and elastic wave propagation in two dimensions in isotropic media. Ultrasonic plane-wave reflection and transmission; and simple straight-crested guided waves. Transducer construction, behavior, and performance. Simple signal analysis and discrete signal processing. The last few weeks of the course are devoted to case studies.",Spring,https://catalog.iastate.edu/azcourses/e_m/
EM,4900,Independent Study,1-30.,,,,True,Instructor Permission for Course,,"Fall, Spring, Summer",https://catalog.iastate.edu/azcourses/e_m/
EM,4900H,Independent Study: Honors,1-30.,,,,True,Permission of Instructor; Membership in the University Honors Program,,"Fall, Spring, Summer",https://catalog.iastate.edu/azcourses/e_m/
EM,5100,Continuum Mechanics,3.,Lecture 3.,,,,Graduate Standing or Permission of Instructor,"Introduction to Cartesian tensors as linear vector transformations. Kinematics of continuous deformations, Lagrangian and Eulerian descriptions of motion. Fundamental equations or balance laws of continuous media, linear and angular momentum balance. Conservation laws of momentum and energy. Introduction to constitutive equations of classical elastic solids and simple fluids. Formulations and solutions of some canonical problems.",Fall,https://catalog.iastate.edu/azcourses/e_m/
EM,5140,Advanced Mechanics of Materials,3.,Lecture 3.,,,,Graduate Standing or Permission of Instructor,"Theory of stress and strain, stress-strain relationships. Unsymmetrical bending, curved beams, shear center. Torsion of thin-walled noncircular sections. Equilibrium, compatibility equations. Airy stress functions. Membrane stresses in shells, thick-walled cylinders.",Fall,https://catalog.iastate.edu/azcourses/e_m/
EM,5160,Applied Elasticity and Mechanics of Deformable Solids,3.,Lecture 3.,,,,Graduate Standing or Permission of Instructor,"Fundamental mechanics of linear elasticity, formulation and solution of simple elastostatic boundary value problems. Kinematics of small deformations, constitutive equations for isotropic and anisotropic media. Field equations for elastic solids, plane strain/plane stress and some classic analytical solutions such as Boussinesq, Hertz, Kirsch, Lame, and Mitchell. Stress functions and potential methods and introduction to finite elements.",Spring,https://catalog.iastate.edu/azcourses/e_m/
EM,5170,Experimental Mechanics,3.,"Lecture 2, Laboratory 2.",,,,Graduate Standing or Permission of Instructor,"Introduction to fundamental concepts for force, displacement, stress and strain measurements for structures and materials applications. Strain gage theory and application. Full field deformation measurements with laser interferometry and digital image processing. Advanced experimental concepts at the micro- and nano-scale regimes. Selected laboratory experiments. Offered even-numbered years.",Fall,https://catalog.iastate.edu/azcourses/e_m/
EM,5180,Waves in Elastic Solids with Applications to Ultrasonic Nondestructive Evaluation,3.,Lecture 3.,,,,Graduate Standing or Permission of Instructor,"Propagation of bulk waves, surface waves, and guided waves in isotropic and anisotropic elastic media. Transmission and reflection of waves at plane and curved interfaces. Radiation of sources with application to ultrasonic transducer beam modeling. Elastic wave scattering from cracks and inclusions. Reciprocity principles and their use in the development of an ultrasonic measurement model. Characterization and measurement of material attenuation.",Fall,https://catalog.iastate.edu/azcourses/e_m/
EM,5250,Finite Element Analysis,3.,Lecture 3.,,,,Graduate Standing or Permission of Instructor,"Variational and weighted residual approach to finite element equations. Emphasis on two- and three-dimensional problems in solid mechanics. Isoparametric element formulation, higher order elements, numerical integration, imposition of constraints and penalty, convergence, and other more advanced topics. Use of two- and three-dimensional computer programs. Dynamic and vibrational problems, eigenvalues, and time integration. Introduction to geometric and material nonlinearities.",Spring,https://catalog.iastate.edu/azcourses/e_m/
EM,5260,Boundary Element Methods in Engineering,3.,Lecture 3.,,,,Graduate Standing or Permission of Instructor,"Introductory boundary element methods through plane problems. Singular integrals, Cauchy principal values, integral representations and boundary integrals in one dimension. Direct and indirect formulations. Plane potential and elastostatic problems. Higher order elements, numerical integration. Regularizations. Body forces and infinite regions. Specialized fundamental solutions, half-plane and axisymmetric problems. Diffusion and wave problems. Coupling with finite elements. Offered even-numbered years.",Fall,https://catalog.iastate.edu/azcourses/e_m/
EM,5430,Introduction to Random Vibrations and Nonlinear Dynamics,3.,Lecture 3.,,,,Graduate Standing or Permission of Instructor,"Vibrations of continuous systems. Nonlinear vibration phenome, perturbation expansions; methods of multiple time scales and slowly-varying amplitude and phase. Characteristics of random vibrations; random processes, probability distributions, spectral density and its significance, the normal or Gaussian random process. Transmission of random vibration, response of simple single and two-degree-of-freedom systems to stationary random excitation. Fatigue failure due to random excitation. Offered odd-numbered years.",Spring,https://catalog.iastate.edu/azcourses/e_m/
EM,5480,Advanced Engineering Dynamics,3.,Lecture 3.,,,,"EM 3450, MATH 2660 or MATH 2670","3-D kinematics and dynamics of particles and rigid bodies. Coordinate systems, calculus of variations. Lagrange's equations with constraints, modified Euler's equations, torque-free motion of rigid bodies in 3-D, moment equations with constraints. Offered even-numbered years.",Spring). ( Typically Offered: Spring,https://catalog.iastate.edu/azcourses/e_m/
EM,5500,Nondestructive Evaluation,4.,"Lecture 3, Laboratory 2.",,,,Graduate Standing or Permission of Instructor,"Principles of five basic NDE methods and their application in engineering inspections. Materials behavior and simple failure analysis. NDE reliability, and damage-tolerant design. Advanced methods such as acoustic microscopy, laser ultrasonics, thermal waves, and computed tomography are analyzed. Computer-based experiments on a selection of methods: ultrasonics, eddy currents, x-rays are assigned for student completion.",Spring,https://catalog.iastate.edu/azcourses/e_m/
EM,5640,Fracture and Fatigue,3.,Lecture 3.,,,,Graduate Standing or Permission of Instructor,"Materials and mechanics approach to fracture and fatigue. Fracture mechanics, brittle and ductile fracture, fracture and fatigue characteristics, fracture of thin films and layered structures. Fracture and fatigue tests, mechanics and materials designed to avoid fracture or fatigue. Offered even-numbered years.",Fall,https://catalog.iastate.edu/azcourses/e_m/
EM,5660,Phase Transformation in Elastic Materials,3.,Lecture 3.,,,,Graduate Standing or Permission of Instructor,Continuum thermodynamics and kinetics approaches to phase transformations. Phase field approach to stress- and temperature-induced martensitic transformations and twinning at the nanoscale. Nucleation and growth. Nanostructural evaluation. Analytical and numerical solutions. Surface stresses and energy. Surface-induced phase transformations. Large Strain formulation.,Spring,https://catalog.iastate.edu/azcourses/e_m/
EM,5670,Nanomechanics of Materials,3.,Lecture 3.,,,,Graduate Standing or Permission of Instructor,"Continuum theoretical and computational approaches to material deformation and nanostructure evolution. Thermodynamics and kinetics. Nucleation and growth. Surface and interface tension and phenomena. Chemical reactions, phase transformations, and dislocation evolution.",Spring,https://catalog.iastate.edu/azcourses/e_m/
EM,5690,Mechanics of Composite and Combined Materials,3.,Lecture 3.,,,,EM 3240,Mechanics of fiber-reinforced materials. Micromechanics of lamina. Macromechanical behavior of lamina and laminates. Strength and interlaminar stresses of laminates. Failure criteria. Stress analysis of laminates. Thermal moisture and residual stresses. Joints in composites. Offered even-numbered years.,Spring,https://catalog.iastate.edu/azcourses/e_m/
EM,5700,Wind Engineering,3.,Lecture 3.,,,,ABE 3780 and ME 3450,"Atmospheric circulations, atmospheric boundary layer wind, bluff-body aerodynamics, aeroelastic phenomena, wind-tunnel and full-scale testing, wind-load code and standards, effect of tornado and thunderstorm winds, design applications. Offered odd-numbered years.",Spring,https://catalog.iastate.edu/azcourses/e_m/
EM,5800,Phase Transformations and Plasticity,3.,Lecture 3.,,,,Graduate Standing or Permission of Instructor,"Continuum approaches to phase transformations and plasticity at nano-, micro-, and macroscales. Interaction between phase transformations and plasticity and different scales. Temperature-, stress-, and strain-induced phase transformations. Transformation-induced plasticity. Thermodynamics and kinetics. Nucleation and growth. Large strain formulation. High pressure phenomena and theories.",Fall,https://catalog.iastate.edu/azcourses/e_m/
EM,5840,High Pressure Mechanics and Phase Transformations,3.,Lecture 3.,,,,Graduate Standing or Permission of Instructor,"Techniques for producing static high pressure and measurements. Traditional and rotational diamond anvil cell. Phase diagrams. Pressure, stress, and plastic strain induced phase transformations: continuum thermodynamics and kinetics. Elasticity and plastic flow under high pressure. Transformation pressure hysteresis. Material synthesis and search for new phases. Interaction between phase transformations and plasticity under high pressure. High pressure mechanochemistry. Multiscale modeling.",,https://catalog.iastate.edu/azcourses/e_m/
EM,5860,Micromechanics of Structural Changes in Materials,3.,"Lecture 2, Discussion 1.",,,,Graduate Standing or Permission of Instructor,"Continuum and micromechanical approaches to material deformation, phase transformations, and microstructure evolution. Thermodynamics and kinetics. Eshelby inclusion. Interface propagation and reorientation. Microscale phase field approach. Large strain formulation. Phase transformations, chemical reactions, twinning, and fracture.",Fall,https://catalog.iastate.edu/azcourses/e_m/
EM,5900F,Engineering Mechanics Special Topics: Introduction to Dislocation and Plasticity,1-4.,,,,True,Graduate Standing or Permission of Instructor,,"Fall, Spring, Summer",https://catalog.iastate.edu/azcourses/e_m/
EM,5900H,Engineering Mechanics Special Topics: Mechanics of Thin Films and Adhesives,1-4.,,,,True,Instructor Permission for Course,,"Fall, Spring, Summer",https://catalog.iastate.edu/azcourses/e_m/
EM,5900I,Engineering Mechanics Special Topics: Mechanics of Cellular and Porous Media,1-4.,,,,True,Instructor Permission for Course,,"Fall, Spring, Summer",https://catalog.iastate.edu/azcourses/e_m/
EM,5900J,Engineering Mechanics Special Topics: Other,1-4.,,,,True,Instructor Permission for Course,,"Fall, Spring, Summer",https://catalog.iastate.edu/azcourses/e_m/
EM,5990,Creative Component,1-30.,,,,True,Instructor Permission for Course,,"Fall, Spring, Summer",https://catalog.iastate.edu/azcourses/e_m/
EM,6900N,Engineering Mechanics Special Topics: Advanced Experimental Methods,1-6.,,,,True,Instructor Permission for Course,,"Fall, Spring, Summer",https://catalog.iastate.edu/azcourses/e_m/
EM,6900O,Engineering Mechanics Special Topics: Advanced Wave Propagation,1-6.,,,,True,Instructor Permission for Course,,"Fall, Spring, Summer",https://catalog.iastate.edu/azcourses/e_m/
EM,6900P,Engineering Mechanics Special Topics: Advanced Materials,1-6.,,,,True,Instructor Permission for Course,,"Fall, Spring, Summer",https://catalog.iastate.edu/azcourses/e_m/
EM,6900Q,Engineering Mechanics Special Topics: Advanced Computational Methods,1-6.,,,,True,Instructor Permission for Course,,"Fall, Spring, Summer",https://catalog.iastate.edu/azcourses/e_m/
EM,6900R,Engineering Mechanics Special Topics: Reliability and Failure,1-6.,,,,True,Instructor Permission for Course,,Fall,https://catalog.iastate.edu/azcourses/e_m/
EM,6900S,Engineering Mechanics Special Topics: Other,1-6.,,,,True,Instructor Permission for Course,,"Fall, Spring, Summer",https://catalog.iastate.edu/azcourses/e_m/
EM,6970,Engineering Internship,Required.,,,,True,,One semester and one summer maximum per academic year professional work period. Offered on a satisfactory-fail basis only.,"Fall, Spring, Summer",https://catalog.iastate.edu/azcourses/e_m/
EM,6990,Research,1-30.,,,,True,Instructor Permission for Course,,"Fall, Spring, Summer",https://catalog.iastate.edu/azcourses/e_m/
