subject_code,course_number,title_name,credits,contact_hours,cross_listed,dual_listed,repeatable,prerequisites,description,typically_offered,source_url
ENVS,1010,Environmental Geology: Earth in Crisis,3.,Lecture 3.,,,,,"Exploration of the interactions between humans and the geologic environment, and the consequences of those interactions, on local to global scales. Discussion of water, soil, mineral, and energy resources, pollution, climate change, and natural hazards such as earthquakes, volcanism, mass wasting, and flooding.","Fall, Spring, Summer",https://catalog.iastate.edu/azcourses/env_s/
ENVS,1080,Introduction to Oceanography,3.,Lecture 3.,,,,,"Introduction to the study of oceans and the processes that helped shape them. A major focus is on how the oceans work, with special attention on geological, chemical, and biological processes. Ocean circulation and its influence on climate. Life of the oceans. Use and misuse of ocean resources. Anthropogenic impacts on the oceanic environment.",Fall,https://catalog.iastate.edu/azcourses/env_s/
ENVS,1110,Geological Disasters,1.,Lecture 1.,,,,,"Introduction to the catastrophic geologic processes with the potential to devastate human populations that continue to expand into regions at greatest risk from geologic hazards. Selected case studies and discussion of plate tectonics, climate, and earth processes explain the driving forces behind natural hazards such as earthquakes, tsunamis, volcanic eruptions, landslides, and floods.","Fall, Spring, Summer",https://catalog.iastate.edu/azcourses/env_s/
ENVS,1200,Introduction to Renewable Resources,3.,Lecture 3.,,,,,"Overview of soil, water, plants, and animals as renewable natural resources in an ecosystem context. History and organization of resource management. Concepts of integrated resource management.","Fall, Spring",https://catalog.iastate.edu/azcourses/env_s/
ENVS,1300,Natural Resources and Agriculture,3.,Lecture 3.,,,,,"Survey of the ecology and management of fish, forest, and wildlife resources in areas of intensive agriculture, with emphasis on Iowa. Conservation and management practices for private agricultural lands. Designed for nonmajors.",Spring,https://catalog.iastate.edu/azcourses/env_s/
ENVS,1400,Climate and Society,3.,Lecture 3.,,,,,"The climate system of our planet. How nature and our actions alter the existing energy balance leading to climate change. Past climates on our planet. The influence of climate on society and resource availability during the Holocene (~ 11,000 years ago to present) with focus on changes post industrial revolution. Significant climate events that have altered our way of life in the past. Projected changes in future climate and potential impacts on society, environment and resources. Adaption to and mitigation of climate change. Meets International Perspectives Requirement.","Fall, Spring",https://catalog.iastate.edu/azcourses/env_s/
ENVS,1600,Water Resources of the World,3.,Lecture 3.,,,,,"Study of the occurrence, history, development, and management of world water resources. Basic hydrologic principles including climate, surface water, groundwater, and water quality. Historical and current perspectives on water policy, use, and the role of water in society and the environment. Meets International Perspectives Requirement.",Spring,https://catalog.iastate.edu/azcourses/env_s/
ENVS,1730,Environmental Biology,3.,Lecture 3.,,,,,"An introduction to the structure and function of natural systems at scales from the individual to the biosphere and the complex interactions between humans and their environment. Discussions of human population growth, biodiversity, sustainability, resource use, and pollution. Does not satisfy biology major requirements.","Fall, Spring",https://catalog.iastate.edu/azcourses/env_s/
ENVS,2010,Introduction to Environmental Issues,2.,Lecture 2.,,,,,"Discussion of current and emerging environmental issues such as human population growth, energy use, loss of biodiversity, water resources, and climate change.",Fall,https://catalog.iastate.edu/azcourses/env_s/
ENVS,2040,Biodiversity,2.,Lecture 4.,,,,,"Survey of the major groups of organisms and biological systems. Definition, measurements, and patterns of distribution of organisms. Sources of information about biodiversity. Does not satisfy biology major requirements. Half semester course. See list of life science courses (https://www.cals.iastate.edu/student-services/lifescience) for additional information.",Spring,https://catalog.iastate.edu/azcourses/env_s/
ENVS,2200,Globalization and Sustainability,3.,Lecture 3.,,,,,"An introduction to understanding the key global issues in sustainability. Focuses on interconnected roles of energy, materials, human resources, economics, and technology in building and maintaining sustainable systems. Applications discussed will include challenges in both the developed and developing world and will examine the role of technology in a resource-constrained world. Graduation Restriction: Cannot be used for technical elective credit in any engineering department. Meets International Perspectives Requirement.","Fall, Spring",https://catalog.iastate.edu/azcourses/env_s/
ENVS,2500,Environmental Geography,3.,Lecture 3.,,,,,"The distribution, origins and functions of the earth's physical systems and the spatial relationship between human activity and the natural world.",Fall,https://catalog.iastate.edu/azcourses/env_s/
ENVS,2700,Foundations in Natural Resource Policy and History,3.,Lecture 3.,,,,,"The development of natural resource conservation philosophy and policy from the Colonial Era to the present. North American wildlife, forestry, and environmental policy; national parks and other protected lands; federal and state agencies. Relationship to cultural contexts, including urban reform and American planning movement. Discussion of common pool resources, public and private lands.",Fall,https://catalog.iastate.edu/azcourses/env_s/
ENVS,2830,Introduction to Environmental Politics and Policies,3.,Lecture 3.,,,,,"Introduction to major ideologies' relations to conservation and ecology. Processes, participants, and institutions involved in state, national, and global environmental policymaking. Case studies of environmental controversies and proposals for policy reform.",Spring,https://catalog.iastate.edu/azcourses/env_s/
ENVS,2930,Environmental Planning,3.,"Lecture 2, Laboratory 2.",,,,,"Comprehensive overview of the field of environmental relationships and the efforts being made to organize, control, and coordinate environmental, aesthetic, and cultural characteristics of land, air, and water.","Fall, Spring",https://catalog.iastate.edu/azcourses/env_s/
ENVS,3190,Analysis of Environmental Systems,3.,,,,,ENSCI 3120 ; junior classification,"Systems approach to the analysis and modeling of material and energy flows in natural and managed environmental systems and the primary environmental factors controlling these systems. Applications in hydrology, biogeochemistry, and population dynamics.",Spring,https://catalog.iastate.edu/azcourses/env_s/
ENVS,3200,Ecofeminism,3.,Lecture 3.,,,,WGS 2010 or 3 credits in WGS at 3000 level or above,"Women's relationships with the earth, non-human nature, and other humans. The course explores the connections between society's treatment of women and nature; origins of ecofeminism and how it relates to the science of ecology, conventional and sustainable agriculture as well as how ecofeminism relates to other branches of feminist philosophy. Evaluation and critique of modern science, technology, political systems and SOLUTIONS will be included.",,https://catalog.iastate.edu/azcourses/env_s/
ENVS,3240,Energy and the Environment,3.,Lecture 3.,,,,,"Exploration of Earth's energy resources and the environmental and climatic impacts of energy acquisition and consumption. Renewable and non-renewable energy resources within an Earth-system context. Various environmentally-relevant topics such as water quality and availability, habitat destruction, greenhouse-gas emissions, and health and safety hazards to wildlife and human communities. Designed for students with a college-level understanding of chemistry and physics.",Spring,https://catalog.iastate.edu/azcourses/env_s/
ENVS,3340,Environmental Ethics,3.,Lecture 3.,,,,3 credits in PHIL or Permission of Instructor,"Thorough study of some of the central moral issues arising in connection with human impact on the environment, e.g., human overpopulation, species extinction, forest and wilderness management, pollution. Several world views of the proper relationship between human beings and nature will be explored.",Fall,https://catalog.iastate.edu/azcourses/env_s/
ENVS,3360X,Climate Change Policy,3.,Lecture 3.,,,,3 credits in POLS OR ECON 1010 OR Sophomore Classification,"Policy-centered approach to climate-change solutions. Investigation, analysis, and evaluation of policy responses to the prospect and occurrence of climate change. Politics of climate-related technological, regulatory, and societal changes. Interaction of social movements, institutions, and economic interests in shaping national and global responses to climate change.",Spring,https://catalog.iastate.edu/azcourses/env_s/
ENVS,3420,World Food Issues: Past and Present,3.,Lecture 3.,,,,Junior classification,"Issues associated with global agricultural and food systems including ethical, social, economic, environmental, and policy contexts. Investigation of various causes and consequences of overnutrition/undernutrition, global health, poverty, hunger, access, and distribution. Meets International Perspectives Requirement.","Fall, Spring, Summer",https://catalog.iastate.edu/azcourses/env_s/
ENVS,3450,Population and Society,3.,Lecture 3.,,,,,"History of present and future of human populations. How human population growth and structure impacts our world, influencing food and the environment, causes of death, fertility rates, and international migration. Compare the U.S. with other societies worldwide. Understand population policies and their impacts on climate, social and economic inequalities, and human well-being. Gain hands-on experience practicing demographic techniques and applying demographic data to real-world population problems. Meets International Perspectives Requirement.","Fall, Spring",https://catalog.iastate.edu/azcourses/env_s/
ENVS,3550,Literature and the Environment,3.,Lecture 3.,,,,ENGL 2500,"Focused study of texts that address a wide range of environmental issues, including the relationship between humans and natural/urban environments, views of other-than-human beings, food, climate change, extinction, and social and racial justice. Assignments for the course may include research, exams, writing, and/or individual/group projects.",,https://catalog.iastate.edu/azcourses/env_s/
ENVS,3620,Global Environmental History,3.,Lecture 3.,,,,Sophomore classification,"Survey of the interactions of human communities with their environments from the beginnings of human history to the present. Topics include the domestication of animals, the agricultural revolution, industrialization, urbanization, deforestation, hydraulic management, fossil fuel consumption, and climate change.",Fall,https://catalog.iastate.edu/azcourses/env_s/
ENVS,3630,U. S. Environmental History,3.,Lecture 3.,,,,Sophomore classification,"Survey of the interactions of human communities with the North American environment. Focus on the period from presettlement to the present, with a particular concentration on natural resources, disease, settlement patterns, land use, and conservation policies.",,https://catalog.iastate.edu/azcourses/env_s/
ENVS,3800,"Energy, Environmental and Resource Economics",3.,Lecture 3.,,,,ECON 1010,"Natural resource availability, use, conservation, and government policy, with emphasis on energy issues. Environmental quality and pollution control policies.",,https://catalog.iastate.edu/azcourses/env_s/
ENVS,3820,Environmental Sociology,3.,Lecture 3.,,,,,"Environment-society relations; social construction of nature and the environment; social and environmental impacts of resource extraction, production, and consumption; environmental inequality; environmental mobilization and movements; U.S. and international examples. Meets International Perspectives Requirement. Meets International Perspectives Requirement.",Spring,https://catalog.iastate.edu/azcourses/env_s/
ENVS,3900,Internship in Environmental Studies,1-30.,,,,True,Program Coordinator Permission for Course,"Practical experience with nature centers, government agencies, schools, private conservation groups, and other organizations. Offered on a satisfactory-fail basis only.","Fall, Spring, Summer",https://catalog.iastate.edu/azcourses/env_s/
ENVS,4040,Global Change,3.,Lecture 3.,,,,,"Recent changes in global biogeochemical cycles and climate; models of future changes in the climate system; impacts of global change on agriculture, water resources and human health; ethical issues of global environmental change.","Fall, Spring",https://catalog.iastate.edu/azcourses/env_s/
ENVS,4070,Watershed Management,4.,"Lecture 3, Laboratory 3.",,,,1 course in BIOL,"Managing human impacts on the hydrologic cycle. Field and watershed level best management practices for modifying the impacts on water quality, quantity and timing are discussed. Field project includes developing a management plan using landscape buffers.",Spring,https://catalog.iastate.edu/azcourses/env_s/
ENVS,4240,Sustainable and Environmental Horticulture Systems,3.,Lecture 3.,,,,,"Inquiry into ethical issues and environmental consequences of horticultural cropping systems, production practices and managed landscapes. Emphasis on systems that are resource efficient, environmentally sound, socially acceptable, and profitable.",Spring,https://catalog.iastate.edu/azcourses/env_s/
ENVS,4500,Issues in Sustainable Agriculture,3.,Lecture 3.,,,,Junior classification,Agricultural science as a human activity; contemporary agricultural issues from agroecological perspective. Comparative analysis of intended and actual consequences of agricultural practices from the perspective of ethics and sustainable agriculture.,Spring,https://catalog.iastate.edu/azcourses/env_s/
ENVS,4600,Controversies in Natural Resource Management,3.,Lecture 3.,,,,"WFCE 3120 or NREM 3010, NREM 1200, and Junior classification","Analysis of controversial natural resource issues using a case approach that considers uncertainty and adequacy of information and scientific understanding. Ecological, social, political, economic, and ethical implications of issues will be analyzed.","Fall, Spring",https://catalog.iastate.edu/azcourses/env_s/
ENVS,4840,Sustainable Communities,3.,Lecture 3.,,,,Junior classification,The history and theory of sustainable community planning. Procedural and substantive dimensions. Case studies of communities engaged in sustainability planning. Use and development of indicators.,Spring,https://catalog.iastate.edu/azcourses/env_s/
ENVS,4900,Independent Study,1-30.,,,,True,Program Coordinator Permission for Course,,"Fall, Spring, Summer",https://catalog.iastate.edu/azcourses/env_s/
ENVS,4900H,Independent Study: Honors,1-30.,,,,True,Program Coordinator Permission; Membership in the University Honors Program,,"Fall, Spring, Summer",https://catalog.iastate.edu/azcourses/env_s/
ENVS,4910,Environmental Law and Planning,3.,Lecture 3.,,,,6 credits natural sciences or permission of instructor,"Environmental law and policy as applied in planning at the local and state levels. Brownfields, environmental justice, water quality, air quality, wetland and floodplain management, and local government involvement in ecological protection through land use planning and other programs.",Spring,https://catalog.iastate.edu/azcourses/env_s/
ENVS,4960A,International Tour,1-30.,,,,True,Sophomore classification,Extended field trips to study environmental topics in varied locations. Location and duration of trips will vary. Trip expenses paid by students. Check with department for current offerings.,"Fall, Spring, Summer",https://catalog.iastate.edu/azcourses/env_s/
ENVS,4960B,Domestic Tour,1-30.,,,,True,Sophomore classification,Extended field trips to study environmental topics in varied locations. Location and duration of trips will vary. Trip expenses paid by students. Check with department for current offerings.,"Fall, Spring, Summer",https://catalog.iastate.edu/azcourses/env_s/
