subject_code,course_number,title_name,credits,contact_hours,cross_listed,dual_listed,repeatable,prerequisites,description,typically_offered,source_url
HDFS,1020,Human Development,3.,Lecture 3.,,,,,"Overview of life-span developmental tasks (physical, cognitive, language, social, emotional) examined from various theoretical perspectives. Discussion of topics related to individual/family health and well-being and reciprocal relationships as affected by external factors.","Fall, Spring, Summer",https://catalog.iastate.edu/azcourses/hd_fs/
HDFS,1100,Freshman Learning Community Orientation,1.,Lecture 1.,,,,,"Introduction to the Department of Human Development and Family Studies including academic requirements and opportunities, strategies for transitioning to college, learning and study strategies, reading and reflection, and career awareness.",Fall,https://catalog.iastate.edu/azcourses/hd_fs/
HDFS,1110,New Transfer Student Seminar,1.,Lecture 1.,,,,"Human Development and Family Studies, Early Childhood Education, Family and Consumer Sciences Education, and Family Counseling and Planning Undergraduate Majors","Introduction to HDFS curricula and faculty for students in HDFS, FCEDS, ECE, or FCP. Department and University policies and procedures, degree audits, and registration. Exploration of campus resources and strategies for student success. Offered on a satisfactory-fail basis only.","Fall, Spring",https://catalog.iastate.edu/azcourses/hd_fs/
HDFS,1830,Financial Literacy for Life,1.,Lecture 1.,,,,,"Introduction to basic concepts and budgeting practices for management of resources and prevention of financial problems commonly associated with college, including credit and student loans. Offered on a satisfactory-fail basis only.","Fall, Spring, Summer",https://catalog.iastate.edu/azcourses/hd_fs/
HDFS,2080,Foundations of Early Childhood Professions,Required.,Lecture 2.,,,,Early Childhood Education Major or Instructor Permission,"Introduction to historical foundations, delivery systems, ethical responsibilities, and professional practices. Focus on developmentally appropriate, equitable, and inclusive learning contexts as career preparation.",Spring,https://catalog.iastate.edu/azcourses/hd_fs/
HDFS,2200,Introduction to Professional Practice,3.,Lecture 3.,,,,Sophomore classification,"Introduction to the human service field's historical context, delivery systems, ethics, and professional practices. Development of foundational career preparation.","Fall, Spring",https://catalog.iastate.edu/azcourses/hd_fs/
HDFS,2230,Child Development and Health,3.,Lecture 3.,,,,,"Typical and atypical development of children prenatal through middle childhood. Examination of healthy development and potential impact of health issues in children. Discussion of influence of the family and society on development. Graduation Restriction: Either HDFS 2230 or HDFS 2240 , but not both, may be applied toward graduation.",Spring,https://catalog.iastate.edu/azcourses/hd_fs/
HDFS,2240,Child Development,3.,Lecture 3.,,,,PSYCH 2300 or HDFS 1020,"Focus on child development from prenatal through age eight considering developmental stages, milestones and individual differences. Includes theories of child development with attention to physical, communication, cognitive, and social-emotional domains. Exploration of the impact of the family and society on development.","Fall, Spring",https://catalog.iastate.edu/azcourses/hd_fs/
HDFS,2240L,Child Development Practicum,1.,,,,,HDFS 1020 OR PSYCH 2300 ; concurrent enrollment in HDFS 2240 or permission of instructor,"Strategies for observing, recording, and interpreting children’s development. Interactions within multiple learning environments for young children.","Fall, Spring",https://catalog.iastate.edu/azcourses/hd_fs/
HDFS,2260,Development and Guidance in Middle Childhood,3.,Lecture 3.,,,,PSYCH 2300 or HDFS 1020,"Physical, cognitive, socioemotional, and identity development from 5 to 12 years of age. Development within the contexts of family, school, peers, and society. Guidance of children in family and group settings.",Fall,https://catalog.iastate.edu/azcourses/hd_fs/
HDFS,2270,Middle Childhood and Adolescence,3.,Lecture 3.,,,,PSYCH 2300 or HDFS 1020,"Physical, cognitive, socioemotional, and psychosocial development in the contexts of family, schools, peers, relationships, and culture from 8 to 18 years of age. .","Fall, Spring",https://catalog.iastate.edu/azcourses/hd_fs/
HDFS,2340,Young Adulthood Through Later Life,3.,Lecture 3.,,,,PSYCH 2300 or HDFS 1020,"Exploration of the health, individual and social factors associated with adult development including emerging, younger, middle, and older adulthood. Information is presented from a biopsychosocial lens of change across the lifespan. .",Spring,https://catalog.iastate.edu/azcourses/hd_fs/
HDFS,2350X,Exploring Disability,3.,Lecture 3.,,,,PSYCH 2300 or HDFS 1020,"This course explores disability through social, cultural, and educational lenses, focusing on its impact on individuals and families, disability rights and laws, and inclusive practices. Perspectives from individuals with lived experiences are included to illustrate the multifaceted nature of disability throughout the lifespan.",Fall,https://catalog.iastate.edu/azcourses/hd_fs/
HDFS,2390,Consumer Issues,3.,Lecture 3.,,,,,"Introduction to factors affecting consumer decisions of individuals and families, including housing, healthcare, and personal finances. Emphasis on accessibility and affordability, community contexts for families; and consumer protection, legislation and regulation, and consumer fraud. Meets U.S. Cultures and Communities Requirement.","Fall, Spring",https://catalog.iastate.edu/azcourses/hd_fs/
HDFS,2400,Children’s Literature,3.,Lecture 3.,,,,,Evaluation of literature for children with emphasis on diversity and inclusion. Role of literature in the development of children across contexts. Meets U.S. Cultures and Communities Requirement.,"Fall, Spring",https://catalog.iastate.edu/azcourses/hd_fs/
HDFS,2490,Family Studies,3.,Lecture 3.,,,,,"Overview of family life, including the diversity of family structures and characteristics. Strengths-based approaches to supporting healthy family relationships including parenting and caregiving/partnering.","Fall, Spring",https://catalog.iastate.edu/azcourses/hd_fs/
HDFS,2700,Family Communications and Relationships,3.,Lecture 3.,,,,,"Family communication and its function to develop, maintain, enrich and limit family relationships. Family theories related to communication and ethical considerations when working with families.","Fall (annually), Spring (annually), Summer (odd-numbered years). Meets U.S. Cultures and Communities Requirement. ( Typically Offered: Fall, Spring, Summer",https://catalog.iastate.edu/azcourses/hd_fs/
HDFS,2760,Human Sexuality,3.,Lecture 3.,,,,,"Behavioral, biological, and psychological aspects of human sexuality within the social context of family, culture, and society. Role of sexuality in human development. Critical analysis of media and research. Communication and decision-making skills relating to sexuality issues and relationships. Meets U.S. Cultures and Communities Requirement.","Fall, Spring, Summer",https://catalog.iastate.edu/azcourses/hd_fs/
HDFS,2830,Personal Finance,3.,Lecture 3.,,,,,"Introduction to basic principles of personal and family finance. Budgeting, record keeping, checking and savings accounts, consumer credit, insurance, investments, and taxes. Meets U.S. Cultures and Communities Requirement.","Fall, Spring, Summer",https://catalog.iastate.edu/azcourses/hd_fs/
HDFS,2830H,Personal Finance: Honors,3.,Lecture 3.,,,,Membership in the University Honors Program,"Introduction to basic principles of personal and family finance. Budgeting, record keeping, checking and savings accounts, consumer credit, insurance, investments, and taxes. Additional work required to meet Honors requirements. Meets U.S. Cultures and Communities Requirement.","Fall, Spring, Summer",https://catalog.iastate.edu/azcourses/hd_fs/
HDFS,3050X,Play in Childhood,3.,Lecture 3.,,,True,,"Addresses the essential role of play to children’s growth, development, and learning. Examination and analysis of play principles, theories, behaviors, and environments. Explores the roles of adults, programs, schools, and society through opportunities for active play.",Spring,https://catalog.iastate.edu/azcourses/hd_fs/
HDFS,3170B,Field Experiences: Human Development and Family Studies,1-6.,,,,True,Instructor Permission for Course,Consult department office for procedure. Supervised field experience in human development and family studies programs. Offered on a satisfactory-fail basis only.,"Fall, Spring, Summer",https://catalog.iastate.edu/azcourses/hd_fs/
HDFS,3170G,Field Experiences: Financial Counseling and Planning,1-6.,,,,True,Department Permission for Course,Consult department office for procedure. Supervised field experience in human development and family studies programs. Offered on a satisfactory-fail basis only.,"Fall, Spring, Summer",https://catalog.iastate.edu/azcourses/hd_fs/
HDFS,3170H,Field Experiences: Honors,1-6.,,,,True,9 credits in HDFS; Department Permission; Membership in the University Honors Program,Consult department office for procedure. Supervised field experience in human development and family studies programs. Offered on a satisfactory-fail basis only.,"Fall, Spring, Summer",https://catalog.iastate.edu/azcourses/hd_fs/
HDFS,3210,Happiness Across the Lifespan,3.,Lecture 3.,,,,,"Interdisciplinary and relational approach to happiness and well-being at every stage of life. Application of scientifically validated strategies for learning how to live a satisfying and fulfilling life, including how to respond to stress and adapt to life challenges. Emphasis on habit change and implementation for individual and career development.","Fall, Spring",https://catalog.iastate.edu/azcourses/hd_fs/
HDFS,3400,Infant-Toddler Curriculum and Assessment,4.,"Lecture 3, Laboratory 3.",,,,,"Focus on curriculum, assessment, learning environments, teaching strategies, and routines for infant-toddler care and education. Using assessment information to plan, implement, and evaluate activities to promote child development and learning. Practicum.",Fall,https://catalog.iastate.edu/azcourses/hd_fs/
HDFS,3410,Income Tax Planning,3.,Lecture 3.,,,,,"Practice and planning to minimize tax liability and maximize after-tax returns for individuals and families. Addresses components of the US personal income tax system including tax forms, filing status, income, exemptions, exclusions, deductions, adjustments, credits, penalties, and tax rates. The case-problem approach prepares students to plan for themselves and to advise others.",Fall,https://catalog.iastate.edu/azcourses/hd_fs/
HDFS,3420,Social-Emotional Development and Guidance,3.,Lecture 2.,,,,HDFS 2240,"Working knowledge of social and emotional development of young children. Examines the influence of relationships, trauma, and positive guidance on children’s development and learning across contexts.","Fall, Spring",https://catalog.iastate.edu/azcourses/hd_fs/
HDFS,3430,Preschool Curriculum and Assessment,4.,"Lecture 3, Laboratory 3.",,,,HDFS 2240 ; HDFS 2400 ; admission to Educator Preparation program,"Application of curriculum, teaching, and assessment strategies for inclusive preschool settings. Plan, implement, and evaluate learning activities to promote holistic development. Practicum.",Spring,https://catalog.iastate.edu/azcourses/hd_fs/
HDFS,3440,Programming for Children in Early Care and Education,4.,Lecture 3.,,,,HDFS 2240,"Programming in inclusive child care centers and family child care homes, including those with special needs, aged birth through 8 years. Developing, implementing, and evaluating learning environments; activities and materials; behavioral guidance and classroom management practices; health and nutritional practices; and schedules to ensure developmental, individual, and cultural appropriateness. Monitoring children's development and behavior to promote physical, motor, cognitive, communication, and social emotional development. Learning to collaborate effectively with parents and staff. Practicum.","Fall, Spring",https://catalog.iastate.edu/azcourses/hd_fs/
HDFS,3450,Inclusive Teaching and Interaction Strategies,3.,Lecture 3.,,,,( HDFS 2240 ; SPED 2500 ) or Permission of Instructor,Strategies to use with young children with special needs. Focus on meeting the needs of all learners ages birth through 8 years old through Individualized Education Plans.,Spring,https://catalog.iastate.edu/azcourses/hd_fs/
HDFS,3600,Housing and Services for Families and Children,3.,Lecture 3.,,,,"6 credits from the following courses: AESHM 4210 ; AFAM 3300 ; FDM 1650 , 3620, 4670; AMIN 3100 , 2150, 3220; ANTHR (except 2020); CJ (except 2200, 3320); ECON; FSHN 3420 ; INTST 2350 ; LING 2190 , 2750, 4710; POLS; PSYCH (except 1310); SOC; WGS 2010 , 2030, 3010, 3200, 3270, 3280, 3460, 3500, 3850","Approaches to and assessment of housing and services that assist those with special needs including those with disabilities, low-income, children at risk, single-parents, and the homeless. Emphasis on community settings; e.g., residential facilities, group housing, shelters and transitional housing. Meets U.S. Cultures and Communities Requirement.",Fall,https://catalog.iastate.edu/azcourses/hd_fs/
HDFS,3670,"Family Stress, Abuse, and Resilience",3.,Lecture 3.,,,,"3 credits from the following courses: AESHM 4210 ; AFAM 3300 ; FDM 1650 , 3620, 4670; AMIN 3100 , 2150, 3220; ANTHR (except 2020); CJ (except 2200, 3320); ECON; FSHN 3420 ; INTST 2350 ; LING 2190 , 2750, 4710; POLS; PSYCH (except 1310); SOC; WGS 2010 , 2030, 3010, 3200, 3270, 3280, 3460, 3500, 3850","Causes and consequences of family stressors across the lifespan including physical, psychological, and sexual abuse; substance abuse; intergenerational transmission of violence; and resilience to family stress. Community and legal response to family violence. .","Fall, Spring",https://catalog.iastate.edu/azcourses/hd_fs/
HDFS,3690,Research Methods in Human Development and Family Studies,3.,"Lecture 3, Laboratory 1.",,,,( HDFS 1020 or PSYCH 2300 ); Junior or Senior classification,Understanding and evaluating research. Use of primary and secondary data to identify and study problems related to human development and family issues. An introduction to statistical concepts and data analysis. Computer laboratory experience.,"Fall, Spring",https://catalog.iastate.edu/azcourses/hd_fs/
HDFS,3730,Death as a Part of Living,3.,Lecture 3.,,,,PSYCH 2300 or HDFS 1020,Consideration of death in the life span of the individual and the family with opportunity for exploration of personal and societal attitudes.,"Fall, Spring, Summer",https://catalog.iastate.edu/azcourses/hd_fs/
HDFS,3770,Aging and the Family,3.,Lecture 3.,,,,,"Interchanges of older adults and their families. Emphasis on role changes, social interaction, and independence as influenced by health, finances, lifestyles, and community support.","Fall, Summer",https://catalog.iastate.edu/azcourses/hd_fs/
HDFS,3780,Retirement Planning and Employee Benefits,3.,Lecture 3.,,,,,"Financial needs analysis for retirement, characteristics of employer-sponsored and individual retirement plans, tax implications of retirement plans, Social Security funding and benefits, strategies for meeting varying retirement needs in a diverse society, financial counseling and planning practice, and overview of employee benefits.",Spring,https://catalog.iastate.edu/azcourses/hd_fs/
HDFS,3830,Fundamentals of Financial Planning,3.,Lecture 3.,,,,,"Fundamental principles of the financial planning process, client/planner interactions, time value of money applications as well as analyses of ethics review, financial statements, cash flow and debt management, education planning, retirement planning, tax planning, and estate planning needs of families.",Spring,https://catalog.iastate.edu/azcourses/hd_fs/
HDFS,3840,Insurance Planning,3.,Lecture 3.,,,,HDFS 2830,Strategies for managing family financial risk with insurance. Emphasis on communication and planning process and the use of risk mitigation and insurance within families. Risk analysis and management within the comprehensive family financial planning process.,Spring,https://catalog.iastate.edu/azcourses/hd_fs/
HDFS,3860,Human Services Management I,3.,Lecture 3.,,,,Junior or Senior Classification,"Foundational understanding of administration and leadership within human services organizations, with a focus on operations, policies, staffing, and program design and evaluation. Key leadership and financial management principles for effective service delivery will be introduced.",Fall,https://catalog.iastate.edu/azcourses/hd_fs/
HDFS,3870,Trauma-Informed Practice,3.,Lecture 3.,,,,Junior or Senior Classification,The application of strengths-based and resiliency-focused approaches for individuals and families. Practice skills such as relationship building and motivational interviewing through role plays and experiential activities. Meets U.S. Cultures and Communities Requirement.,"Fall, Spring",https://catalog.iastate.edu/azcourses/hd_fs/
HDFS,3950,"Children, Families, and Public Policy",3.,Lecture 3.,,,,HDFS 3690 or PSYCH 3010 or Permission of Instructor,Public policy and public service programs as they affect children and families. Examination of how individuals and groups influence policy. Investigation of current issues and programs influencing the well-being and welfare of children and families.,Spring,https://catalog.iastate.edu/azcourses/hd_fs/
HDFS,4110X,Family Communication Dynamics,3.,Lecture 3.,,,,COMST 1010 or HDFS 2700 or Instructor Permission,"Examine theory and research on communication dynamics across a variety of family relationships and structures. Topics include storytelling, affection, conflict, privacy, socialization, stress, and resilience. Students will gain an understanding of the communication behaviors that improve (or detract from) family functioning.","Fall, Spring",https://catalog.iastate.edu/azcourses/hd_fs/
HDFS,4160,Human Development and Family Studies Seminar,1-30.,Lecture 30.,,,True,8 credits in HDFS,Intensive study of a selected topic in human development and family studies.,"Fall, Spring, Summer",https://catalog.iastate.edu/azcourses/hd_fs/
HDFS,4170,Supervised Student Teaching: Early Childhood Special Education,8.,,,,True,,"Teaching experience in inclusive settings, ages 0-5 4170-1Inside Central Iowa, first 8 weeks4170-2 Outside Central Iowa, first 8 weeks4170-3 Inside Central Iowa, second 8 weeks4170-4 Outside Central Iowa, second 8 weeks.",Spring,https://catalog.iastate.edu/azcourses/hd_fs/
HDFS,4180,Reflective Supervision,0.5.,,,,,Concurrent enrollment in HDFS 4170,Reflective supervision and feedback of student teaching field experience. Offered on a satisfactory-fail basis only..5 Credit 4180-1 first 8 weeks4180-2 second 8 weeks. Offered on a satisfactory-fail basis only.,Spring,https://catalog.iastate.edu/azcourses/hd_fs/
HDFS,4200,Advanced Professional Practice,3.,Lecture 3.,,,,HDFS 2200 AND junior or senior classification,"Essential skills for internship preparation and practice. Topics include career planning, resume writing, interview techniques, and strategic career management.","Fall, Spring",https://catalog.iastate.edu/azcourses/hd_fs/
HDFS,4550,Curriculum and Interventions: Ages 3 through 6 Years,4.,"Lecture 3, Laboratory 3.",,,,"HDFS 3430 , HDFS 3450 , SPED 4050 and SPED 4580","Assessment and intervention strategies for preschool in educational settings with an emphasis on diverse populations. Practical experience in using assessment approaches to inform teaching, engage in collaborative teaming, and communicating assessment findings. Practicum.",Fall,https://catalog.iastate.edu/azcourses/hd_fs/
HDFS,4560,Family Partnerships in Early Childhood,3.,Lecture 3.,,,,HDFS 3400 or HDFS 3440 or Permission of Instructor,Understanding and applying family systems theory and family centered principals with a focus on early childhood and special education. Experiences with families.,Fall,https://catalog.iastate.edu/azcourses/hd_fs/
HDFS,4760X,Advanced Human Sexuality,3.,Lecture 3.,,,,Prerq: HDFS 2760 or Instructor Permission,"An in-depth exploration of human sexuality and its role in human development, health and well-being. Engage with current research, applied learning activities, and critical reflection to better understand the role of sexuality in individual, family, and community contexts. Recommended for students pursuing careers in health, education, human services, or related fields.",,https://catalog.iastate.edu/azcourses/hd_fs/
HDFS,4790,Families Through a Social and Cultural Lens,3.,Lecture 3.,,,,HDFS 1020 OR PSYCH 2300 ; HDFS 3690 OR PSYCH 3010 OR permission of instructor; junior or senior classification,Exploration of social and cultural factors that influence families. Examination of how social and cultural contexts impact work within chosen careers. Meets U.S. Cultures and Communities Requirement.,"Fall, Spring",https://catalog.iastate.edu/azcourses/hd_fs/
HDFS,4820,Investment Planning,3.,Lecture 3.,,,,"HDFS 3830 , ECON 1010 ; STAT 1010","Management of family financial resources; emphasis on savings and the investment planning process; issues facing financial planners who manage family assets. Identification of investment options including common stocks, fixed income securities, convertible securities, and related choices.",Fall,https://catalog.iastate.edu/azcourses/hd_fs/
HDFS,4840,Estate Planning,3.,Lecture 3.,,,,HDFS 2830 or FIN 3010,"Study of estate planning focusing on efficient conservation and transfer of wealth, consistent with client's goals. Legal, tax, financial and non-financial aspects of estate planning process; trusts, wills, probate, advanced directives, charitable giving, wealth transfers and related taxes.",Spring,https://catalog.iastate.edu/azcourses/hd_fs/
HDFS,4850,Case Studies in Financial Counseling and Planning,3.,Lecture 3.,,,,( FIN 3610 or HDFS 3840 ); HDFS 3410 ; HDFS 3780 ; HDFS 3830 ; ( FIN 3200 or HDFS 4820 ),"Capstone experience in comprehensive financial counseling and planning. Create a written financial plan, role play client delivery. Utilization of skills obtained in financial counseling and planning major to create financial planning narratives.",Spring,https://catalog.iastate.edu/azcourses/hd_fs/
HDFS,4860,Human Services Management II,3.,Lecture 3.,,,,HDFS 3860,"Advanced leadership principles tailored for complex human service organizations, focusing on client-oriented program implementation and effective funding strategies. In-depth application of financial management techniques and strategic planning frameworks to meet organizational needs.",Spring,https://catalog.iastate.edu/azcourses/hd_fs/
HDFS,4890,Financial Counseling,2.,Lecture 2.,,,,HDFS 2830,"Financial counseling and planning education is the integrative, multidisciplinary field of social science that studies personal finance and helps individuals and families make effective financial decisions. Learn how a client’s psychology, such as their socialization, money beliefs, and past financial experiences and behaviors impact their objectives, goals, understanding, decision-making and actions.",Fall,https://catalog.iastate.edu/azcourses/hd_fs/
HDFS,4890L,Financial Counseling Laboratory,1.,Laboratory 2.,,,True,HDFS 2830,"Hands-on financial counseling experience using preventative, remedial, and productive strategies in one-on-one and/or group situations. Students work with clients to develop diverse and inclusive decision-making and problem-solving methods to achieve goals or to remove barriers.",Fall,https://catalog.iastate.edu/azcourses/hd_fs/
HDFS,4900,Independent Study,1-30.,,,,True,6 credits in HDFS; Permission of Instructor,Consult department office for procedure.,,https://catalog.iastate.edu/azcourses/hd_fs/
HDFS,4900H,Independent Study: Honors,1-30.,,,,True,6 credits in HDFS; Permission of Instructor; Membership in the University Honors Program,Consult department office for procedure.,,https://catalog.iastate.edu/azcourses/hd_fs/
HDFS,4900I,Independent Study: Human Development and Family Studies,1-30.,,,,True,6 credits in HDFS; Permission of Instructor,Consult department office for procedure.,,https://catalog.iastate.edu/azcourses/hd_fs/
HDFS,4910,Internship,4-9.,,,,True,Instructor Permission for Course,Supervised work experience related to the student's curriculum. Offered on a satisfactory-fail basis only.,"Fall, Spring, Summer",https://catalog.iastate.edu/azcourses/hd_fs/
HDFS,4930,Workshop,1-30.,Lecture 30.,,,True,,Workshop in HDFS.,"Fall, Spring, Summer",https://catalog.iastate.edu/azcourses/hd_fs/
HDFS,4990,Research,1-6.,,,,True,Instructor Permission for Course,Supervised research experience.,"Fall, Spring, Summer",https://catalog.iastate.edu/azcourses/hd_fs/
HDFS,5010,"Graduate Studies, Research, and Ethics in HDFS",2.,Lecture 2.,,,,Graduate Standing or Permission of Instructor,"Overview of graduate study, research, ethics, and professional development in the field of human development and family studies. Curriculum, programs of study, portfolios, faculty research interests, dissemination of research, career planning, and teaching discussed.",Fall,https://catalog.iastate.edu/azcourses/hd_fs/
