subject_code,course_number,title_name,credits,contact_hours,cross_listed,dual_listed,repeatable,prerequisites,description,typically_offered,source_url
HDFS,5020,Professional Development in Human Development and Family Studies,2.,Lecture 2.,,,,Graduate Standing or Permission of Instructor,"Overview of professional skills, portfolio building, preparation for academic and nonacademic jobs, leadership fundamentals and project management training, time management, work balance issues, and professional ethics. Opportunities for graduate students to work on their professional development tailored to individual needs of students. Develop an individual professional portfolio. Offered even-numbered years.",Spring). ( Typically Offered: Spring,https://catalog.iastate.edu/azcourses/hd_fs/
HDFS,5030,Introduction to Research Design,4.,Lecture 4.,,,,Graduate Standing or Permission of Instructor,"Basic research skills including developing research questions, posing testable hypotheses, determining appropriate data collection and analyses, and identifying the benefits and limitations of various sampling strategies. Measurement theory, observational assessments, survey research, experimental and quasi-experimental designs, analysis of secondary data, and qualitative research methods.",Fall,https://catalog.iastate.edu/azcourses/hd_fs/
HDFS,5040,Qualitative Research Methods,3.,Lecture 3.,,,,Graduate Standing or Permission of Instructor,"Introduction to qualitative research methodology. Application of fieldwork methods, analysis, interpretation, and writing through individual qualitative research projects.",Spring,https://catalog.iastate.edu/azcourses/hd_fs/
HDFS,5050,Application of Quantitative Research Methods,3.,Lecture 3.,,,,Graduate Standing or Permission of Instructor,"Descriptive and inferential statistics, hypothesis testing, scales of measurement, comparisons of proportions, correlations between variables, the t distribution, analysis of variance, and multiple regression.",Spring,https://catalog.iastate.edu/azcourses/hd_fs/
HDFS,5100,Theories of Human Development,3.,Lecture 3.,,,,Graduate Standing or Permission of Instructor,"Theoretical approaches and current research in child, adolescent, and adult development. Individual life span perspectives. Implications for research, policy and practice. (Summer course offering is on-line).","Fall, Summer",https://catalog.iastate.edu/azcourses/hd_fs/
HDFS,5110,Family Theory,3.,Lecture 3.,,,,Graduate Standing or Permission of Instructor,"Theoretical approaches and current research in family development. Review the nature and value of theory to the study of the family and evaluate the use of theory in empirical research. Implications for research, policy and practice.",Spring,https://catalog.iastate.edu/azcourses/hd_fs/
HDFS,5300,Perspectives in Gerontology,3.,Lecture 3.,,,,Graduate Standing or Permission of Instructor,"Overview of current aging issues including theory and research, critical social and political issues in aging, the interdisciplinary focus of gerontology, career opportunities, and aging in the future.",Fall,https://catalog.iastate.edu/azcourses/hd_fs/
HDFS,5340,Adult Development,3.,Lecture 3.,,,,Graduate Standing or Permission of Instructor,"Exploration of the biological, psychological and social factors associated with aging. Although the focus is on the later years, information is presented from a life-span developmental framework. Empirical studies are reviewed and their strengths, limitations and implications for normative and optimal functioning are discussed.",Spring,https://catalog.iastate.edu/azcourses/hd_fs/
HDFS,5380,Developmental Disabilities,3.,Lecture 3.,,,,Graduate Standing or Permission of Instructor,"Theories, research, and current issues regarding the intersection of development and disabilities. Investigation of interventions with individuals and families (Online course offering via Distance Education). Offered odd-numbered years.",Fall,https://catalog.iastate.edu/azcourses/hd_fs/
HDFS,5410,Housing and Real Estate in Family Financial Planning,3.,Lecture 3.,,,,Graduate Standing or Permission of Instructor,"The role of housing and real estate in the family financial planning process, including taxation, mortgages, financial calculations, legal concerns, and ethical issues related to home ownership and real estate investments. Emphasis on emerging issues in the context of housing and real estate. Offered even-numbered years.",Summer,https://catalog.iastate.edu/azcourses/hd_fs/
HDFS,5450,"Economics, Public Policy, and Aging",3.,Lecture 3.,,,,Graduate Standing or Permission of Instructor,Policy development in the context of the economic status of the older adult population. Retirement planning and the retirement decisions; social security and public transfer programs; intra-family transfers to/from the aged; private pensions; financing medical care; prospects and issues for the future.,Fall,https://catalog.iastate.edu/azcourses/hd_fs/
HDFS,5630,Environments for the Aging,3.,Lecture 3.,,,,Graduate Standing or Permission of Instructor,"Emphasis on independent living within residential settings including specialized shelter, supportive services and housing management. Application of criteria appropriate for accessibility and functional performance of activities; universal design principles. Creative project provides service learning opportunities.",Spring,https://catalog.iastate.edu/azcourses/hd_fs/
HDFS,5660,Family Policy,3.,Lecture 3.,,,,Graduate Standing or Permission of Instructor,An introduction to policy for family researchers and practitioners. Examination of relevant policies through a family lens via discussion of theory and student interests in current and enduring family policies and programs. Descriptions of work roles in family policy and the interaction of family researchers and policymakers. Offered even-numbered years.,Fall,https://catalog.iastate.edu/azcourses/hd_fs/
HDFS,5670,"Family Stress, Abuse, and Illness",3.,Lecture 3.,,,,Graduate Standing or Permission of Instructor,"Explores research related to family stress within romantic, parent-child, and sibling relationships. Examines contemporary theory and research on the nature, causes, and consequences of family stressors. These stressors include but are not limited to economic distress; physical and emotional abuse; substance abuse; and mental and physical illness across the life span (Online course offering via Distance Education). Offered even-numbered years.",Fall,https://catalog.iastate.edu/azcourses/hd_fs/
HDFS,5750,Cross-cultural Perspectives about Families and Children,3.,Lecture 3.,,,,Graduate Standing or Permission of Instructor,Review of current research regarding family diversity including an examination of cultural and structural influences on the development and well-being of families and children. Discussion of the impact on human rights and social justice (Online course offering via Distance Education). Offered even-numbered years.,Spring,https://catalog.iastate.edu/azcourses/hd_fs/
HDFS,5760X,Advanced Human Sexuality,3.,Lecture 3.,,,,,"An in-depth exploration of human sexuality and its role in human development, health and well-being. Students will engage with current research, applied learning activities, and critical reflection to better understand the role of sexuality in individual, family, and community contexts. Recommended for students pursuing careers in health, education, human services, or related fields.",,https://catalog.iastate.edu/azcourses/hd_fs/
HDFS,5770,Aging in the Family Setting,3.,Lecture 3.,,,,Graduate Standing or Permission of Instructor,Theories and research related to personal and family adjustments in later life affecting older persons and their intergenerational relationships. Related issues including demographics also are examined through the use of current literature.,Spring,https://catalog.iastate.edu/azcourses/hd_fs/
HDFS,5790,Family Well-being Across the Lifespan,3.,Lecture 3.,,,,Graduate Standing or Permission of Instructor,"Review of current research to provide a theoretical and practical understanding of the economic, social, and psychological factors that influence interpersonal relationships and individual well-being within the institution of the family system. Economic and policy effects considered (Online course offering via Distance Education). Offered odd-numbered years.",Spring,https://catalog.iastate.edu/azcourses/hd_fs/
HDFS,5810A,International Study in HDFS: Practicum,1-12.,,,,True,Graduate Standing or Permission of Instructor,Limited enrollment. Supervised international study experiences in Human Development and Family Studies. Countries vary.,"Fall, Spring, Summer",https://catalog.iastate.edu/azcourses/hd_fs/
HDFS,5810B,International Study in HDFS: Exchange,1-12.,,,,True,Graduate Standing or Permission of Instructor,Limited enrollment. Supervised international study experiences in Human Development and Family Studies. Countries vary.,"Fall, Spring, Summer",https://catalog.iastate.edu/azcourses/hd_fs/
HDFS,5830,Investing for the Family's Future,3.,Lecture 3.,,,,Graduate Standing or Permission of Instructor,Evaluation of investment markets for the household. Analysis of how families choose where to put their savings. Emphasis is on using the family's overall financial and economic goals to help inform investment choices.,Fall,https://catalog.iastate.edu/azcourses/hd_fs/
HDFS,5840,Program Evaluation and Research Methods in Gerontology,3.,Lecture 3.,,,,Graduate Standing or Permission of Instructor,"Overview of program evaluation, research methods, and grant writing in gerontology. Includes application of quantitative and qualitative methods in professional settings.",Spring,https://catalog.iastate.edu/azcourses/hd_fs/
HDFS,5850,Program Evaluation,3.,Lecture 3.,,,,Graduate Standing or Permission of Instructor,"Theoretical and practical issues related to design and implementation of program evaluation in social sciences. Includes theory, design, implementation, analysis and proposal writing to assist programs to be successful in meeting program goals. Offered odd-numbered years.",Spring,https://catalog.iastate.edu/azcourses/hd_fs/
HDFS,5890,Financial Counseling,2.,Lecture 2.,,,,Graduate Standing or Permission of Instructor,"Financial counseling and planning education is the integrative, multidisciplinary field of social science that studies personal finance and helps individuals and families make effective financial decisions. Learn how a client’s psychology, such as their socialization, money beliefs, and past financial experiences and behaviors impact their objectives, goals, understanding, decision-making and actions.",Fall,https://catalog.iastate.edu/azcourses/hd_fs/
HDFS,5890L,Financial Counseling Laboratory,1.,Laboratory 2.,,,True,Graduate Standing or Permission of Instructor,"Hands-on financial counseling experience using preventative, remedial, and productive strategies in one-on-one and/or group situations. Students work with clients to develop diverse and inclusive decision-making and problem-solving methods to achieve goals or to remove barriers.",Fall,https://catalog.iastate.edu/azcourses/hd_fs/
HDFS,5900I,Special Topics: Human Development and Family Studies,1-30.,,,,True,Instructor Permission for Course,Consult department office on procedure for filing a written plan of study.,,https://catalog.iastate.edu/azcourses/hd_fs/
HDFS,5900R,Special Topics,1-30.,,,,True,Graduate Standing or Permission of Instructor,Consult department office on procedure for filing a written plan of study.,"Fall, Spring, Summer",https://catalog.iastate.edu/azcourses/hd_fs/
HDFS,5910I,Internship: Human Development and Family Studies,1-30.,,,,True,Instructor Permission for Course,Supervised experience in an area of human development and family studies.,"Fall, Spring, Summer",https://catalog.iastate.edu/azcourses/hd_fs/
HDFS,5930,Workshop,1-30.,Lecture 30.,,,True,Graduate Standing or Permission of Instructor,Workshop in HDFS.,"Fall, Spring, Summer",https://catalog.iastate.edu/azcourses/hd_fs/
HDFS,5940,Professional Seminar in Gerontology,3.,Lecture 3.,,,,Graduate Standing or Permission of Instructor,"An integrative experience for gerontology students designed to be taken near the end of the degree program. By applying knowledge gained in earlier coursework, students will strengthen skills in ethical decision-making behavior, applying these skills in gerontology-related areas such as advocacy, professionalism, family and workplace issues. Students from a variety of professions will bring their unique perspectives to bear on topics of common interest.",Summer,https://catalog.iastate.edu/azcourses/hd_fs/
HDFS,5990,Creative Component,1-30.,,,,,Instructor Permission for Course,"Nonthesis creative component (e.g., a special report, capstone course, integrated field experience, annotated bibliography, research project, design, or other creative endeavor).","Fall, Spring, Summer",https://catalog.iastate.edu/azcourses/hd_fs/
HDFS,6030,Advanced Quantitative Methods,3.,Lecture 3.,,,,,"Methodological and analytical issues in research in human development and family studies. Advanced research design and measurement, selection of statistical techniques, and issues in the interpretation of findings.",Fall,https://catalog.iastate.edu/azcourses/hd_fs/
HDFS,6040,Advanced Qualitative Methods,3.,Lecture 3.,,,,,"Research methodologies including phenomenology, grounded theory, ethnography, and case studies. Methods of data collection and analysis procedures. Issues of ethics and interpretation of findings (Online course offering via Distance Education). Offered even-numbered years.",Spring,https://catalog.iastate.edu/azcourses/hd_fs/
HDFS,6050,Multi-level Modeling,3.,Lecture 3.,,,,,"Rationale for and interpretation of random coefficient models. Strategies for the analysis of multi-level and panel data including models for random intercepts, random slopes, and growth curves. Offered odd-numbered years.",Spring,https://catalog.iastate.edu/azcourses/hd_fs/
HDFS,6060,Advanced Structural Equation and Longitudinal Modeling,3.,Lecture 3.,,,,,"Rationale for and interpretation of advanced structural equation modeling for the analysis of longitudinal data. Emphasis will be placed on developing a working familiarity with some of the common statistical procedures, coupled with their application through the use of statistical software. Offered even-numbered years.",Spring,https://catalog.iastate.edu/azcourses/hd_fs/
HDFS,6070,Mixed Methods,3.,Lecture 3.,,,,,"Foundations of mixed methods research, controversies, and philosophical concerns. Rationale for and interpretation of mixed methods designs. Research design, sampling, data collection, data analysis, results, and interpretation (Online course offering via Distance Education). Offered odd-numbered years.",Spring,https://catalog.iastate.edu/azcourses/hd_fs/
HDFS,6080,Grant Writing for Research,3.,Lecture 3.,,,,,"Understand how to identify funding sources as well as the fundamental components of a federal research grant proposal such as the abstract or summary, background and significance, specific aims/goals and objectives, project design and methods, sustainability, assessment, broader impacts, dissemination, budget, budget justification, and cover letter.",Fall,https://catalog.iastate.edu/azcourses/hd_fs/
HDFS,6160,Seminar,1-30.,Lecture 30.,,,,,May be repeated. F.S.SS.,,https://catalog.iastate.edu/azcourses/hd_fs/
HDFS,6310,Child Health and Development,3.,Lecture 3.,,,,,"Young children’s cognitive, physical, communication, and social-emotional health and development will be examined. Both typical and atypical trajectories will be explored. Research on current trends in the field will be emphasized (Online course offering via Distance Education). Offered even-numbered years.",Fall,https://catalog.iastate.edu/azcourses/hd_fs/
HDFS,6330,Infant Mental Health,3.,Lecture 3.,,,,,"Examination of the individual, interpersonal, and familial factors that influence infant (birth through age 3) mental health. Analysis of the risk and protective factors that influence these systems and their potential effects on social-emotional development. Current issues relating to effective programs for improving parent-infant interactions and additional supports available to families (Online course offering via Distance Education). Offered even-numbered years.",Spring,https://catalog.iastate.edu/azcourses/hd_fs/
HDFS,6340,Adolescent and Emerging Adult Health and Development,3.,Lecture 3.,,,,,"Theory and research on biopsychosocial, cognitive, physical and sexual health and development from early adolescence to emerging adulthood. Contexts of development including families, peers, schools, neighborhoods, romantic relationships, economics and public policies are considered (Online course offering via Distance Education). Offered even-numbered years.",Spring,https://catalog.iastate.edu/azcourses/hd_fs/
HDFS,6350,"Adult Development, Aging, and Health",3.,Lecture 3.,,,,,"Review of the impact of the growing older adult population as well as individual development and aging on individuals, families, and society. Exploration of theoretical perspectives applied to adult development and aging and distinction of normative and non-normative changes in adulthood. Discussion of methods to assess development across adulthood and consideration of the role of individual and environmental factors impacting efforts to optimize adult development. Offered odd-numbered years.",Fall,https://catalog.iastate.edu/azcourses/hd_fs/
HDFS,6900I,Advanced Topics: Human Development and Family Studies,1-30.,,,,True,Instructor Permission for Course,,,https://catalog.iastate.edu/azcourses/hd_fs/
HDFS,6910A,Internship: College Teaching,1-30.,,,,True,Instructor Permission for Course,Supervised practice and experience in college-level teaching. Offered on a satisfactory-fail basis only.,"Fall, Spring, Summer",https://catalog.iastate.edu/azcourses/hd_fs/
HDFS,6910B,Internship: Research,1-30.,,,,True,Instructor Permission for Course,Supervised practice and experience in conducting research. Offered on a satisfactory-fail basis only.,"Fall, Spring, Summer",https://catalog.iastate.edu/azcourses/hd_fs/
HDFS,6910D,Internship: Professional Experience,1-30.,,,,True,Instructor Permission for Course,Supervised practice and experience in relevant professional experiences. Offered on a satisfactory-fail basis only.,"Fall, Spring, Summer",https://catalog.iastate.edu/azcourses/hd_fs/
HDFS,6990I,Research: Human Development and Family Studies,1-30.,,,,True,Instructor Permission for Course,Thesis and dissertation research. Offered on a satisfactory-fail basis only.,,https://catalog.iastate.edu/azcourses/hd_fs/
