subject_code,course_number,title_name,credits,contact_hours,cross_listed,dual_listed,repeatable,prerequisites,description,typically_offered,source_url
LA,5540,Fundamentals of Remote Sensing and Spatial Analysis,3.,Lecture 3.,,,,,"Introduction to image processing techniques needed for analysis of optical remote sensing imagery, including filtering, enhancement, and classification. Analysis of elevation surfaces, hydrology, distance, overlays and visual programming with Model Builder. Practical applications in a variety of topics to understand how to analyze imagery.",Spring,https://catalog.iastate.edu/azcourses/l_a/
LA,5570,Landscape Parametrics & Design Coding,3.,Lecture 3.,,,,Graduate Standing or Permission of Instructor,"Introduction to parametric landscape design through computer programming of the landscape palette. Terrain, vegetation, water, weather, and lighting effects are modeled and represented algorithmically in Rhino-Grasshopper. Computational thinking, logic, and interactivity are combined to address core design principles.",Fall,https://catalog.iastate.edu/azcourses/l_a/
LA,5580,Web Mapping and Spatial Data Visualization,3.,"Lecture 2, Laboratory 2.",,,,Graduate Standing or Permission of Instructor,"Use and development of online mapping tools and coding to support participatory GIS, Volunteered Geographic Information, information sharing, geodesign, and decision-making actions. Geoprocessing, spatial data science, and user interface design. Laboratory emphasis on practical applications and uses of Web GIS.",,https://catalog.iastate.edu/azcourses/l_a/
LA,5590,Digital Design Methods for Landscape Architecture,3.,Lecture 3.,,,,Graduate Standing or Permission of Instructor,"Introduction to digital tools used by landscape architects for design communication, visualization, and design development, with emphasis on 3D modeling and workflow interoperability.",Spring,https://catalog.iastate.edu/azcourses/l_a/
LA,5710,Landscape Architectural Theory,3.,Lecture 3.,,,,Graduate Standing or Permission of Instructor,"Examination of the development of landscape architectural ideas in their historical contexts and in relation to social and cultural practices. Emphasis on exposure to key modern and contemporary texts and projects in landscape architecture, architecture, art, and related fields. Readings, discussions, and writings.",Fall,https://catalog.iastate.edu/azcourses/l_a/
LA,5715,History of Landscape Architecture,3.,Lecture 3.,,,,Graduate Standing or Permission of Instructor,"History of the profession, with emphasis on its origins in the United States and Europe. Examination of significant figures and outstanding works (sites, gardens, landscapes, monuments, subdivisions, city plans, etc.) Analysis of the social, economic, political, and technical forces contributing to the development of the profession and its literature. Lectures, readings, projects, research papers.",Fall,https://catalog.iastate.edu/azcourses/l_a/
LA,5740,Environmental Justice in Built Environments,3.,Lecture 3.,,,,,"Introduction to inequitable access to healthy environments as an issue in planning and design. Focus on cumulative effects of climate change, environmental hazards, and physical design on vulnerable populations. Examination of current research. Mapping in GIS and spatial analysis to assess unjust environmental burdens and equitable built environments.","Fall, Spring",https://catalog.iastate.edu/azcourses/l_a/
LA,5780A,Topical Studies in Landscape Architecture: Landscape Design,2-3.,Lecture 3.,,,True,Graduate Standing or Permission of Instructor,Offerings vary with each term; check with department for available sections.,"Fall, Spring, Summer",https://catalog.iastate.edu/azcourses/l_a/
LA,5780B,Topical Studies in Landscape Architecture: Planting Design,2-3.,Lecture 3.,,,True,Graduate Standing or Permission of Instructor,Offerings vary with each term; check with department for available sections.,"Fall, Spring, Summer",https://catalog.iastate.edu/azcourses/l_a/
LA,5780C,Topical Studies in Landscape Architecture: Construction,2-3.,Lecture 3.,,,True,Graduate Standing or Permission of Instructor,Offerings vary with each term; check with department for available sections.,"Fall, Spring, Summer",https://catalog.iastate.edu/azcourses/l_a/
LA,5780D,Topical Studies in Landscape Architecture: History/Theory/Criticism,2-3.,Lecture 3.,,,True,Graduate Standing or Permission of Instructor,Offerings vary with each term; check with department for available sections.,"Fall, Spring, Summer",https://catalog.iastate.edu/azcourses/l_a/
LA,5780E,Topical Studies in Landscape Architecture: Landscape Planning,2-3.,Lecture 3.,,,True,Graduate Standing or Permission of Instructor,Offerings vary with each term; check with department for available sections.,"Fall, Spring, Summer",https://catalog.iastate.edu/azcourses/l_a/
LA,5780F,Topical Studies in Landscape Architecture: Urban Design,2-3.,Lecture 3.,,,True,Graduate Standing or Permission of Instructor,Offerings vary with each term; check with department for available sections.,"Fall, Spring, Summer",https://catalog.iastate.edu/azcourses/l_a/
LA,5780G,Topical Studies in Landscape Architecture: Graphics,2-3.,Lecture 3.,,,True,Graduate Standing or Permission of Instructor,Offerings vary with each term; check with department for available sections.,"Fall, Spring, Summer",https://catalog.iastate.edu/azcourses/l_a/
LA,5780I,Topical Studies in Landscape Architecture: Interdisciplinary Studies,2-3.,Lecture 3.,,,True,Graduate Standing or Permission of Instructor,Offerings vary with each term; check with department for available sections.,"Fall, Spring, Summer",https://catalog.iastate.edu/azcourses/l_a/
LA,5780J,Topical Studies in Landscape Architecture: International Studies,2-3.,Lecture 3.,,,True,Graduate Standing or Permission of Instructor,Offerings vary with each term; check with department for available sections.,"Fall, Spring, Summer",https://catalog.iastate.edu/azcourses/l_a/
LA,5780K,Landscape Architecture: Computer Applications,2-3.,Lecture 3.,,,True,Graduate Standing or Permission of Instructor,Offerings vary with each term; check with department for available sections. Course contact hours can range from (2-0) to (3-0) depending on number of credits.,"Fall, Spring, Summer",https://catalog.iastate.edu/azcourses/l_a/
LA,5780L,Topical Studies in Landscape Architecture: Ecological Design,2-3.,Lecture 6.,,,True,Graduate Standing or Permission of Instructor,Offerings vary with each term; check with department for available sections.,"Fall, Spring, Summer",https://catalog.iastate.edu/azcourses/l_a/
LA,5780M,Topical Studies in Landscape Architecture: Landscape Architecture: Social/Behavioral,2-3.,Lecture 3.,,,True,Graduate Standing or Permission of Instructor,Offerings vary with each term; check with department for available sections.,"Fall, Spring, Summer",https://catalog.iastate.edu/azcourses/l_a/
LA,5780N,Topical Studies in Landscape Architecture: Natural Resources,2-3.,Lecture 3.,,,True,Graduate Standing or Permission of Instructor,Offerings vary with each term; check with department for available sections.,"Fall, Spring, Summer",https://catalog.iastate.edu/azcourses/l_a/
LA,5800,"Thesis, Creative Component Tutorial",1-4.,,,,True,Instructor Permission for Course,Hands-on participation in a creative or research activity in the student's area of specialization. Development of a detailed prospectus that defines the thesis or creative component.,"Fall, Spring, Summer",https://catalog.iastate.edu/azcourses/l_a/
LA,5810,Landscape Materials,3.,Lecture 3.,,,,,"Examination and identification of characteristics, applications, systems, and uses of common landscape construction materials including wood, paving, walls, masonry, concrete, and metals. Investigation of the relationships between site plans and construction details with an emphasis on the aesthetic and functional use of landscape details. Preliminary preparation of construction documents using design documentation software.","Spring, Spring",https://catalog.iastate.edu/azcourses/l_a/
LA,5830,Landscape TopoGraphics,3.,Lecture 3.,,,,LA 6020,"Design of landforms to achieve aesthetic, functional, and safety goals. Impacts and implications of landform transformation on the surrounding environment. Design communication using CAD, perspectives, cross-sections, contour maps, landform models, and narratives. Class exercises, case study precedents, and preliminary construction documents.",Fall,https://catalog.iastate.edu/azcourses/l_a/
LA,5900A,Special Topics: Landscape Design,1-6.,,,,True,Instructor Permission for Course,Investigation of a topic of special interest to the student.,"Fall, Spring, Summer",https://catalog.iastate.edu/azcourses/l_a/
LA,5900B,Special Topics: Planting Design,1-6.,,,,True,Instructor Permission for Course,Investigation of a topic of special interest to the student.,"Fall, Spring, Summer",https://catalog.iastate.edu/azcourses/l_a/
LA,5900C,Special Topics: Construction,1-6.,,,,True,Instructor Permission for Course,Investigation of a topic of special interest to the student.,"Fall, Spring, Summer",https://catalog.iastate.edu/azcourses/l_a/
LA,5900D,Special Topics: History/Theory/Criticism,1-6.,,,,True,Instructor Permission for Course,Investigation of a topic of special interest to the student.,"Fall, Spring, Summer",https://catalog.iastate.edu/azcourses/l_a/
LA,5900E,Special Topics: Landscape Planning,1-6.,,,,True,Instructor Permission for Course,Investigation of a topic of special interest to the student.,"Fall, Spring, Summer",https://catalog.iastate.edu/azcourses/l_a/
LA,5900F,Special Topics: Urban Design,1-6.,,,,True,Instructor Permission for Course,Investigation of a topic of special interest to the student.,"Fall, Spring, Summer",https://catalog.iastate.edu/azcourses/l_a/
LA,5900G,Special Topics: Graphics,1-6.,,,,True,Instructor Permission for Course,Investigation of a topic of special interest to the student.,"Fall, Spring, Summer",https://catalog.iastate.edu/azcourses/l_a/
LA,5900I,Special Topics: Interdisciplinary Studies,1-6.,,,,True,Instructor Permission for Course,Investigation of a topic of special interest to the student.,"Fall, Spring, Summer",https://catalog.iastate.edu/azcourses/l_a/
LA,5900J,Special Topics: International Studies,1-6.,,,,True,Instructor Permission for Course,Investigation of a topic of special interest to the student.,"Fall, Spring, Summer",https://catalog.iastate.edu/azcourses/l_a/
LA,5900K,Special Topics: Computer Applications,1-6.,,,,True,Instructor Permission for Course,Investigation of a topic of special interest to the student.,"Fall, Spring, Summer",https://catalog.iastate.edu/azcourses/l_a/
LA,5900L,Special Topics: Ecological Design,1-6.,,,,True,Instructor Permission for Course,Investigation of a topic of special interest to the student.,"Fall, Spring, Summer",https://catalog.iastate.edu/azcourses/l_a/
LA,5900M,Special Topics: Social/Behavioral,1-6.,,,,True,Instructor Permission for Course,Investigation of a topic of special interest to the student.,"Fall, Spring, Summer",https://catalog.iastate.edu/azcourses/l_a/
LA,5900N,Special Topics: Natural Resources,1-6.,,,,True,Instructor Permission for Course,Investigation of a topic of special interest to the student.,"Fall, Spring, Summer",https://catalog.iastate.edu/azcourses/l_a/
LA,5910,Environmental Law and Planning,3.,Lecture 3.,,,,Graduate Standing or Permission of Instructor,"Environmental law and policy as applied in planning at the local and state levels. Brownfields, environmental justice, water quality, air quality, wetland and floodplain management, and local government involvement in ecological protection through land use planning and other programs.",Spring,https://catalog.iastate.edu/azcourses/l_a/
LA,5990,Creative Component,1-8.,,,,True,Instructor Permission for Course,Comprehensive study and original development of a project selected by the student and approved by the major professor. Completed project must be submitted to and approved by a graduate faculty committee as evidence of mastery of the principles of landscape architecture.,"Fall, Spring, Summer",https://catalog.iastate.edu/azcourses/l_a/
LA,6010,Introduction to Landscape Architecture,6.,Studio 12.,,,,,"Introduction to the theory and methods of landscape architectural design. Emphasis on creative space and place making at the site scale using the landscape palette. Exploration of two- and three-dimensional representation, both digital and analog, as a means of testing design ideas.",Fall,https://catalog.iastate.edu/azcourses/l_a/
LA,6020,Designing the Living Environment,6.,Studio 12.,,,,LA 6010,"Landscape design integrating knowledge of theory, land patterns, plant ecosystems, and human processes. Projects involve landform and plants at varied scale of design. Emphasis on competencies in design based in natural process, human behavior, and representation.",Spring,https://catalog.iastate.edu/azcourses/l_a/
LA,6030,Intermediate Landscape Architecture Studio,6.,Studio 12.,,,,LA 6020,"Theory and methods of landscape design at a variety of scales to achieve desired outcomes. Introduction to performance metrics drawn from design, humanities, and science. Development of program, inventory, and analysis to propose rigorous design ""arguments"" and meaningful, just and vibrant environments.",Fall,https://catalog.iastate.edu/azcourses/l_a/
LA,6040,Urban Landscapes,6.,Studio 12.,,,,LA 6030,"Examination of sociopolitical, ecological, and visual-spatial conditions of the urban environment. Projects highlight the complexity of planning and design of urban systems. Development of innovative strategies for sustainable, healthy, and just cities. Investigation of climate impacts and evolutionary design strategies.",Spring,https://catalog.iastate.edu/azcourses/l_a/
LA,6050,Advanced Landscape Architecture,6.,Studio 12.,,,,LA 6040,"Landscape design focusing on broadening landscape architectural concepts applied to complex sites at multiple scales. Emphasis on ideation and technical competency through advanced conceptualization, performance metrics, and skills in design research, digital representation, and teamwork.",,https://catalog.iastate.edu/azcourses/l_a/
LA,6990,Thesis Research,1-8.,,,,True,Instructor Permission for Course,Advanced and original scholarship in a specialized area. Culminates in a thesis document submitted to and approved by a graduate faculty committee as evidence of mastery of research in landscape architecture.,"Fall, Spring, Summer",https://catalog.iastate.edu/azcourses/l_a/
