subject_code,course_number,title_name,credits,contact_hours,cross_listed,dual_listed,repeatable,prerequisites,description,typically_offered,source_url
LA,2010,Studio: Landscape Interpretation and Representation,6.,Studio 12.,,,,Landscape Architecture professional program,"Reading and representing varied landscapes; development of aesthetic sensitivity to the geomorphology, vegetation, and cultural influences on these landscapes. Small-scale interventions and exploration of landscape phenomena and change. Emphasis on a variety of documentation and drawing techniques.",Fall,https://catalog.iastate.edu/azcourses/l_a/
LA,2020,Studio: Site Design I,6.,Studio 12.,,,,LA 2010,"Fundamental issues of landscape planning and design at a site scale. Projects introduce a variety of (objective and subjective) site inquiry methods, space and place making, and sensitive integration of architecture and landscape for specific land uses. User needs, precedent study, programming, site engineering, planting design, and outdoor space design expressed through a variety of three-dimensional modeling, graphic, and written media.",Spring,https://catalog.iastate.edu/azcourses/l_a/
LA,2110,Digital Design Methods for Landscape Architecture,3.,Lecture 3.,,,,,"Foundational knowledge and basic skills in 2D, 3D, and 4D computer applications used for design development and communication, with emphasis on 3D modeling and workflow interoperability.",Spring,https://catalog.iastate.edu/azcourses/l_a/
LA,2210,Native Plants of the Savanna Ecotone,3.,"Lecture 2, Laboratory 3.",,,,Landscape Architecture professional program,"Observation and study of the wetland, prairie, and woodland vegetation native to the savanna ecotone. Emphasis on plant communities, their distribution, structure, habitat and aesthetics. Plant identification and use in landscape design. Precedent and case studies of vegetation preservation, restoration and use in built works.",Fall,https://catalog.iastate.edu/azcourses/l_a/
LA,2220,Introduced Plants of the Midwest,3.,"Lecture 2, Studio 3.",,,,LA 2210,"Identification, observation, and study of plants introduced to cultivation in the Midwest region. Plant cultural requirements, including adaptations to climate changes, solar exposure, and soil conditions. Investigation of history of plant introduction and use in designed landscape, including consequent impacts of plant introduction such as plant invasion. Introduction to planting design at the site scale, including matching plant cultural requirements to site conditions, functional uses of plants and expressive composition using plant form, texture and color.",Spring,https://catalog.iastate.edu/azcourses/l_a/
LA,2410,Developing Identity as a Landscape Architect,1.,Lecture 1.,,,,Landscape Architecture professional program,"Development of life skills for conflict resolution, effective interpersonal communication, and CPR/First Aid. Examination of personal values as they relate to the backgrounds, abilities, attitudes, and values of others; exploration of how these influence personal decision-making and group interaction. Reading, discussion, class activities, journal-keeping, writing. Offered on a satisfactory-fail basis only.",Fall,https://catalog.iastate.edu/azcourses/l_a/
LA,2700,Foundations in Natural Resource Policy and History,3.,Lecture 3.,,,,,"The development of natural resource conservation philosophy and policy from the Colonial Era to the present. North American wildlife, forestry, and environmental policy; national parks and other protected lands; federal and state agencies. Relationship to cultural contexts, including urban reform and American planning movement. Discussion of common pool resources, public and private lands.",Fall,https://catalog.iastate.edu/azcourses/l_a/
LA,2720,Landscape Studies,3.,Lecture 3.,,,,Landscape Architecture professional program,"Exploration of landscapes, from broad settlement patterns to individual sites. Investigation of relationships between vernacular and designed landscapes. Landscapes considered as modes of cultural production that shape and are shaped by social, political, and economic processes. Lectures, reading, field studies, and writing. Meets U.S. Cultures and Communities Requirement.",Fall,https://catalog.iastate.edu/azcourses/l_a/
LA,2810,"Investigating Landscape Form, Process, and Detail",3.,"Lecture 1, Laboratory 6.",,,,Landscape Architecture professional program,"Exploration of the poetics and principles of landscape construction. Investigation and interpretation of landform and geomorphic processes such as the hydrologic cycle, erosion, and sedimentation. Close observation and representation of detail design, with an emphasis on material types, their connections, and weathering. Readings, field studies, and drawings in analog and digital media.",Fall,https://catalog.iastate.edu/azcourses/l_a/
LA,3010,Site Design II,6.,Studio 12.,,,,LA 2020,"Iterative development of half-acre to hundred-acre landscape design and planning proposals. Assess and interpret a program of use, organize subjective and objective site inventory and analysis, and develop functional and poetic conceptual design strategies. Development of high-quality verbal and graphic skills to support design process and iteration.",Fall,https://catalog.iastate.edu/azcourses/l_a/
LA,3020,Ecological Design,6.,Studio 12.,,,,"LA 2820, LA 3010 , LA 3810 and NREM 1200","Exploration and application of ecological theories and processes in design and planning to include hundred plus-acre scale in urban, urban fringe, and rural landscapes. Apply advanced landscape analysis of soil, water, topography, and vegetation utilizing geographic information systems with an emphasis on inventory and analysis mapping.",Spring,https://catalog.iastate.edu/azcourses/l_a/
LA,3090,Field Travel,1-2.,,,,True,Landscape Architecture professional program,"Observation of and reflection on professional practice and landscapes in urban, rural, and wilderness areas. Offered on a satisfactory-fail basis only.","Fall, Spring, Summer",https://catalog.iastate.edu/azcourses/l_a/
LA,3220,Fundamentals of Planting Design,3.,,,,,LA 2020,"The art and techniques of creating plant compositions in the landscape that respond to cultural and biophysical contexts. Methods of site inventory and analysis, developing plant palettes and composing plant assemblages that address biodiversity, expressive and functional needs. Introduction to the techniques of preparing planting plans, including standards for plant selection, plant lists and plant specification.",Fall,https://catalog.iastate.edu/azcourses/l_a/
LA,3410,Contemporary Landscape Architecture,1.,Lecture 1.,,,,"LA 3010 , LA 3810 and NREM 1200","Exploration of contemporary landscape architectural practice through individualized research into practicing firms. Preparation of paper and presentation outlining broad framework and specific parameters of a selected area of contemporary practice using specific projects as examples. Work may result in invitation of current practitioner(s) as a lecture series or event. Resume and portfolio preparation in advance of required off-campus semester (LA 4440 A, B or C).",Spring,https://catalog.iastate.edu/azcourses/l_a/
LA,3710,"History of Modern Landscapes, 1750 to Present",3.,Lecture 3.,,,,,"Investigation of landscape design concepts and trends as observed over time, from approximately 1750 to the present, with emphasis on the United States and Europe. Examination of significant figures and outstanding works (sites, gardens, landscapes, monuments, subdivisions, city plans, etc.) of varied geographic regions. Analysis of the social, economic, political, and technical forces contributing to the development of landscape design styles, vocabulary, and literature. Lectures, readings, projects, research papers.",Fall,https://catalog.iastate.edu/azcourses/l_a/
LA,3730,Gardens and Landscapes from Antiquity to 1750,3.,Lecture 3.,,,,,"Investigation of international landscape design concepts and trends as observed over time, from pre-history to the mid 18th century. Examination of significant figures and outstanding works (sites, gardens, landscapes, monuments, subdivisions, city plans, etc.) of varied geographic regions. Analysis of the social, economic, political, and technical forces contributing to the development of landscape design styles, vocabulary, and literature. Lectures, readings, projects, research papers. Meets International Perspectives Requirement.",Spring,https://catalog.iastate.edu/azcourses/l_a/
LA,3810,Shaping the Land,3.,,,,,,"Design of landforms to achieve aesthetic, functional, and safety goals. Landform changes to accommodate human uses and activities. Impacts and implications of landform transformation on the surrounding environment. Surface and subsurface drainage design, storm water runoff best management practices, contour manipulation to incorporate slopes, swales, culverts, pads, retaining walls, walks, steps, terraces, buildings, and other structures in the landscape. Road layout and alignment, parking lot design, and earthwork volume estimates. Design communication using CAD, perspectives, cross-sections, contour maps, landform models, and narratives. Class exercises, case study precedents, and preliminary construction documents.",Fall,https://catalog.iastate.edu/azcourses/l_a/
LA,4020,Urban Design,6.,Studio 12.,,,,LA 3020,"Comprehensive planning and design for urban sites or for sites within urban contexts. Projects typically include planning for a variety of integrated land uses, and cover the full range of design scales from master planning to proposals for site details. Emphasis on written and verbal as well as graphic communications. Integrated seminar component.",Fall,https://catalog.iastate.edu/azcourses/l_a/
LA,4020H,Urban Design: Honors,7.,Studio 12.,,,,LA 3020 ; Membership in the University Honors Program,"Comprehensive planning and design for urban sites or for sites within urban contexts. Projects typically include planning for a variety of integrated land uses, and cover the full range of design scales from master planning to proposals for site details. Emphasis on written and verbal as well as graphic communications. Integrated seminar component.",Fall,https://catalog.iastate.edu/azcourses/l_a/
LA,4030H,Senior Thesis Preparation Tutorial,2.,,,,,LA 4020 or LA 4020H; permission of thesis advisor; Membership in the Honors Program,Preparation for senior thesis.,Fall,https://catalog.iastate.edu/azcourses/l_a/
LA,4040,Advanced Landscape Architectural Design,6.,Studio 12.,,,True,LA 4020,Advanced forum for the demonstration of sophistication in landscape architectural design. Experimentation and innovation are encouraged.,Fall,https://catalog.iastate.edu/azcourses/l_a/
LA,4040H,Advanced Landscape Architectural Design: Honors,6-7.,Studio 12.,,,True,LA 4020 ; Membership in the University Honors Program,Advanced forum for the demonstration of sophistication in landscape architectural design. Experimentation and innovation are encouraged.,Fall,https://catalog.iastate.edu/azcourses/l_a/
LA,4050H,Senior Thesis,6.,Studio 15.,,,,LA 4010; LA 4020 ; LA 4030; Department Permission; Membership in the University Honors Program,Individual advanced forum for the demonstration of sophistication in landscape architectural design. Experimentation and innovation are expected.,,https://catalog.iastate.edu/azcourses/l_a/
LA,4110,Advanced Digital Design for Landscape Architecture,3.,Lecture 3.,,,,,"Visualization of site scale design for presentation and analysis with emphasis on 3D modeling, rendering, videography, and parametric methods.",Spring,https://catalog.iastate.edu/azcourses/l_a/
LA,4420,Professional Practice,2.,Lecture 2.,,,,LA 4810,"Studies of conventional and developing forms of public and private practice. Explore relationships between professional life and the culture of the professional design firm; investigate firm identities and structures; understand design projects, their delivery process, and contractual agreements. Lecture and class discussion.",Spring,https://catalog.iastate.edu/azcourses/l_a/
LA,4440A,Landscape Architecture Independent Educational Enrichment: Professional Internship,Required.,,,,True,LA 3410 or Permission of Advisor and Chair,"Independent educational enrichment through exploration of landscape architectural practice in a professional internship, international studies, or out-of-region national study experience. Offered on a satisfactory-fail basis only.","Fall, Spring, Summer",https://catalog.iastate.edu/azcourses/l_a/
LA,4440B,Landscape Architecture Independent Educational Enrichment: Study Abroad,Required.,,,,True,LA 3410 or Permission of Advisor and Chair,"Independent educational enrichment through exploration of landscape architectural practice in a professional internship, international studies, or out-of-region national study experience.","Fall, Spring, Summer",https://catalog.iastate.edu/azcourses/l_a/
LA,4440C,Landscape Architecture Independent Educational Enrichment: National Student Exchange,Required.,,,,True,LA 3410 or Permission of Advisor and Chair,"Independent educational enrichment through exploration of landscape architectural practice in a professional internship, international studies, or out-of-region national study experience.","Fall, Spring, Summer",https://catalog.iastate.edu/azcourses/l_a/
LA,4540,Fundamentals of Remote Sensing and Spatial Analysis,3.,Lecture 3.,,,,CRP 3510 or AGRON 2700 or NREM 3450 or GEOL 4520 or LA 3020 or CRP 5510 or GEOL 5520,"Introduction to image processing techniques needed for analysis of optical remote sensing imagery, including filtering, enhancement, and classification. Analysis of elevation surfaces, hydrology, distance, overlays and visual programming with Model Builder. Practical applications in a variety of topics to understand how to analyze imagery.",Spring,https://catalog.iastate.edu/azcourses/l_a/
LA,4590,Digital Design Methods for Landscape Architecture,3.,Lecture 3.,,,,,"Introduction to digital tools used by landscape architects for design communication, visualization, and design development, with emphasis on 3D modeling and workflow interoperability.",Spring,https://catalog.iastate.edu/azcourses/l_a/
LA,4740,Environmental Justice in Built Environments,3.,Lecture 3.,,,,,"Introduction to inequitable access to healthy environments as an issue in planning and design. Focus on cumulative effects of climate change, environmental hazards, and physical design on vulnerable populations. Examination of current research. Mapping in GIS and spatial analysis to assess unjust environmental burdens and equitable built environments.","Fall, Fall",https://catalog.iastate.edu/azcourses/l_a/
LA,4780A,Topical Studies in Landscape Architecture: Landscape Design,2-3.,Lecture 3.,,,True,LA 2020 OR Senior or Graduate classification,Offerings vary with each term; check with department for available sections.,"Fall, Spring, Summer",https://catalog.iastate.edu/azcourses/l_a/
LA,4780B,Topical Studies in Landscape Architecture: Planting Design,2-3.,Lecture 3.,,,True,LA 2020 OR Senior or Graduate classification,Offerings vary with each term; check with department for available sections.,"Fall, Spring, Summer",https://catalog.iastate.edu/azcourses/l_a/
LA,4780C,Topical Studies in Landscape Architecture: Construction,2-3.,Lecture 3.,,,True,LA 2020 OR Senior or Graduate classification,Offerings vary with each term; check with department for available sections.,"Fall, Spring, Summer",https://catalog.iastate.edu/azcourses/l_a/
LA,4780D,Topical Studies in Landscape Architecture: History/Theory/Criticism,2-3.,Lecture 3.,,,True,LA 2020 OR Senior or Graduate classification,Offerings vary with each term; check with department for available sections.,"Fall, Spring, Summer",https://catalog.iastate.edu/azcourses/l_a/
LA,4780E,Topical Studies in Landscape Architecture: Landscape Planning,2-3.,Lecture 3.,,,True,LA 2020 OR Senior or Graduate classification,Offerings vary with each term; check with department for available sections.,"Fall, Spring, Summer",https://catalog.iastate.edu/azcourses/l_a/
LA,4780F,Topical Studies in Landscape Architecture: Urban Design,2-3.,Lecture 3.,,,True,LA 2020 OR Senior or Graduate classification,Offerings vary with each term; check with department for available sections.,"Fall, Spring, Summer",https://catalog.iastate.edu/azcourses/l_a/
LA,4780G,Topical Studies in Landscape Architecture: Graphics,2-3.,Lecture 3.,,,True,LA 2020 OR Senior or Graduate classification,Offerings vary with each term; check with department for available sections.,"Fall, Spring, Summer",https://catalog.iastate.edu/azcourses/l_a/
LA,4780H,Topical Studies in Landscape Architecture: Honors,2-3.,Lecture 3.,,,True,LA 2020 OR Senior or Graduate classification; Membership in the University Honors Program,Offerings vary with each term; check with department for available sections.,"Fall, Spring, Summer",https://catalog.iastate.edu/azcourses/l_a/
LA,4780I,"Quality of Life, Health, and the Environment",2-3.,Lecture 3.,,,True,LA 2020 OR Senior or Graduate classification,Offerings vary with each term; check with department for available sections.,"Fall, Spring, Summer",https://catalog.iastate.edu/azcourses/l_a/
LA,4780J,Topical Studies in Landscape Architecture: International Studies,2-3.,Lecture 3.,,,True,LA 2020 OR Senior or Graduate classification,Offerings vary with each term; check with department for available sections.,"Fall, Spring, Summer",https://catalog.iastate.edu/azcourses/l_a/
LA,4780K,Landscape Architecture: Computer Applications,2-3.,Lecture 3.,,,True,LA 2020 OR Senior or Graduate classification,Offerings vary with each term; check with department for available sections. Course contact hours can range from (2-0) to (3-0) depending on number of credits.,"Fall, Spring, Summer",https://catalog.iastate.edu/azcourses/l_a/
LA,4780L,Topical Studies in Landscape Architecture: Ecological Design,2-3.,Lecture 3.,,,True,LA 2020 OR Senior or Graduate classification,Offerings vary with each term; check with department for available sections.,"Fall, Spring, Summer",https://catalog.iastate.edu/azcourses/l_a/
LA,4780M,Topical Studies in Landscape Architecture: Landscape Architecture: Social/Behavioral,2-3.,Lecture 3.,,,True,LA 2020 OR Senior or Graduate classification,Offerings vary with each term; check with department for available sections.,"Fall, Spring, Summer",https://catalog.iastate.edu/azcourses/l_a/
LA,4780N,Topical Studies in Landscape Architecture: Natural Resources,2-3.,Lecture 3.,,,True,LA 2020 OR Senior or Graduate classification,Offerings vary with each term; check with department for available sections.,"Fall, Spring, Summer",https://catalog.iastate.edu/azcourses/l_a/
LA,4810,Landscape Materials,3.,Lecture 3.,,,,LA 3810,"Examination and identification of characteristics, applications, systems, and uses of common landscape construction materials including wood, paving, walls, masonry, concrete, and metals. Investigation of the relationships between site plans and construction details with an emphasis on the aesthetic and functional use of landscape details. Preliminary preparation of construction documents using design documentation software.",Spring,https://catalog.iastate.edu/azcourses/l_a/
LA,4820,Landscape Construction Documentation,3.,Lecture 3.,,,,LA 4810,"Development of advanced construction documents, including documentation processes, cost estimation, sheet coordination, and specification writing. Emphasis on documentation software as a tool for design communication.",Spring,https://catalog.iastate.edu/azcourses/l_a/
LA,4900A,Independent Study: Landscape Design,1-6.,,,,True,Department Permission for Course,Investigation of a topic of special interest to the student.,"Fall, Spring, Summer",https://catalog.iastate.edu/azcourses/l_a/
LA,4900B,Independent Study: Planting Design,1-6.,,,,True,Department Permission for Course,Investigation of a topic of special interest to the student.,"Fall, Spring, Summer",https://catalog.iastate.edu/azcourses/l_a/
LA,4900C,Independent Study: Construction,1-6.,,,,True,Department Permission for Course,Investigation of a topic of special interest to the student.,"Fall, Spring, Summer",https://catalog.iastate.edu/azcourses/l_a/
LA,4900D,Independent Study: History/Theory/Criticism,1-6.,,,,True,Instructor Permission for Course,Investigation of a topic of special interest to the student.,"Fall, Spring, Summer",https://catalog.iastate.edu/azcourses/l_a/
LA,4900E,Independent Study: Landscape Planning,1-6.,,,,True,Department Permission for Course,Investigation of a topic of special interest to the student.,"Fall, Spring, Summer",https://catalog.iastate.edu/azcourses/l_a/
LA,4900F,Independent Study: Urban Design,1-6.,,,,True,Department Permission for Course,Investigation of a topic of special interest to the student.,"Fall, Spring, Summer",https://catalog.iastate.edu/azcourses/l_a/
LA,4900G,Independent Study: Graphics,1-6.,,,,True,Department Permission for Course,Investigation of a topic of special interest to the student.,"Fall, Spring, Summer",https://catalog.iastate.edu/azcourses/l_a/
LA,4900H,Independent Study: Honors,1-6.,,,,True,Department Permission for Course; Membership in the University Honors Program,Investigation of a topic of special interest to the student.,"Fall, Spring, Summer",https://catalog.iastate.edu/azcourses/l_a/
LA,4900I,Independent Study: Interdisciplinary Studies,1-6.,,,,True,Department Permission for Course,Investigation of a topic of special interest to the student.,"Fall, Spring, Summer",https://catalog.iastate.edu/azcourses/l_a/
LA,4900J,Independent Study: International Studies,1-6.,,,,True,Department Permission for Course,Investigation of a topic of special interest to the student.,"Fall, Spring, Summer",https://catalog.iastate.edu/azcourses/l_a/
LA,4900K,Independent Study: Computer Applications,1-6.,,,,True,Department Permission for Course,Investigation of a topic of special interest to the student.,"Fall, Spring, Summer",https://catalog.iastate.edu/azcourses/l_a/
LA,4900L,Independent Study: Ecological Design,1-6.,,,,True,Department Permission for Course,Investigation of a topic of special interest to the student.,"Fall, Spring, Summer",https://catalog.iastate.edu/azcourses/l_a/
LA,4900M,Independent Study: Social/Behavioral,1-6.,,,,True,Department Permission for Course,Investigation of a topic of special interest to the student.,"Fall, Spring, Summer",https://catalog.iastate.edu/azcourses/l_a/
LA,4900N,Independent Study: Natural Resources,1-6.,,,,True,Department Permission for Course,Investigation of a topic of special interest to the student.,"Fall, Spring, Summer",https://catalog.iastate.edu/azcourses/l_a/
LA,4910,Environmental Law and Planning,3.,Lecture 3.,,,,6 credits natural sciences or permission of instructor,"Environmental law and policy as applied in planning at the local and state levels. Brownfields, environmental justice, water quality, air quality, wetland and floodplain management, and local government involvement in ecological protection through land use planning and other programs.",Spring,https://catalog.iastate.edu/azcourses/l_a/
LA,5090,Field Travel,1.,,,,True,Graduate Standing or Permission of Instructor,Observation of and reflection on professional and academic practice and landscapes. Field study and travel to conferences and educational events. Reading and final report. Offered on a satisfactory-fail basis only.,,https://catalog.iastate.edu/azcourses/l_a/
LA,5210,Introduction to Plants,3.,"Lecture 2, Laboratory 3.",,,,Graduate Standing or Permission of Instructor,"Observation and study of plants adapted to the Midwest ecoregion. Emphasis on plant communities, their distribution, structure, habitat and aesthetics. Plant identification and use of planted form in the designed landscape.",Fall,https://catalog.iastate.edu/azcourses/l_a/
LA,5220,Advanced Plant Technology,3.,"Lecture 2, Studio 2.",,,,Graduate Standing or Permission of Instructor,"Introduction to the science that supports green technologies. Plant and soil design for performance in the built environment. Design studies and lab explorations will complement readings, lecture and project case study presentations by practitioners. Green streets, green roofs, bio- phyto-remediation and other technologies are introduced. Final project integrates scientific and technical knowledge in a holistic landscape design.",Fall,https://catalog.iastate.edu/azcourses/l_a/
LA,5410,Design Inquiry,3.,Lecture 3.,,,,Graduate Standing or Permission of Instructor,"Examination of design inquiry and introduction to research methods relevant to design. Consideration of where knowledge comes from, and how different research methods help create knowledge in various contexts. Readings, discussions, and sketch problems. Preparation of a written research proposal.",Spring,https://catalog.iastate.edu/azcourses/l_a/
LA,5420,Professional Practice,2.,Lecture 2.,,,,Graduate Standing or Permission of Instructor,"Studies of conventional and developing forms of public and private practice. Explore relationships between professional life and the culture of the professional design firm; investigate firm identities and structures; understand design projects, their delivery process, and contractual agreements. Lecture and class discussion.",Spring,https://catalog.iastate.edu/azcourses/l_a/
LA,5430,Colloquium: Landscape Architecture Research,1.,Lecture 1.,,,,Graduate Standing or Permission of Instructor,Forum on current research in landscape architecture. Weekly presentation and discussion of scholarship relevant to the field. Offered on a satisfactory-fail basis only.,Spring,https://catalog.iastate.edu/azcourses/l_a/
