subject_code,course_number,title_name,credits,contact_hours,cross_listed,dual_listed,repeatable,prerequisites,description,typically_offered,source_url
POLS,1010,Exploring Political Science,1.,Lecture 1.,,,,,"Introduction to a variety of approaches to political questions. Relevance to career paths. For political science majors and others interested in exploring political questions. Recommended first semester of freshman year, or as soon as possible after declaring the major. Offered on a satisfactory-fail basis only.","Fall, Spring",https://catalog.iastate.edu/azcourses/pol_s/
POLS,1110,Introduction to American Government,3.,Lecture 3.,,,,,"Fundamentals of American democracy; constitutionalism; federalism; rights and duties of citizens; executive, legislative, and judicial branches of government; elections, public opinion, interest groups, and political parties.","Fall, Spring",https://catalog.iastate.edu/azcourses/pol_s/
POLS,1210,Introduction to International Politics,3.,Lecture 3.,,,,,"Dynamics of interstate relations pertaining to nationalism, the nation state; peace and war; foreign policy making; the national interest; military capability and strategy; case studies of transnational issues, such as population, food, energy, and terrorism. Meets International Perspectives Requirement.","Fall, Spring",https://catalog.iastate.edu/azcourses/pol_s/
POLS,1250,Democracy and Dictatorship: Introduction to Comparative Politics,3.,Lecture 3.,,,,,"Interactions between governments and citizens in countries outside the US. Causes of democracy, dictatorship, and economic and social development. Meets International Perspectives Requirement.","Fall, Spring",https://catalog.iastate.edu/azcourses/pol_s/
POLS,2220X,Global Engagement,3.,Lecture 3.,,,,,"Engagement with social and political issues on a global scale. Contributions of individual action, non-governmental organizations, and governments to changing societal and international outcomes. Techniques for identifying and addressing problems around the world. Meets International Perspectives Requirement.",Fall,https://catalog.iastate.edu/azcourses/pol_s/
POLS,2320X,Politics of Business,3.,Lecture 3.,,,,,"Characteristics of American political economy and its comparison to other countries. Wealth, power, and the market in politics; the relationship between capitalism and democracy. The regulation of corporations, and the relationship between governments and business.","Fall, Spring, Summer",https://catalog.iastate.edu/azcourses/pol_s/
POLS,2350,Introduction to Ethics and Politics,3.,Lecture 3.,,,,,"Moral controversies surrounding political issues such as violence, deception, corruption, civil disobedience, democracy, justice, equality, and freedom. Political applications of classic and contemporary texts.",Fall,https://catalog.iastate.edu/azcourses/pol_s/
POLS,2610,Thinking Like a Political Scientist: Qualitative Approaches,3.,Lecture 3.,,,,,"Theory and method in empirical political science, with an emphasis on qualitative social-science methodologies. Research design, causal logic, and use of evidence. Content analysis, case studies, focus groups, and interviews.",Fall,https://catalog.iastate.edu/azcourses/pol_s/
POLS,2620,Thinking Like a Political Scientist: Quantitative Approaches,3.,Lecture 3.,,,,,"Theory and method in empirical political science, with an emphasis on quantitative social-science methodologies. Research design, causal logic, and use of evidence. Regressions, experiments, and polls and surveys.",Spring,https://catalog.iastate.edu/azcourses/pol_s/
POLS,2710,Public Organizations and Leadership,3.,Lecture 3.,,,,,"Introductory survey of public governance at the administrative and managerial levels of international, national, state, and local government. Essential issues and competencies involved in efficient, effective, and ethical provision of public goods and services. Relationships inside and across governments, social equity, public-private partnerships, and privatization.",Fall,https://catalog.iastate.edu/azcourses/pol_s/
POLS,2830,Introduction to Environmental Politics and Policies,3.,Lecture 3.,,,,,"Introduction to major ideologies' relations to conservation and ecology. Processes, participants, and institutions involved in state, national, and global environmental policymaking. Case studies of environmental controversies and proposals for policy reform.",Spring,https://catalog.iastate.edu/azcourses/pol_s/
POLS,2980,Cooperative Education,Required.,,,,True,Permission of the department cooperative education coordinator; sophomore classification,Required of all cooperative education students. Students must register for this course prior to commencing each work period.,"Fall, Spring, Summer",https://catalog.iastate.edu/azcourses/pol_s/
POLS,3050,Comparative Political Behavior,3.,Lecture 3.,,,,,"Political attitudes and behaviors of citizens in democracies, both in the US and cross-nationally. Citizens' traits and their relationship to democracy. Offered even-numbered years.",Fall,https://catalog.iastate.edu/azcourses/pol_s/
POLS,3060,Public Opinion and Voting Behavior,3.,Lecture 3.,,,,,"The formation of political opinions and attitudes, political participation, and voting behavior of the general public, and their influences on American politics; polling as a means of assessing public opinions and behaviors.",Spring,https://catalog.iastate.edu/azcourses/pol_s/
POLS,3070X,Political Psychology,3.,Lecture 3.,,,,,"Psychological influences on political behavior. Political preferences, personality, cognitive biases, political violence, and partisan identities. Psychological explanations of contemporary political events.",Fall,https://catalog.iastate.edu/azcourses/pol_s/
POLS,3080,Video Games and Politics,3.,Lecture 3.,,,,,"Interactions between video games and politics from the perspective of both state and society. History and regulation of video games; games' connection with war and with authoritarian regimes; representation, race, and gender in games and game communities; games' influence on social and political attitudes.","Fall, Spring, Summer",https://catalog.iastate.edu/azcourses/pol_s/
POLS,3100,State and Local Government,3.,Lecture 3.,,,,,"Role of state and local governments in the American federal system. Structures of participation: political parties, elections, interest groups. Major governmental institutions: legislative, executive, and judicial. Structure and functions of local governments.","Fall, Spring",https://catalog.iastate.edu/azcourses/pol_s/
POLS,3110,Federal Indian Law and Policy,3.,Lecture 3.,,,,,"Examines the impact of federal American Indian policies on Native communities, especially contemporary Indian Country and communities. Topics include sovereignty, recognition, the role of the Supreme Court, specific policies like allotment, and other relevant issues. AMIN 2100 recommended. Meets U.S. Cultures and Communities Requirement.",,https://catalog.iastate.edu/azcourses/pol_s/
POLS,3180,Campaigns and Elections,3.,Lecture 3.,,,,,Methods and strategies of political campaigns in American elections. History of the electoral process and the transformation of American campaigns.,Fall,https://catalog.iastate.edu/azcourses/pol_s/
POLS,3190,Law and Politics,3.,Lecture 3.,,,,,"American judicial system and controversies spanning law and politics. Potential topics include statutory construction, judicial review, proper role of the judiciary, vagueness and ambiguity in law, competing constitutional philosophies, executive branch concerns, and relative power of different branches. POLS 1110 recommended. Graduation Restriction: Only one of POLS 2300, 3190 may count toward graduation.",Fall,https://catalog.iastate.edu/azcourses/pol_s/
POLS,3200,American Judicial Process,3.,Lecture 3.,,,,,"An overview of the American judicial process. Emphasis on specific topics such as application of constitutional rights to the states (particularly the Fourth, Fifth, Sixth, and Fourteenth Amendments), mechanics of judicial opinions, constitutional philosophies of Supreme Court Justices, decisions of first impression, and the value and scope of precedent.",Spring,https://catalog.iastate.edu/azcourses/pol_s/
POLS,3240,Health and Native American Communities,3.,Lecture 3.,,,,ENGL 2500,"Overview of historic and contemporary health and health care in Native Communities. Indian Health Service and specific regulations. Consideration of both cultural and scientific approaches to medicine. Specific health issues (e.g., diabetes, alcoholism, depression, etc.) in American Indian communities. Meets U.S. Cultures and Communities Requirement.",,https://catalog.iastate.edu/azcourses/pol_s/
POLS,3250,"Religion, Law, and Justice",3.,Lecture 3.,,,,,"A study of the role of religion in law and justice with a focus on the United States. Examines the history of religious freedom, key contemporary legal cases, and how religious-oriented justice movements engage ethics and the law.",Fall,https://catalog.iastate.edu/azcourses/pol_s/
POLS,3330,Democracy in America,3.,Lecture 3.,,,,,"Competing American conceptions of democracy as expressed in founding documents and important texts in American political thought. Implications for contemporary debates about religion, race, gender, and wealth. Meets U.S. Cultures and Communities Requirement.",Spring,https://catalog.iastate.edu/azcourses/pol_s/
POLS,3340,Politics and Society,3.,Lecture 3.,,,,,"The relationship between politics and society with emphasis on American society. Discussion of theories of inequality, power, social movements, elites, ruling classes, democracy, and capitalism.",Fall,https://catalog.iastate.edu/azcourses/pol_s/
POLS,3350,"Science, Technology, and Public Policy",3.,Lecture 3.,,,,,"Examines the history and political dynamics of public science and technology policies. Examines differences in political and technological orientations. Assessment of the roles of politics, media, engineering, science, and private business in the formation of public policies that put heavy reliance on or seek to advance science and technology.",Spring,https://catalog.iastate.edu/azcourses/pol_s/
POLS,3360X,Climate Change Policy,3.,Lecture 3.,,,,3 credits in POLS OR ECON 1010 OR Sophomore Classification,"Policy-centered approach to climate-change solutions. Investigation, analysis, and evaluation of policy responses to the prospect and occurrence of climate change. Politics of climate-related technological, regulatory, and societal changes. Interaction of social movements, institutions, and economic interests in shaping national and global responses to climate change.",Spring,https://catalog.iastate.edu/azcourses/pol_s/
POLS,3370X,Health Politics and Policy,3.,Lecture 3.,,,,,"Analysis of the evolution of the American system of healthcare. Financing, regulation, delivery, and the policy process related to healthcare policymaking by political institutions including Congress, the presidency and executive branch, federal courts, and state and local governments. Exploration of factors leading to disparities in healthcare service delivery and outcomes. Offered odd-numbered years. Meets U.S. Cultures and Communities Requirement.",Fall,https://catalog.iastate.edu/azcourses/pol_s/
POLS,3390,Liberty and Law in America,3.,Lecture 3.,,,,,"Competing conceptions of liberty in American political thought. Debates about how liberty should be protected by the law, in fields such as health care, drugs, property, speech, religion, and sex. Meets U.S. Cultures and Communities Requirement.","Fall, Spring",https://catalog.iastate.edu/azcourses/pol_s/
POLS,3400,Politics of Developing Areas,3.,Lecture 3.,,,,,Economic and political development as they relate to the political process of developing states. Impact of social and technological change on political systems of developing areas. Meets International Perspectives Requirement.,"Fall, Spring",https://catalog.iastate.edu/azcourses/pol_s/
POLS,3420,Chinese Politics,3.,Lecture 3.,,,,,"Legacies of Imperial China, the origins of the Chinese Civil War, and the causes and consequences of the reform era. Issues of contemporary China, including economic transformation, the structure of the Party/state, the environment, the media and other topics. Meets International Perspectives Requirement.","Fall, Spring, Summer",https://catalog.iastate.edu/azcourses/pol_s/
POLS,3430,Latin American Government and Politics,3.,Lecture 3.,,,,,"Political institutions, processes, and contemporary issues. Selected countries examined intensively to illustrate generalizations. Role of parties, military, church, human rights, women, environmental issues, interest groups, ideology, and globalization. Meets International Perspectives Requirement.","Fall, Spring, Summer",https://catalog.iastate.edu/azcourses/pol_s/
POLS,3440,Public Policy,3.,Lecture 3.,,,,,"How agendas come to be set in public policy, theories describing the policy-making process, forces molding policy choices and the impact of such choices.","Fall, Spring",https://catalog.iastate.edu/azcourses/pol_s/
POLS,3460,European Politics,3.,Lecture 3.,,,,,"Comparative study of political institutions of Europe and the European Union; emphasis on parties, elections, and governmental structures. Substance and process of public policies in selected problem areas. Meets International Perspectives Requirement.",Fall,https://catalog.iastate.edu/azcourses/pol_s/
POLS,3480,British Government and Politics,3.,Lecture 3.,,,,,"Political institutions and processes in Great Britain and Northern Ireland; emphasis on Parliament, executive and monarchy, and public policies, including devolution. Meets International Perspectives Requirement.","Fall, Spring, Summer",https://catalog.iastate.edu/azcourses/pol_s/
POLS,3490,Politics of Russia and Eastern Europe,3.,Lecture 3.,,,,,"Nation-states of Central and Eastern Europe. Comparison of European communist systems and the revolutionary conflict leading to the dissolution of communist Europe. Political analysis of post-communist Russian and Eastern European nation-states and their economic, cultural and social variations. Meets International Perspectives Requirement.","Fall, Spring, Summer",https://catalog.iastate.edu/azcourses/pol_s/
POLS,3500,Politics of the Middle East,3.,Lecture 3.,,,,,"Introduction to the Middle East as a region and to issues of political importance to the Middle East and its place in the world. Topics covered include political Islam, regional conflicts and alliances, local leaders, political economy, democracy, and human rights. Meets International Perspectives Requirement.",Spring,https://catalog.iastate.edu/azcourses/pol_s/
POLS,3520,Migration and Refugees in the 21st Century,3.,Lecture 3.,,,True,,"The historical, economic, social, political, and environmental factors that explain human mobility in the 21st century. The definition of a ""migrant"" with special emphasis on refugees (people who have been forcibly displaced across national borders). Ethnographic accounts of current refugee crises and of host state policy toward refugees. Meets International Perspectives Requirement.",,https://catalog.iastate.edu/azcourses/pol_s/
POLS,3530,Immigration Policy,3.,Lecture 3.,,,,,"Political, economic, and social factors that affect immigration policy. Systematic analysis and implications of different types of immigration policies in countries sending and receiving immigrants. Policies regarding incorporation of migrants into, and effects of migrants on, American society. Meets U.S. Cultures and Communities Requirement.",Fall,https://catalog.iastate.edu/azcourses/pol_s/
POLS,3540,War and the Politics of Humanitarianism,3.,Lecture 3.,,,,,Humanitarianism as a system of thought and a system of intervention in conflict and post-conflict situations. Role of humanitarian organizations and actors in addressing human suffering caused by conflict or war. Military action as a form of humanitarian intervention. Meets International Perspectives Requirement.,,https://catalog.iastate.edu/azcourses/pol_s/
POLS,3550,War and Politics,3.,Lecture 3.,,,,,"Theoretical relationship among politics, strategy, and war. Evolution of war, the relationship between technology and conflict, and the changing causes and nature of global violence. Meets International Perspectives Requirement.",Fall,https://catalog.iastate.edu/azcourses/pol_s/
POLS,3560,Theories of International Politics,3.,Lecture 3.,,,,,"Introduction to essential theoretical concepts and approaches, both classical and contemporary on world politics including realism, empiricism, liberalism, and postpositivism; for example, war and conflict, peace and cooperation, political economy, crisis decision-making, systemic theory, dependence and interdependence.","Fall, Spring, Summer",https://catalog.iastate.edu/azcourses/pol_s/
POLS,3570,International Security Policy,3.,Lecture 3.,,,,,"Contemporary approaches in the security area including strategic deterrence, cybersecurity, environmental security, peacekeeping and terrorism. Current cases to illustrate policies as well as historical and theoretical choices.","Fall, Spring, Summer",https://catalog.iastate.edu/azcourses/pol_s/
POLS,3580,United States Foreign Policy,3.,Lecture 3.,,,,,"U.S. foreign policy since World War II with emphasis on changing American values in foreign policy, the role of the President, Congress, and the bureaucracy in policy making, and a survey of current foreign policy issues and problems.",Spring,https://catalog.iastate.edu/azcourses/pol_s/
POLS,3590,Current Issues in American Foreign Policy,3.,Lecture 3.,,,,,"Examination of contemporary U.S. foreign policy issues (e.g., U.S. policy in the Middle East; defense budgeting in the post-Cold War era; conventional and nuclear arms control policy). The course will explore alternate methods to analyze policy, survey the evolution of each issue, and discuss different policy alternatives.","Fall, Spring, Summer",https://catalog.iastate.edu/azcourses/pol_s/
POLS,3600,American Institutions: Congress,3.,Lecture 3.,,,,,"Theory and practice of representation and deliberation in the legislative branch of the republic; operations of Congress in terms of its committees, leadership, legislative and oversight processes, partisan politics, electoral campaigns, service to local and special electoral campaigns, service to local and special interests, and interactions with the President.","Fall, Spring, Summer",https://catalog.iastate.edu/azcourses/pol_s/
POLS,3610,American Institutions: The Presidency,3.,Lecture 3.,,,,,"Creation and historical development of the office of chief executive; character and behavior of past chief executives; selection and control; powers, roles, functions; executive staff; relations with Congress, press, public opinion.","Fall, Spring, Summer",https://catalog.iastate.edu/azcourses/pol_s/
POLS,3630,American Institutions: Media,3.,Lecture 3.,,,,,"Influence of mass media organizations, forms, techniques, and technologies on the practices and expectations of American politics. Role of media in the political process, including promoting or discouraging political participation. Politics of traditional journalism, devices of propaganda, effects of campaign advertising, and media spectacles.",Spring,https://catalog.iastate.edu/azcourses/pol_s/
POLS,3640,Political Parties and Interest Groups,3.,Lecture 3.,,,,,"Nature of political parties and interest groups, their relation to each other, and their effects on American politics. Topics include party identification, party organization and mobilization, factionalism, lobbying, campaign contributions and financing, and the effects of special interests on public law.",Fall,https://catalog.iastate.edu/azcourses/pol_s/
POLS,3700,Religion and Politics,3.,Lecture 3.,,,,,"The interaction of religion and politics in the U.S. from both an historical and contemporary perspective, as well as the role of religion in politics internationally.",Fall,https://catalog.iastate.edu/azcourses/pol_s/
POLS,3810,International Political Economy,3.,Lecture 3.,,,,,"Politics of international economic interaction. Trade wars and agreements, cross-border finance and multinational corporations, exchange rates and monetary policy, outsourcing, and development under conditions of globalization.","Fall, Spring, Summer",https://catalog.iastate.edu/azcourses/pol_s/
POLS,3850,Women in Politics,3.,Lecture 3.,,,,,Entry and participation of women in politics in the United States and other countries. Contemporary issues and strategies for change through the political process. Meets U.S. Cultures and Communities Requirement.,Spring,https://catalog.iastate.edu/azcourses/pol_s/
POLS,3870,First Ladies in U.S. History,3.,Lecture 3.,,,,Sophomore classification,"Evolution of the role and office of the First Lady in U.S. history, including her political activism, social impact, and international influence. Analysis of the authority, intersectionality and agency of First Ladies in the aggregate and exploration of how individual First Ladies have interpreted and adapted this unique public position. Offered even-numbered years.",Fall,https://catalog.iastate.edu/azcourses/pol_s/
POLS,3890X,Agriculture and Global Politics,3.,Lecture 3.,,,,,"Political and governmental structures and institutions that regulate agriculture production and distribution in the United States and throughout the globe, including international agencies, nation-states, and non-governmental organizations. Agricultural politics and policies and their impact domestically and internationally.",Spring,https://catalog.iastate.edu/azcourses/pol_s/
POLS,3900,Topics in Political Science,1-4.,Lecture 4.,,,True,,Selected topics in political science. Graduation Restriction: A topic may not be taken more than once.,"Fall, Spring, Summer",https://catalog.iastate.edu/azcourses/pol_s/
POLS,3970,International Study and Travel,1-30.,Lecture 30.,,,True,Instructor Permission for Course,Supervised study in an aspect of discipline while traveling or located in a foreign country. Meets International Perspectives Requirement.,"Fall, Spring, Summer",https://catalog.iastate.edu/azcourses/pol_s/
POLS,3980,Cooperative Education,Required.,,,,True,Permission of Department Cooperative Education Coordinator; Junior classification,Required of all cooperative education students. Students must register for this course prior to commencing work period.,"Fall, Spring, Summer",https://catalog.iastate.edu/azcourses/pol_s/
POLS,4010,Political Analysis and Research,3.,Lecture 3.,,,,Sophomore classification,Scope and methods of political science. Introduction to theoretical approaches and analytical reasoning in political science. Relationship of theory and data. Research design.,Fall,https://catalog.iastate.edu/azcourses/pol_s/
POLS,4040,Proseminar in International Politics,3.,Lecture 3.,,,,,"Overview of major theoretical and empirical works in the study of international politics and foreign policy. Realism, liberalism, and constructivism; conflict, alliances, and international economic relations.","Fall, Spring, Summer",https://catalog.iastate.edu/azcourses/pol_s/
POLS,4050,Proseminar in Comparative Politics,3.,Lecture 3.,,,,,"Foundations of comparative politics, the study of different political regimes. Political behavior, development, causes and consequences of democracy and authoritarianism. Contrasting research methods and designs.","Fall, Spring, Summer",https://catalog.iastate.edu/azcourses/pol_s/
POLS,4070,Proseminar in Public Policy,3.,Lecture 3.,,,,Sophomore classification,"An overview of the major theoretical approaches and empirical methods relevant to the study of public policy. Emphasis is placed on agenda setting, policy formation, policy sustainability, and policy analysis. Seminal writings by leading scholars will be reviewed. Leading quantitative and qualitative methodological tools for analyzing policy are presented. Offered even-numbered years.",Fall,https://catalog.iastate.edu/azcourses/pol_s/
POLS,4080,Proseminar in Policy Implementation,3.,Lecture 3.,,,,Sophomore classification,"The implementation phase of the policy process, primarily within government. Examination of specific programs, rules, or pieces of legislation within a larger policy area, such as health, environment, transportation, education, welfare, or foreign policy. Offered even-numbered years.",Fall,https://catalog.iastate.edu/azcourses/pol_s/
POLS,4090,Political Game Theory,3.,Lecture 3.,,,,Sophomore classification,"Application of economics to political science in the study of nonmarket decision-making. Behavior of bureaucrats, elected officials, and voters. Market failure, collective action, representative democracies, direct democracies, logrolling, voter paradoxes, and game theory.","Fall, Spring, Summer",https://catalog.iastate.edu/azcourses/pol_s/
POLS,4100,State Government and Politics,3.,Lecture 3.,,,,,"Comparative analysis of state political systems. Role of interest groups, political parties, legislatures, courts, and governors in state politics. Possible determinants of public policy outputs at the state level.","Fall, Spring, Summer",https://catalog.iastate.edu/azcourses/pol_s/
POLS,4170,Campaign Rhetoric,3.,Lecture 3.,,,,SPCM 2120,Backgrounds of candidates for state and national elections; selected speeches and issues; persuasive strategies and techniques of individual speakers. Offered even-numbered years.,Fall,https://catalog.iastate.edu/azcourses/pol_s/
POLS,4190,The Judiciary,3.,Lecture 3.,,,,Sophomore classification,"Judicial review, federal common law, judicial confirmation, strict construction of the Constitution, and qualifications to serving on Courts; judicial activism and the infusion of politics into courts.",,https://catalog.iastate.edu/azcourses/pol_s/
