subject_code,course_number,title_name,credits,contact_hours,cross_listed,dual_listed,repeatable,prerequisites,description,typically_offered,source_url
PSYCH,5920C,Seminar in Psychology: Developmental,1-3.,Lecture 3.,,,True,Graduate classification and Permission of Instructor,,"Fall, Spring",https://catalog.iastate.edu/azcourses/psych/
PSYCH,5920P,Seminar in Psychology: Research Methods and Psychometrics,1-3.,Lecture 3.,,,True,Graduate classification and Permission of Instructor,,,https://catalog.iastate.edu/azcourses/psych/
PSYCH,5920Z,Seminar in Psychology: General,1-3.,Lecture 3.,,,True,Graduate classification and Permission of Instructor,,,https://catalog.iastate.edu/azcourses/psych/
PSYCH,5940A,Quantitative Behavioral Methods: Classical Psychometric Theory,1.,Lecture 1.,,,,PSYCH 5010,,"Fall, Spring",https://catalog.iastate.edu/azcourses/psych/
PSYCH,5940B,Quantitative Behavioral Methods: Modern Psychometric Methods,1.,Lecture 1.,,,,PSYCH 5010,,"Fall, Spring",https://catalog.iastate.edu/azcourses/psych/
PSYCH,5940C,Quantitative Behavioral Methods: Construct Validation,1.,Lecture 1.,,,,PSYCH 5010,,"Fall, Spring",https://catalog.iastate.edu/azcourses/psych/
PSYCH,5940D,Quantitative Behavioral Methods: Multi-Dimensional Scaling,1.,Lecture 1.,,,,PSYCH 5010,,"Fall, Spring",https://catalog.iastate.edu/azcourses/psych/
PSYCH,5940E,Quantitative Behavioral Methods: Cluster Analysis,1.,Lecture 1.,,,,Graduate Standing or Permission of Instructor,,"Fall, Spring",https://catalog.iastate.edu/azcourses/psych/
PSYCH,5940F,Quantitative Behavioral Methods: Meta-analysis,1.,Lecture 1.,,,,Graduate Standing or Permission of Instructor,,"Fall, Spring",https://catalog.iastate.edu/azcourses/psych/
PSYCH,5940G,Quantitative Behavioral Methods: Longitudinal Analysis,1.,Lecture 1.,,,,PSYCH 5010,,"Fall, Spring",https://catalog.iastate.edu/azcourses/psych/
PSYCH,5940I,Quantitative Behavioral Methods: Focus Groups,1.,Lecture 1.,,,,Graduate Standing or Permission of Instructor,,"Fall, Spring",https://catalog.iastate.edu/azcourses/psych/
PSYCH,5940K,Quantitative Behavioral Methods: Mediation and Moderation,1.,Lecture 1.,,,,Graduate Standing or Permission of Instructor,Specialized quantitative methods for social and behavioral research problems.,"Fall, Spring",https://catalog.iastate.edu/azcourses/psych/
PSYCH,5940L,Quantitative Behavioral Methods: Missing Data,1.,Lecture 1.,,,,Graduate Standing or Permission of Instructor,Specialized quantitative methods for social and behavioral research problems.,"Fall, Spring",https://catalog.iastate.edu/azcourses/psych/
PSYCH,5940M,Quantitative Behavioral Methods: Power Analysis,1.,Lecture 1.,,,,Graduate Standing or Permission of Instructor,Specialized quantitative methods for social and behavioral research problems.,"Fall, Spring",https://catalog.iastate.edu/azcourses/psych/
PSYCH,5940N,Quantitative Behavior Methods: Generalized Linear Models,1.,Lecture 1.,,,,Graduate Standing or Permission of Instructor,Specialized quantitative methods for social and behavioral research problems.,Spring,https://catalog.iastate.edu/azcourses/psych/
PSYCH,5940P,Quantitative Behavioral Methods: Systematic Review,1.,Lecture 1.,,,,Graduate Standing or Permission of Instructor,Specialized quantitative methods for social and behavioral research problems.,,https://catalog.iastate.edu/azcourses/psych/
PSYCH,5940R,Quantitative Behavioral Methods: Practical Data Analysis,1.,Lecture 1.,,,,Graduate Standing or Permission of Instructor,Specialized quantitative methods for social and behavioral research problems.,Spring,https://catalog.iastate.edu/azcourses/psych/
PSYCH,5950A,Seminar in Social Psychology: Social Cognition,1-3.,Lecture 3.,,,True,PSYCH 5800 ; Graduate classification,,"Fall, Spring",https://catalog.iastate.edu/azcourses/psych/
PSYCH,5950B,Seminar in Social Psychology: Aggression,1-3.,Lecture 3.,,,True,PSYCH 5800 ; Graduate classification,,"Fall, Spring",https://catalog.iastate.edu/azcourses/psych/
PSYCH,5950C,Seminar in Social Psychology: Culture,1-3.,Lecture 3.,,,True,PSYCH 5800 ; Graduate classification,,"Fall, Spring",https://catalog.iastate.edu/azcourses/psych/
PSYCH,5950D,Seminar in Social Psychology: Attitudes and Attitude Change,1-3.,Lecture 3.,,,True,PSYCH 5800 ; Graduate classification,,"Fall, Spring",https://catalog.iastate.edu/azcourses/psych/
PSYCH,5950E,Seminar in Social Psychology: Psychology and Law,1-3.,Lecture 3.,,,True,PSYCH 5800 ; Graduate classification,,"Fall, Spring",https://catalog.iastate.edu/azcourses/psych/
PSYCH,5950F,Seminar in Social Psychology: Health Psychology,1-3.,Lecture 3.,,,True,PSYCH 5800 ; Graduate classification,,Spring,https://catalog.iastate.edu/azcourses/psych/
PSYCH,5950G,Seminar in Social Psychology: Close Relationships,1-3.,Lecture 3.,,,True,PSYCH 5800 ; Graduate classification,,"Fall, Spring",https://catalog.iastate.edu/azcourses/psych/
PSYCH,5950I,Seminar in Social Psychology: General,1-3.,Lecture 3.,,,True,PSYCH 5800 ; Graduate classification,,"Fall, Spring",https://catalog.iastate.edu/azcourses/psych/
PSYCH,5950J,Seminar in Social Psychology: Industrial Organizational Psychology,1-3.,Lecture 3.,,,True,PSYCH 5800 ; Graduate classification,,Fall,https://catalog.iastate.edu/azcourses/psych/
PSYCH,5950K,Seminar in Social Psychology: Media Psychology,1-3.,Lecture 3.,,,True,PSYCH 5800 ; Graduate classification,,Spring,https://catalog.iastate.edu/azcourses/psych/
PSYCH,5950L,Seminar in Social Psychology: Self and Identity,1-3.,Lecture 3.,,,True,Graduate Standing or Permission of Instructor,,,https://catalog.iastate.edu/azcourses/psych/
PSYCH,5960A,Seminar in Counseling Psychology: Supervision,1-30.,Lecture 30.,,,True,Psychology Graduate Student,,"Fall, Spring",https://catalog.iastate.edu/azcourses/psych/
PSYCH,5960B,Seminar in Counseling Psychology: Research,1-30.,Lecture 30.,,,True,Psychology Graduate Student,,"Fall, Spring",https://catalog.iastate.edu/azcourses/psych/
PSYCH,5960C,Seminar in Counseling Psychology: Multicultural,1-30.,Lecture 30.,,,True,Psychology Graduate Student,,"Fall, Spring",https://catalog.iastate.edu/azcourses/psych/
PSYCH,5960D,Seminar in Counseling Psychology: Professional Issues and Ethics,1-30.,Lecture 30.,,,True,Psychology Graduate Student,,"Fall, Spring",https://catalog.iastate.edu/azcourses/psych/
PSYCH,5960E,Seminar in Counseling Psychology: General,1-30.,Lecture 30.,,,True,Psychology Graduate Student,,"Fall, Spring",https://catalog.iastate.edu/azcourses/psych/
PSYCH,5980A,Seminar in Cognitive Psychology: Attention and Perception,1-30.,Lecture 30.,,,True,PSYCH 5160 ; graduate classification,,"Fall, Spring",https://catalog.iastate.edu/azcourses/psych/
PSYCH,5980B,Seminar in Cognitive Psychology: Memory,1-30.,Lecture 30.,,,True,PSYCH 5160 ; graduate classification,,"Fall, Spring",https://catalog.iastate.edu/azcourses/psych/
PSYCH,5980C,Seminar in Cognitive Psychology: Cognitive Neuroscience,1-30.,Lecture 30.,,,True,PSYCH 5160 ; graduate classification,,"Fall, Spring",https://catalog.iastate.edu/azcourses/psych/
PSYCH,5980D,Seminar in Cognitive Psychology: Judgment and Decision Making,1-30.,Lecture 30.,,,True,PSYCH 5160 ; graduate classification,,"Fall, Spring",https://catalog.iastate.edu/azcourses/psych/
PSYCH,5980E,Seminar in Cognitive Psychology: Evolution,1-30.,Lecture 30.,,,True,PSYCH 5160 ; graduate classification,,"Fall, Spring",https://catalog.iastate.edu/azcourses/psych/
PSYCH,5980F,Seminar in Cognitive Psychology: Language,1-30.,Lecture 30.,,,True,PSYCH 5160 ; graduate classification,,"Fall, Spring",https://catalog.iastate.edu/azcourses/psych/
PSYCH,5980G,Seminar in Cognitive Psychology: Applied,1-30.,Lecture 30.,,,True,PSYCH 5160 ; graduate classification,,"Fall, Spring",https://catalog.iastate.edu/azcourses/psych/
PSYCH,5980I,Seminar in Cognitive Psychology: General,1-30.,Lecture 30.,,,True,PSYCH 5160 ; graduate classification,,"Fall, Spring",https://catalog.iastate.edu/azcourses/psych/
PSYCH,5990,Creative Component,1-30.,,,,True,Graduate classification and Permission of Instructor,Offered on a satisfactory-fail basis only.,,https://catalog.iastate.edu/azcourses/psych/
PSYCH,6050,Multi-level Modeling,3.,Lecture 3.,,,,,"Rationale for and interpretation of random coefficient models. Strategies for the analysis of multi-level and panel data including models for random intercepts, random slopes, and growth curves. Offered odd-numbered years.",Spring,https://catalog.iastate.edu/azcourses/psych/
PSYCH,6210,Psychological Counseling -Theory and Process,3.,Lecture 3.,,,,Psychology graduate student; instructor permission,"Overview of major counseling theories with emphases upon: key concepts of theories, the role of the counselor, and applications of theory in fostering client change.",Fall,https://catalog.iastate.edu/azcourses/psych/
PSYCH,6210L,Psychological Counseling -Theory and Process: Techniques in Counseling,3.,Laboratory 6.,,,,Psychology graduate student; instructor permission,"Development of basic counseling skills and techniques through observation, role-playing, case studies, and supervised counseling sessions.",Fall,https://catalog.iastate.edu/azcourses/psych/
PSYCH,6230,Vocational Behavior,3.,Lecture 3.,,,,Psychology Graduate Student,"Theoretical views, research, and issues in career development through the life span. Methods of career counseling, including appraisal interviewing, assessment, test interpretation, and use of information sources.",,https://catalog.iastate.edu/azcourses/psych/
PSYCH,6260,Group Counseling,3.,Lecture 4.,,,,Psychology Graduate Student,"Theory, research, ethical issues, and therapeutic considerations relevant to group counseling. Participation in lab exercises for development of group counseling skills and observation of ongoing groups.",,https://catalog.iastate.edu/azcourses/psych/
PSYCH,6330,Teaching of Psychology,3.,Lecture 3.,,,,Psychology Graduate Student,"Orientation to teaching of psychology at college level: academic issues and problems, instructional and evaluative techniques.",Spring,https://catalog.iastate.edu/azcourses/psych/
PSYCH,6610,Adult Psychopathology,3.,Lecture 3.,,,,Graduate classification,"Examination of DSM and research based perspectives pertinent to the major forms of adult psychopathology including: anxiety, mood, psychotic, personality and other disorders. Coverage of research examining causes, development, and clinical issues concerning adult psychopathology.",,https://catalog.iastate.edu/azcourses/psych/
PSYCH,6910A,Practicum in Psychology: Counseling (Beginning),1-30.,,,,True,PSYCH 6210L ; Psychology graduate student,,"Fall, Spring",https://catalog.iastate.edu/azcourses/psych/
PSYCH,6910B,Practicum in Psychology: Counseling (Intermediate),1-30.,,,,True,PSYCH 6910A; Psychology graduate student,,"Fall, Spring",https://catalog.iastate.edu/azcourses/psych/
PSYCH,6910C,Practicum in Psychology: Counseling (Advanced),1-30.,,,,True,PSYCH 6910B; Psychology graduate student,,"Fall, Spring",https://catalog.iastate.edu/azcourses/psych/
PSYCH,6910D,Practicum in Psychology: Counseling (Advanced External Practicum),1-30.,,,,True,PSYCH 6910C ; Psychology graduate student,,"Fall, Spring",https://catalog.iastate.edu/azcourses/psych/
PSYCH,6910G,Practicum in Psychology: Group Counseling,1-30.,,,,True,PSYCH 6260; Psychology graduate student,,"Fall, Spring",https://catalog.iastate.edu/azcourses/psych/
PSYCH,6910S,Practicum in Psychology: Supervision,1-30.,,,,True,,,"Fall, Spring",https://catalog.iastate.edu/azcourses/psych/
PSYCH,6910T,Practicum in Psychology: Teaching,1-30.,,,,True,Psychology graduate student; instructor permission,Offered on a satisfactory-fail basis only.,"Fall, Spring",https://catalog.iastate.edu/azcourses/psych/
PSYCH,6910Z,Practicum in Psychology: General,1-30.,,,,True,Psychology graduate student; instructor permission,,"Fall, Spring",https://catalog.iastate.edu/azcourses/psych/
PSYCH,6920A,Research Seminar: Counseling,1-3.,Lecture 3.,,,True,Psychology Graduate Student,,,https://catalog.iastate.edu/azcourses/psych/
PSYCH,6920Q,Research Seminar: Cognitive,1-3.,Lecture 3.,,,True,Psychology Graduate Student,,,https://catalog.iastate.edu/azcourses/psych/
PSYCH,6920R,Research Seminar: Social,1-3.,Lecture 3.,,,True,Psychology Graduate Student,,,https://catalog.iastate.edu/azcourses/psych/
PSYCH,6920Z,Research Seminar: General,1-3.,Lecture 3.,,,True,Psychology Graduate Student,,,https://catalog.iastate.edu/azcourses/psych/
PSYCH,6970,Internship in Counseling Psychology,Required.,,,,,Psychology graduate student; instructor permission,Full time supervised predoctoral internship experience in a setting relevant to counseling psychology.,"Fall, Spring, Summer",https://catalog.iastate.edu/azcourses/psych/
PSYCH,6990,Research,1-30.,,,,True,Graduate classification and Permission of Instructor,Offered on a satisfactory-fail basis only.,,https://catalog.iastate.edu/azcourses/psych/
