subject_code,course_number,title_name,credits,contact_hours,cross_listed,dual_listed,repeatable,prerequisites,description,typically_offered,source_url
PSYCH,1010,Introduction to Psychology,3.,"Lecture 2, Discussion 1.",,,,,Fundamental psychological concepts derived from the application of the scientific method to the study of behavior and mental processes. Applications of psychology.,"Fall, Spring, Summer",https://catalog.iastate.edu/azcourses/psych/
PSYCH,1020,Laboratory in Introductory Psychology,1.,Laboratory 2.,,,,Credit or concurrent enrollment in PSYCH 1010,Laboratory to accompany 1010.,"Fall, Spring",https://catalog.iastate.edu/azcourses/psych/
PSYCH,1110,Orientation to Psychology,1.,Lecture 1.,,,,,Program requirements and degree/career options. Required of psychology majors.,"Fall, Spring",https://catalog.iastate.edu/azcourses/psych/
PSYCH,1120,Psychology Learning Community Seminar,1.,Lecture 1.,,,True,,"Topics include orientation to academic program requirements, career awareness, strategies for successful transition to college, connections with other disciplines, and applying psychology via service learning opportunities.","Fall, Spring",https://catalog.iastate.edu/azcourses/psych/
PSYCH,1310,Academic Learning Skills,1.,Lecture 1.,,,,,"Evidence-based approach to learning and applying academic skills such as time management, note-taking, reading, test preparation, goal setting and motivation, and well-being. Hybrid course structured in a team-based learning format.","Fall, Spring",https://catalog.iastate.edu/azcourses/psych/
PSYCH,2110,Career Opportunities in Psychology,1.,Lecture 1.,,,,PSYCH 1110 or PSYCH 1120 or Sophomore classification,"Introduction to career options for psychology majors. Development of foundational career preparation topics like resume writing, interviewing, and other career-related topics. Thorough introduction to the sub-fields of psychology. Guidance on applying to graduate school or seeking a job with a bachelor's degree.","Fall, Spring",https://catalog.iastate.edu/azcourses/psych/
PSYCH,2210X,Clinical Psychology,3.,Lecture 3.,,,True,PSYCH 1010,"Overview of the field of clinical psychology. Readings, small group work, class discussion, lectures, and videos to describe the field of clinical psychology.",,https://catalog.iastate.edu/azcourses/psych/
PSYCH,2300,Developmental Psychology,3.,Lecture 3.,,,,,"Life-span development of physical traits, cognition, intelligence, language, social and emotional behavior, personality, and adjustment.","Fall, Spring, Summer",https://catalog.iastate.edu/azcourses/psych/
PSYCH,2400X,Psychology and the Good Life,3.,Lecture 3.,,,,,"This course aims to acquaint students with basic research and theory on positive psychology and increase skills related to life adjustment and self-care through assignments, reflection, and class discussion.","Fall, Spring, Summer",https://catalog.iastate.edu/azcourses/psych/
PSYCH,2500,Psychology of the Workplace,3.,Lecture 3.,,,,,"Survey of theories and research methods of psychology applied to the workplace. Consideration of employee selection, training, performance evaluation, leadership, work groups, employee motivation, job attitudes and behaviors, organizational culture, organizational development, human factors, and job design from the scientist-practitioner approach.",,https://catalog.iastate.edu/azcourses/psych/
PSYCH,2600X,Psychology of Immigration,3.,Lecture 3.,,,,,"Understanding U.S. immigrants’ psychological experiences and challenges, with a focus on psychological theories and research in social, cultural, developmental, and counseling psychology. Topics include (1) individual development, including identity changes and language development, (2) causes, forms, and experiences of prejudice and discrimination, (3) contextual social influences and life span consideration, (4) experiences in education, workplace, and clinical context, and (5) strategies for promoting acceptance of diversity.","Fall, Spring, Summer",https://catalog.iastate.edu/azcourses/psych/
PSYCH,2800,Social Psychology,3.,Lecture 3.,,,,,"Individual human behavior in social contexts. Emphasis on social judgments and decisions, attitudes, perceptions of others, social influence, aggression, stereotypes, and helping.","Fall, Spring, Summer",https://catalog.iastate.edu/azcourses/psych/
PSYCH,2910,Introductory Research Experience,1-4.,,,,True,PSYCH 1010; Sophomore classification; Permission of Instructor,Beginning level supervised research experience in a faculty laboratory. Offered on a satisfactory-fail basis only.,"Fall, Spring",https://catalog.iastate.edu/azcourses/psych/
PSYCH,3010,Research Design and Methodology,3.,Lecture 3.,,,,( STAT 1010 or STAT 1040 or STAT 2260 ); 1 PSYCH course,Overview of the principal research techniques used in psychology with an emphasis on the statistical analysis of psychological data.,"Fall, Spring, Summer",https://catalog.iastate.edu/azcourses/psych/
PSYCH,3020,Research Methods in Psychology,3.,,,,,PSYCH 3010 and ENGL 2500,"Discussion of and experience in designing research studies, collecting and analyzing data, and preparing research reports in psychology.","Fall, Spring",https://catalog.iastate.edu/azcourses/psych/
PSYCH,3070X,Political Psychology,3.,Lecture 3.,,,,,"Psychological influences on political behavior. Political preferences, personality, cognitive biases, political violence, and partisan identities. Psychological explanations of contemporary political events.",Fall,https://catalog.iastate.edu/azcourses/psych/
PSYCH,3100,Brain and Behavior,3.,Lecture 3.,,,,PSYCH 1010,"Survey of basic concepts in the neurosciences with emphasis on brain mechanisms mediating sensory processes, arousal, motivation, learning, and abnormal behavior.","Fall, Spring",https://catalog.iastate.edu/azcourses/psych/
PSYCH,3120,Sensation and Perception,3.,Lecture 3.,,,,PSYCH 1010,"Survey of the physiology and psychology of human sensory systems including vision, audition, smell, taste, the skin senses, and the vestibular senses.","Fall, Spring",https://catalog.iastate.edu/azcourses/psych/
PSYCH,3130,Learning and Memory,3.,Lecture 3.,,,,PSYCH 1010,Survey of fundamental concepts and theories related to learning and memory derived from human and animal research.,"Fall, Spring",https://catalog.iastate.edu/azcourses/psych/
PSYCH,3140,Motivation,3.,Lecture 3.,,,,PSYCH 1010,"Theory and research on motivation at biological, environmental, and psychological levels. Topics include emotion, eating, sex, music, addictions, incentives, goal performance, personality, coping, self-determination and purpose.","Fall, Spring",https://catalog.iastate.edu/azcourses/psych/
PSYCH,3150,Drugs and Behavior,3.,Lecture 3.,,,,PSYCH 1010,"Biologically based examination of the effects of drugs on behavior and social interactions, including recreational drugs and drugs used in the treatment of psychiatric and neurological disorders.","Fall, Spring",https://catalog.iastate.edu/azcourses/psych/
PSYCH,3160,Cognitive Psychology,3.,Lecture 3.,,,,PSYCH 1010,"Overview of human cognition, including sensation and perception, attention, memory, language, and judgment and decision making.","Fall, Spring",https://catalog.iastate.edu/azcourses/psych/
PSYCH,3180,Judgment and Decision Making,3.,Lecture 3.,,,,PSYCH 1010; (STAT 1010 or STAT 1040 or STAT 2260 or Permission of Instructor),"Understanding human reasoning and decision making, including evaluating evidence, judging probabilities, emotional influences, and social dilemmas, with emphasis on the mechanisms that underlie decision making.","Fall, Spring",https://catalog.iastate.edu/azcourses/psych/
PSYCH,3200,Sleep and Dreams,3.,Lecture 3.,,,,PSYCH 1010,"Scientific study of sleep and dreams including basic biological and psychological aspects of sleep-wake cycles, the nature and function of dreams, and the role of sleep in human behavior, performance, and well-being. Sleep problems and their social consequences.",Spring,https://catalog.iastate.edu/azcourses/psych/
PSYCH,3270,Persuasion and Social Influence,3.,Lecture 3.,,,,,"Examination of theories and research in persuasive communication, including attitudes and social influence. Emphasis on persuasive communication strategies in everyday social settings that influence changes in attitudes and actions.","Fall, Spring, Summer",https://catalog.iastate.edu/azcourses/psych/
PSYCH,3300,Forensic Psychology,3.,Lecture 3.,,,,PSYCH 1010,The science and practice of forensic psychology: the application of psychology to inform legal decisions when some question related to psychology is involved. Focuses especially on the ways in which psychologists do clinical work (assessment and treatment) to help courts make informed decisions about cases.,"Fall, Spring, Summer",https://catalog.iastate.edu/azcourses/psych/
PSYCH,3330,Educational Psychology,3.,Lecture 3.,,,,PSYCH 2300 or HDFS 1020,"Psychological theories relevant to student development, learning, and motivation. Review of assessment principles and practices. Implications of theory for teaching children and for assessing learning in K-12 educational settings, with an emphasis on grades 5 - 12.","Fall, Spring",https://catalog.iastate.edu/azcourses/psych/
PSYCH,3350,Child and Adolescent Psychopathology,3.,Lecture 3.,,,,PSYCH 1010; HDFS 1020 or PSYCH 2300,"Psychopathology of children and adolescents,including childhood depression and anxiety disorders. Consideration of multiple probable causes and corresponding therapies.","Fall, Spring",https://catalog.iastate.edu/azcourses/psych/
PSYCH,3460,Psychology of Women,3.,Lecture 3.,,,,PSYCH 1010; 1 additional PSYCH course,"Survey of theory and research related to major biological, interpersonal, and cultural issues affecting girls' and women's psychological development and behavior. Meets U.S. Cultures and Communities Requirement.",Spring,https://catalog.iastate.edu/azcourses/psych/
PSYCH,3470,U.S. Latino/a Psychology,3.,Lecture 3.,,,,PSYCH 1010; 1 additional PSYCH course,"Historical, political, and social contexts of psychological and mental health constructs in terms of their validity and utility for use with Latino/a people in the U.S. Unique aspects of psychological functioning particular to Latino/a people in the U.S. Meets U.S. Cultures and Communities Requirement.",Spring,https://catalog.iastate.edu/azcourses/psych/
PSYCH,3480,Psychology of Religion,3.,Lecture 3.,,,,9 credits in PSYCH,"Survey of psychological theory and research investigating religious and spiritual attitudes, beliefs and practices.",,https://catalog.iastate.edu/azcourses/psych/
PSYCH,3490X,Psychology of Sexual Orientation,3.,Lecture 3.,,,True,PSYCH 1010 ; 3 additional credits in PSYCH,"Development of major human sexual orientation identities (e.g., bisexual, gay, heterosexual, and lesbian) from a research perspective. How persons navigate life contexts (e.g., family, work, relationships) in connection with their sexual identity. Factors that enhance positive sexual orientation identity development.",Spring,https://catalog.iastate.edu/azcourses/psych/
PSYCH,3500,Human Factors in Technology,3.,Lecture 3.,,,,PSYCH 1010 ; junior classification,"Understanding human behavior and cognition in the context of modern technologies. Focus on emergent interactive technologies, human computer interaction, user centered design, usability analysis, and usability testing.",Fall,https://catalog.iastate.edu/azcourses/psych/
PSYCH,3600,Personality Psychology,3.,Lecture 3.,,,,PSYCH 1010,Historical and contemporary theory and research on development and expression of personality with a focus on normal functioning.,"Fall, Spring, Summer",https://catalog.iastate.edu/azcourses/psych/
PSYCH,3800,Social Cognition,3.,Lecture 3.,,,,PSYCH 1010 or PSYCH 2800,"How people understand themselves and others, including attitude formation and change, attribution, impression formation, social categories and schemas, the self, stereotypes, and prejudice.",Spring,https://catalog.iastate.edu/azcourses/psych/
PSYCH,3830,Psychology and Law,3.,Lecture 3.,,,,PSYCH 1010 or PSYCH 2800,"Survey of topics in the interface between psychology and the legal system including but not limited to Miranda warning, confessions, police interrogation, lie detection, juries, eyewitness identification, false memories, and the death penalty.","Fall, Spring",https://catalog.iastate.edu/azcourses/psych/
PSYCH,3860,Media Psychology,3.,Lecture 3.,,,,PSYCH 1010 or PSYCH 2300 or PSYCH 2800,"Theories and research on the psychological mechanisms (e.g., attitudes, perceptions, emotions, arousal) by which media influence children and adults. Topics include media violence, educational media, advertising, music, video games, media literacy, and ratings.","Fall, Spring, Summer",https://catalog.iastate.edu/azcourses/psych/
PSYCH,4050,History of Psychology,3.,Lecture 3.,,,,4 courses in PSYCH,"Origins of psychology in philosophy, physiology, medicine and religion. Development as a scientific discipline during the nineteenth and twentieth centuries. Historical overview of clinical practice and theory.",Spring,https://catalog.iastate.edu/azcourses/psych/
PSYCH,4110,Evolutionary Psychology,3.,Lecture 3.,,,,,"Examination of the application of the principles of evolutionary biology to the understanding of human behavior. Evolutionary perspectives on brain development, cognition, language, mating behavior, sex differences, altruism, artistic behavior, and criminal behavior are explored. Arguments by those critical of the evolutionary approach to psychology are also examined.",Spring,https://catalog.iastate.edu/azcourses/psych/
PSYCH,4130,Psychology of Language,3.,Lecture 3.,,,,PSYCH 1010,"Introduction to psycholinguistics. Topics may include origin of language, speech perception, language comprehension, reading, bilingualism, brain bases of language, and computational modeling of language processes.",Spring,https://catalog.iastate.edu/azcourses/psych/
PSYCH,4220,Counseling Theories and Techniques,3.,Lecture 3.,,,,3 courses in PSYCH,"Overview of the major counseling theories and techniques, with emphasis on the key concepts of each theory, the role of the counselor, therapeutic goals, and the main techniques derived from each theory.",Fall,https://catalog.iastate.edu/azcourses/psych/
PSYCH,4220L,Laboratory in Counseling Theory and Techniques,1.,Laboratory 2.,,,,3 courses in PSYCH and Credit or Concurrent Enrollment in PSYCH 4220,"Learn basic counseling skills such as active listening, reflecting feelings, empathy, confrontation, immediacy and self-disclosure. Supervised practice using basic counseling skills.",Fall,https://catalog.iastate.edu/azcourses/psych/
PSYCH,4250X,The Science of Psychotherapy,3.,Lecture 3.,,,,"PSYCH 1010 , PSYCH 4220 , and 3 additional credits in PSYCH","Review of the research underlying the process of psychotherapy, focusing on psychotherapy process, evaluation outcomes, and research methods. Will review factors that influence the process and outcome of psychotherapy.","Fall, Spring, Summer",https://catalog.iastate.edu/azcourses/psych/
PSYCH,4400,Psychological Measurement I,3.,"Lecture 2, Laboratory 2.",,,,PSYCH 3010 ; 9 additional PSYCH credits; ( STAT 1010 or STAT 1040 or STAT 2260 ),"Principles of psychological measurement, including concepts of reliability and validity; interpretation of scores; factors influencing performance; construction and use of measures of ability, achievement, and personality.","Fall, Spring, Summer",https://catalog.iastate.edu/azcourses/psych/
PSYCH,4500,Industrial Psychology,3.,Lecture 3.,,,,PSYCH 1010 ; 1 additional PSYCH course; ( STAT 1010 or STAT 1040 or STAT 2260 ),"Theory, content and methods of industrial psychology related to the effective operation of organizations. Application of psychology principles to topics including different approaches used to select employees, how to conduct performance appraisals, and how to train and keep employees safe. Work attitudes and behaviors of employees as well as relevant legal issues. Statistics including regression and correlation are used.","Fall, Spring",https://catalog.iastate.edu/azcourses/psych/
PSYCH,4600,General Psychopathology,3.,Lecture 3.,,,,PSYCH 1010 ; 2 additional PSYCH courses,"Description of major forms of psychopathology including anxiety, mood disorders, personality disorders, substance abuse, and schizophrenia. Coverage of research examining causes, development, and clinical issues concerning psychopathology.","Fall, Spring, Summer",https://catalog.iastate.edu/azcourses/psych/
PSYCH,4840,Psychology of Close Relationships,3.,Lecture 3.,,,,PSYCH 2800 ; 6 additional credits in PSYCH,"Theories and research concerning the functions, development, and deterioration of close relationships. Influence of psychological processes on friendship, romantic, marital, and family relationships. Topics include mate selection, interdependence, trust and commitment, power and dominance in relationships, sexuality, divorce, gender roles, and family interaction.","Fall, Spring",https://catalog.iastate.edu/azcourses/psych/
PSYCH,4850,Health Psychology,3.,Lecture 3.,,,,6 credits in PSYCH; Junior classification,"Application of psychological theory and research methods to issues in physical health. Psychological factors in illness prevention, health maintenance, treatment of illness, recovery from injury and illness, and adjustment to chronic illness.",Fall,https://catalog.iastate.edu/azcourses/psych/
PSYCH,4870,Human Aggression,3.,Lecture 3.,,,,"(PSYCH 2300 or PSYCH 2800); PSYCH 3010; (PSYCH 3130, PSYCH 3160, PSYCH 3180, PSYCH 3600, or PSYCH 3800)",Theory and research on development and occurrence of human aggression; implications for prevention and treatment.,Spring,https://catalog.iastate.edu/azcourses/psych/
PSYCH,4880,Cultural Psychology,3.,Lecture 3.,,,,PSYCH 2800; Junior classification,"Examination of the ways that cultural beliefs, values, and affordances shape cognitive, developmental, social and other psychological phenomena, as well as the forces that shape and change culture. Meets International Perspectives Requirement.",,https://catalog.iastate.edu/azcourses/psych/
PSYCH,4900,Independent Study,1-3.,,,,True,"6 credits in PSYCH, Junior classification and Permission of Instructor",Supervised reading in an area of psychology. Writing requirement. Graduation Restriction: No more than 9 credits of PSYCH 4900 may be counted toward a degree in psychology.,"Fall, Spring, Summer",https://catalog.iastate.edu/azcourses/psych/
PSYCH,4910,Research Practicum,1-30.,,,,True,Credit or concurrent enrollment in PSYCH 3010 ; Junior classification; Permission of Instructor,Supervised research in an area of psychology. Primarily for students intending to pursue graduate education. Graduation Restriction: No more than 9 credits of PSYCH 4910 may be counted toward a degree in psychology.,"Fall, Spring, Summer",https://catalog.iastate.edu/azcourses/psych/
PSYCH,4920A,Fieldwork Practicum: Human Services,1-30.,,,,True,12 credits in PSYCH; Junior classification; Permission of Instructor,Offered on a satisfactory-fail basis only.,"Fall, Spring, Summer",https://catalog.iastate.edu/azcourses/psych/
PSYCH,4920B,Fieldwork Practicum: I/O Psychology,1-30.,,,,True,( PSYCH 2500 or PSYCH 4500 ); 9 additional PSYCH credits; Junior classification; Permission of Instructor,Offered on a satisfactory-fail basis only.,"Fall, Spring, Summer",https://catalog.iastate.edu/azcourses/psych/
PSYCH,5010,Foundations of Behavioral Research,3.,Lecture 3.,,,,Graduate classification,"Ethical issues, research design, sampling design, measurement issues, power and precision analysis, interpretation of statistical results in non-experimental, quasi-experimental, and experimental research, use of statistical packages.","Fall, Spring",https://catalog.iastate.edu/azcourses/psych/
PSYCH,5050,History of Psychology,3.,Lecture 3.,,,,Graduate Classification or Permission of Instructor,"Origins of psychology in philosophy, physiology, medicine and religion. Development as a scientific discipline during the nineteenth and twentieth centuries. Historical overview of clinical practice and theory.",Spring,https://catalog.iastate.edu/azcourses/psych/
PSYCH,5160,Advanced Cognition,3.,Lecture 3.,,,,Graduate classification,"Theoretical models and empirical research in human cognition including perception, attention, memory, concepts/categorization, imagery, and judgment and decision making.","Fall, Spring",https://catalog.iastate.edu/azcourses/psych/
PSYCH,5190,Cognitive Neuropsychology,3.,Lecture 3.,,,,Graduate classification,Psychological models and related neurological substrates underlying cognition in normal and brain-damaged individuals.,,https://catalog.iastate.edu/azcourses/psych/
PSYCH,5210,Cognitive Psychology of Human Computer Interaction,3.,Lecture 3.,,,,Graduate classification,"Biological, behavioral, perceptual, cognitive and social issues relevant to human computer interactions.",,https://catalog.iastate.edu/azcourses/psych/
PSYCH,5220,Scientific Methods in Human Computer Interaction,3.,Lecture 3.,,,,Graduate classification,"Basics of hypothesis testing, experimental design, analysis and interpretation of data, and the ethical principles of human research as they apply to research in human computer interaction. Offered odd-numbered years.",Spring,https://catalog.iastate.edu/azcourses/psych/
PSYCH,5330,Theories of Learning,3.,Lecture 3.,,,,Graduate Standing or Permission of Instructor,"Major theories of learning and cognition in educational settings. Emphasis on behavioral, cognitive, constructivist, and sociocultural theories and their implications for educational policy and practice.",Fall,https://catalog.iastate.edu/azcourses/psych/
PSYCH,5380,Developmental Disabilities,3.,Lecture 3.,,,,Graduate Standing or Permission of Instructor,"Theories, research, and current issues regarding the intersection of development and disabilities. Investigation of interventions with individuals and families (Online course offering via Distance Education). Offered odd-numbered years.",Fall,https://catalog.iastate.edu/azcourses/psych/
PSYCH,5420,Applied Psychological Measurement,3.,Lecture 3.,,,,Graduate classification,"Principles of psychological measurement, including concepts of reliability and validity; interpretation of scores; factors influencing performance; test construction and use of measures of intelligence, ability, achievement, vocational interest, and personality. Ethical and multicultural issues in measurement.",Fall,https://catalog.iastate.edu/azcourses/psych/
PSYCH,5440,Cognitive Assessment,3.,,,,,PSYCH 5420 ; graduate student in Psychology,"Principles, concepts, and methods of clinical interviewing, behavioral observation, and administration, scoring, and interpreting individual tests of cognitive function.","Fall, Spring",https://catalog.iastate.edu/azcourses/psych/
PSYCH,5440A,Behavioral Assessment,2.,"Lecture 2, Laboratory 1.",,,,Graduate Standing or Permission of Instructor,"Supervised practice in designing and implementing observational systems and in administering, scoring, interpreting, and reporting individual tests.",,https://catalog.iastate.edu/azcourses/psych/
PSYCH,5440B,Individual Tests: Children,2.,"Lecture 2, Laboratory 1.",,,,Graduate Standing or Permission of Instructor,"Supervised practice in designing and implementing observational systems and in administering, scoring, interpreting, and reporting individual tests.",,https://catalog.iastate.edu/azcourses/psych/
PSYCH,5440C,Testing: Adult Ages,2.,,,,,Graduate Standing or Permission of Instructor,"Supervised practice in designing and implementing observational systems and in administering, scoring, interpreting, and reporting individual tests.",,https://catalog.iastate.edu/azcourses/psych/
PSYCH,5600,Advanced Personality Psychology,3.,Lecture 3.,,,,Graduate classification,"Advanced analysis of contemporary theory and research on personality measurement, development, heritability, and social expression.",,https://catalog.iastate.edu/azcourses/psych/
PSYCH,5620,Personality Assessment,3.,Lecture 3.,,,,PSYCH 5420 ; graduate student in Psychology,"Principles, concepts, and methods of personality assessment. Though not a practicum course, exposure is given to a variety of objective, projective, and situational tests.",,https://catalog.iastate.edu/azcourses/psych/
PSYCH,5800,Advanced Social Psychology: Psychological Perspectives,3.,Lecture 3.,,,,Enrollment in Graduate Psychology Program,"Current theories, methods, and research in social psychology with an emphasis on cognitive and interpersonal processes such as attribution, social cognition, attitude change, attraction, aggression, and social comparison.",,https://catalog.iastate.edu/azcourses/psych/
PSYCH,5890,"Systems Neuroscience: Brain, Behavior, and Nutrition-Related Integrative Physiology",2.,Lecture 2.,,,,Graduate Standing or Qualified Undergraduate with Permission of Instructor,"Structural, functional, and biochemical aspects of brain and non-motor behavior across the human lifespan. Types of neuroimaging used to assess the brain. Current research is leveraged to gauge how nutrition, diseases related to nutrition, and associated physiological processes influence the brain, particularly for common developmental, psychological, and neurological disorders.",Spring,https://catalog.iastate.edu/azcourses/psych/
PSYCH,5900A,Special Topics: Counseling,1-30.,,,,True,Graduate classification and Permission of Instructor,,,https://catalog.iastate.edu/azcourses/psych/
PSYCH,5900Q,Special Topics: Cognitive,1-30.,,,,True,Graduate classification and Permission of Instructor,,,https://catalog.iastate.edu/azcourses/psych/
PSYCH,5900R,Special Topics: Social,1-30.,,,,True,Graduate classification and Permission of Instructor,,,https://catalog.iastate.edu/azcourses/psych/
PSYCH,5900Z,Special Topics: General,1-30.,,,,True,Graduate classification and Permission of Instructor,,,https://catalog.iastate.edu/azcourses/psych/
